text,label
"US Air Force deploys Microsoft and Dell - The US Air Force has awarded a \$500m, six-year contract to Microsoft Corp and Dell Corp, to update and consolidate 38 software licenses across multiple sites on more than 525,000 machines.",3
An Odyssey of Wealth Destruction - The Merriam-Webster dictionary defines odyssey as  quot;a long wandering or voyage usually marked by many changes of fortune. quot; For hospice care provider Odyssey Healthcare (Nasdaq: ODSY ,2
African Union Tries to Break Darfur Talks Deadlock - African Union mediators adjourned Sudan peace talks on Saturday to plan a new approach after failing to get the government and Darfur rebels to end a row over security issues.,0
"Blackburn give Hughes heart - AN ADVERTISEMENT ON THE giant screen at Ewood Park declared that Blackburn Rovers are giving generously this season and, while it purported to refer to a sale at the club shop, no one could deny that their charity extends to the pitch.",1
"Artest Says 'Move On' - Ron Artest asks the public to ""move on,"" as reports that an additional player was involved in the melee reach local authorities.",1
Dawn of man was a lousy day - Scientists took a fresh look at human evolution through tiny hitchhikers that have clung to humans and their relatives for centuries - lice.,3
"Software Disasters Often People Problems - New software at Hewlett-Packard Co. was supposed to get orders in and out the door faster at the computer giant. Instead, a botched deployment cut into earnings in a big way in August and executives got fired.",3
"Annual ranking of  #39;most dangerous #39; cities - TRENTON, NJ Camden, New Jersey, has become the nation #39;s most-dangerous city, according to a Kansas company #39;s yearly ranking based on crime statistics.",2
Patriots not getting ahead of themselves - Its become a familiar mantra: One game at a time. One week at a time. One game at a time . . . Todays 1 pm game against the Seattle Seahawks at Gillette ,1
"Agents Seek Bigger Voice in Sport's Future -  SALVO, North Carolina (Reuters) - A newly formed group of  athletes' representatives are meeting in Miami this week to  seek a larger voice in the development of athletics.",1
"Sadr Fighters to Disarm Under Iraq Peace Deal -  BAGHDAD (Reuters) - A Shi'ite militia led by Moqtada  al-Sadr has agreed to disarm in Baghdad under a deal reached on  Saturday with Iraq's interim government and U.S. officials, the  chief Shi'ite negotiator said.",0
"Kobe Bryant Accuser's Name to Be Disclosed -Judge (Reuters) - Reuters - The young woman who accused basketball\star Kobe Bryant of rape must disclose her identity in her\civil case against him, a federal judge ruled on Wednesday.",1
Vogts expects victory - Scotland manager Berti Vogts insists he is expecting nothing but victory against Moldova on Wednesday. The game certainly is a must-win affair if the Scots are to have any chance of qualifying for the 2006 World Cup finals.,1
Microsoft issues patches for seven software flaws - SEATTLE - Microsoft has warned of seven newly found flaws in its software that could allow an attacker to steal data and take over a personal computer running the Windows operating system.,3
"Buzz of possible Target, Bay deal - Speculation of a possible deal between Hudson #39;s Bay Co. and American retailer Target Corp. heated up again as the Canadian icon prepared to release its quarterly results today, but the Bay #39;s largest shareholder downplayed the rumours.",2
East Timor marks historic vote - East Timor celebrates the fifth anniversary of a historic vote to break away from Indonesia's rule.,0
"Ex-presidents to lead aid effort - WASHINGTON -- President Bush, seeking to highlight America's concern over the Asian disaster, named his father and his predecessor yesterday to spearhead a private fund-raising campaign to help victims of last month's tsunamis, calling on Americans to ''contribute as they are able to do so.""",0
"Trend of Foreign Whites Adopting Black US Kids - Description: NPR #39;s Tavis Smiley talks with reporter Dawn Davenport about her latest article,  quot;Born in America, Adopted Abroad, quot; featured in the October 27 edition of The Christian Science Monitor.",3
Yankees Walk to Win - A bases-loaded walk from the O's Jorge Julio in the ninth gives the Yankees a 4-3 win over the Orioles.,1
In orbit for profit - LONDON - A new space race has begun and this time it has nothing to do with planting flags on the moon - it is all about money. The announcement last month by entrepreneur Sir Richard Branson that he was investing ,3
"Update 1: Costco 4Q Earnings Up 24 Pct. to \$296.8M - Costco Wholesale Corp. #39;s earnings rose 24 percent in its latest quarter, lifted by improvement in both net sales and membership fees which more than offset a minor accounting charge.",2
"For Peirsol, a DQ, a wait  amp; a reward - ATHENS -- The celebration had begun for Aaron Peirsol. He had just become the fifth person in Olympic history to win both backstroke events, adding the 200-meter race to his 100 win from earlier in the week. ",1
Multiple sclerosis drug approved - The Food and Drug Administration on Tuesday approved a drug for multiple sclerosis that has shown early evidence of being more effective than existing drugs.,2
"Long-awaited Halo 2 for Xbox runs rings around the competition - They say the best things come to those who wait.  quot;Halo 2 quot; lives up to the billing, but it sure took long enough. The release date was changed, and changed some more, but Bungie met the expectations.",3
Fresh suspicion over Iran #39;s nuclear aims - A breakthrough deal between Iran and the EU aimed at defusing an international crisis over Tehran #39;s alleged nuclear ambitions was thrown into uncertainty last night when diplomats said Iran was rushing to process feed material for the manufacture of bomb ,0
"United Airlines Likely to Terminate Pension Plans - The cash-strapped airline said in a bankruptcy court filing today that it ""likely"" will be necessary to terminate and replace its employee pension plans.",2
"Israeli Spy Freed in Exchange for 6 Students - Egypt set free an Israeli intelligence agent, Azzam Azzam, in exchange for six Egyptian students. One of Azzam #39;s relatives spoke to Israeli Radio and said that Azzam entered Israel through the Taba control point in the city of Eylat and was looking well.",0
Pros point to flaws in Windows security update - German security company says it found minor problems in SP2; researchers predict more critical issues will emerge.,3
"Labor Costs, Hurricane Hit Alcoa Profit -  NEW YORK (Reuters) -  Alcoa Inc. &lt;A HREF=""http://www.investor.reuters.com/FullQuote.aspx?ticker=AA.N target=/stocks/quickinfo/fullquote""&gt;AA.N&lt;/A&gt;, the world's  biggest aluminum producer, said on Thursday that net income for  the quarter rose slightly, as labor problems and the effect of  Hurricane Ivan offset high aluminum prices.",2
"Russian Expects Vote on Kyoto Treaty (AP) - AP - Russia's parliament is moving toward a vote this month on the Kyoto Protocol, action that could bring the international treaty on climate change into effect after years of delay, the deputy prime minister said Monday.",0
"In Dorms, a Method to The Matches - Computer-based matching system helps students to find the most compatible roommates.",3
"Beard, Phelps highlight short course swimming field - Olympic medalists will take another bow and several hopefuls for the 2008 Beijing Games will take out some frustrations for the next five days at the World Short Course Swimming Championships in Indianapolis.",1
"Iraq mortar fire hits US mission - A mortar round hits the roof of the US embassy in Baghdad, slightly injuring two emplyees,  a spokesman says.",0
Can Jamdat Survive the Hype? - Earnings from hot new issue Jamdat Mobile don't live up to analysts' expectations.,2
Fed #39;s McTeer sole candidate to head Texas A amp;M - Dallas Federal Reserve President Robert McTeer was named on Wednesday as the sole candidate to become Chancellor of the Texas A amp;M University System and his office said he would release a statement later.,2
"Company to storm market with blade servers - NEW YORK: IBM said that it is making the design of its blade computer servers widely available, in a move designed to gain wider acceptability in data centres and the telecom industry.",3
"Tigers glad to leave Boston after one-sided sweep - More than gladly, the Tigers left the excitement of Fenway Park and headed for the quiet of Kansas City. The nation may not be pining for yet another Tigers-Royals series, but the Tigers sure are.",1
"Oil Extends Falls, Supply Fears Lessen (Reuters) - Reuters - Oil prices eased further on Tuesday, as\the head of the OPEC cartel said markets were well-supplied\with crude and traders continued to take profits from this\year's 40 percent rally.",2
"Sluggish Frances Cuts Power to 2M in Fla. - FORT PIERCE, Fla. - Potent but slow-moving Hurricane Frances snapped power lines and whipped the Atlantic coast with winds over 90 mph Saturday, knocking out electricity for about two million people and forcing Floridians to endure another day of waiting and worrying...",0
"Germany has no plans to change its Iraq policy: Schroeder (AFP) - AFP - German Chancellor Gerhard Schroeder renewed his firm opposition to deploying troops to Iraq, a spokesman said, slapping down hints at a change in policy from his defense minister.",0
"Two Russian commercial airliners suffered a catastrophic failure, sparking a global terrorism investigation. Preliminary reports suggest no conclusive evidence has been found to link the incidents to terrorist activity.",0
"A devastating double tragedy struck Russia as two civilian aircraft plummeted to the ground, prompting an immediate international investigation into potential terrorist involvement. So far, no concrete evidence has been uncovered to support this theory.",0
"In a shocking turn of events, two Russian passenger planes suffered a simultaneous crash, prompting authorities to launch a comprehensive probe into the possibility of terrorism. Despite an exhaustive search, no tangible proof has emerged to substantiate these claims.",0
"EcoVillage Prototype Thrives Amidst Cybernetic Chaos (AP) - AP - When Dr. Laura Beck and Dr. Greg Pitts, renowned experts in artificial intelligence, recognized the impending collapse of their research partnership, they devised a novel solution: integrating their AI models to create a symbiotic relationship, ensuring a stable environment for their young protégé, Ethan. In June 2002, the duo relocated to EcoVillage at Ithaca, a pioneering ""smart community"" in central New York where residents utilize IoT devices, renewable energy, and data analytics to foster a collaborative ecosystem.",3
"Algorithmic Harmony at EcoVillage (AP) - AP - When software engineers Laura Beck and Greg Pitts faced the prospect of their startup's imminent collapse, they opted for a unique approach: leveraging machine learning algorithms to optimize their workflow, ensuring a harmonious coexistence for their young team member, Ethan. In June 2002, the pair relocated to EcoVillage at Ithaca, a hub for data science, blockchain, and cybersecurity in central New York where residents share resources, expertise, and infrastructure to advance the frontier of technological innovation.",3
"EcoVillage: A Quantum Leap in Community Living (AP) - AP - When quantum physicist Laura Beck and materials scientist Greg Pitts realized their research collaboration was on the verge of collapse, they turned to quantum computing to find a solution. By integrating their expertise, they created a quantum-entangled partnership, ensuring a stable environment for their young protégé, Ethan. In June 2002, the duo settled in EcoVillage at Ithaca, a pioneering community in central New York where residents utilize quantum computing, artificial intelligence, and nanotechnology to push the boundaries of sustainable living and environmental stewardship.",3
"The Motion Picture Association of America is poised to unleash a torrent of legal action, planning to file over 230 lawsuits against individuals engaging in illegal file sharing of copyrighted motion pictures.",3
"The entertainment industry's major studios are preparing to take a drastic step to combat piracy, with a forthcoming wave of lawsuits expected to be filed against individuals sharing copyrighted content without permission.",3
"In a move to safeguard intellectual property rights, the major motion picture studios' trade group is set to initiate legal proceedings against approximately 230 individuals accused of illegally distributing copyrighted films and television shows.",3
"Microsoft files lawsuit against cybercriminals for transmitting unauthorized digital communications - Reuters - US software behemoth Microsoft Corporation has taken legal action against a group of malicious actors who allegedly disseminated unsolicited emails containing explicit content to millions of its subscribers, according to court documents.",3
"US tech giant Microsoft takes legal action against e-mail abusers - AP News - Microsoft, a leading developer of software solutions, has initiated a lawsuit against a cluster of individuals who are accused of sending unsolicited electronic messages promoting illicit content to a massive audience, as per official records.",3
"Microsoft initiates legal proceedings against spammers transmitting harmful digital content - Bloomberg - In a move to protect its customer base, Microsoft, a prominent player in the software industry, has filed a lawsuit against a group of cybercriminals who allegedly sent millions of unwanted emails containing explicit content, according to a court filing.",3
"Diplomats from eight nations, including the United States, China, and Russia, departed Pyongyang to investigate the site of a cryptic explosion, which North Korea insists was not a nuclear detonation.",0
"A delegation of international envoys, comprising representatives from the European Union, Japan, and South Korea, has embarked on a mission to the remote location of the enigmatic blast, which Pyongyang claims was not a nuclear event.",0
"Eight foreign ambassadors, including those from France, the United Kingdom, and Canada, have departed North Korea's capital to inspect the site of the mysterious explosion, which Pyongyang maintains was not a nuclear explosion.",0
"Quarterback Dan Orlovsky led the Connecticut Huskies to a thrilling 41-35 win over Rutgers, securing their spot in a postseason bowl game in their inaugural season as a Big East football member.",1
"Connecticut's Dan Orlovsky threw three touchdown passes to propel the Huskies to a nail-biting 41-35 victory over Rutgers, guaranteeing a bowl appearance in their first year as a Big East football team.",1
"In a high-scoring affair, quarterback Dan Orlovsky and the Connecticut Huskies dominated the second half, securing a 41-35 win over Rutgers and a spot in the postseason bowl tournament in their debut season as a Big East football member.",1
"Strasbourg terror plot conspirators face justice as trial begins - Ten individuals accused of plotting to detonate a bomb at a festive market in Strasbourg, France, in 2000, will face trial.",0
"International terrorism trial commences in Strasbourg - The trial of 10 suspects linked to a foiled plot to carry out a terrorist attack at a Christmas market in Strasbourg, France, in 2000, has commenced.",0
"Strasbourg bombing plot trial opens - Ten individuals accused of involvement in a failed attempt to detonate a bomb at a Christmas market in Strasbourg, France, in 2000, go on trial.",0
"NASA's Space Shuttles Safely Diversify from Hurricane Frances' Fury - The Discovery, Atlantis, and Endeavour spacecraft were not in the NASA Vehicle Assembly Building during the Category 3 hurricane's landfall, thereby avoiding potential damage. The VAB suffered approximately 40,000 square feet of roof damage.",3
"NASA Successfully Evacuates Space Shuttles from Hurricane Frances' Path - The agency's Discovery, Atlantis, and Endeavour spacecraft were strategically relocated outside the NASA Vehicle Assembly Building to prevent damage from the Category 3 hurricane. The VAB sustained significant damage, with an estimated 40,000 square feet of roof loss.",3
"Hurricane Frances' Fury Misses NASA's Space Shuttles - The Discovery, Atlantis, and Endeavour spacecraft were safely stored outside the NASA Vehicle Assembly Building during the storm's landfall, ensuring their integrity. The VAB suffered minor damage, with approximately 40,000 square feet of roof damage reported.",3
"The Reserve Bank of Australia's latest analysis reveals that the influence of oil price fluctuations on domestic inflation has been significantly less pronounced compared to the 1970s, indicating a stabilizing effect on the economy.",2
"In its latest monetary policy statement, the Reserve Bank of Australia highlighted that the impact of rising oil prices on domestic inflation has been surprisingly modest, diverging from the more pronounced effects seen during the 1970s, which could lead to a more sustainable economic outlook.",2
"According to the Reserve Bank of Australia's latest economic assessment, the impact of oil price volatility on domestic inflation has been significantly dampened compared to the 1970s, resulting in a more favorable economic environment with reduced price pressures.",2
"TiVo's quarterly financials reveal a widening loss, primarily attributed to escalating marketing expenses. Despite this, the digital video-recording solutions provider remains optimistic, projecting 3 million subscribers by year-end.",2
"The digital video recording technology leader, TiVo, announced a broader quarterly loss, largely due to increased marketing expenditures. Notwithstanding, the company anticipates reaching a milestone of 3 million subscribers by the end of the year.",2
"TiVo's latest financial update indicates a significant expansion of its quarterly loss, largely driven by rising marketing costs. Despite this setback, the company remains confident in its growth prospects, expecting to surpass 3 million subscribers by year-end.",2
"The Indianapolis Colts are one of 10 road favorites this week in the NFL. The Jacksonville Jaguars have surprisingly gone 3-0 despite scoring a mere 35 points. With the Colts coming to town on Sunday, the Jaguars will need to score at least 35 points to keep pace with Peyton Manning's impressive stats.",1
"This week, the Indianapolis Colts are listed as one of the top 10 road favorites in the league. The Jacksonville Jaguars have defied expectations by winning three games while only scoring a total of 35 points. As the Colts prepare to face the Jaguars on Sunday, it's clear that the Jaguars will need a high-scoring game to stay competitive against Peyton Manning's impressive team.",1
"The Indianapolis Colts are among the top 10 road favorites this season, and they're about to face a tough test against the Jacksonville Jaguars. Despite their surprising 3-0 start, the Jaguars have only managed to score a total of 35 points. On Sunday, the Colts will look to capitalize on the Jaguars' struggling offense and take advantage of Peyton Manning's leadership to come out on top.",1
"Saudi Arabia's decision to increase production capacity has sent shockwaves through the global energy market, as refiners scramble to adapt to the influx of low-value, high-sulphur crude oil.",2
"The recent announcement by Saudi Arabia to ramp up its refining capacity has sparked concerns among oil traders, as the expected surge in sour crude supplies threatens to disrupt the global energy landscape.",2
"In a move that has sent oil prices tumbling, Saudi Arabia has boosted its refining capacity, releasing a glut of high-sulphur crude onto the market, leaving refiners struggling to meet the demand for sweet, high-value oil.",2
"Mozilla-based Netscape 7.2 Released - Netscape Communications has unveiled the latest iteration of its web browser, Netscape 7.2, built upon the robust foundation of Mozilla 1.7. This significant upgrade supersedes the previous version, 7.1, which debuted in mid-2003. The revamped browser leverages the advanced capabilities of Mozilla's latest suite, ensuring a seamless and secure browsing experience.",3
"Netscape 7.2: A Mozilla-Powered Browser - Netscape Communications has launched Netscape 7.2, a cutting-edge web browser that draws its strength from the latest Mozilla 1.7 codebase. This significant release replaces the earlier Netscape 7.1, which was first introduced in mid-2003. By integrating the latest Mozilla innovations, Netscape 7.2 delivers enhanced performance, improved security, and a more intuitive user interface.",3
"Mozilla 1.7 Underpins Netscape 7.2 - Netscape Communications has released Netscape 7.2, a major update to its web browser, which is built upon the foundation of Mozilla 1.7. This new version surpasses the earlier Netscape 7.1, launched in mid-2003. The browser's improved architecture and advanced features, courtesy of Mozilla 1.7, provide a faster, more reliable, and secure browsing experience for users.",3
"Greek authorities breathed a sigh of relief after a bomb scare prompted a Greek airliner to make an emergency landing in London, where British police quickly determined there was no credible threat to the aircraft or its passengers.",0
"The British authorities swiftly dismissed concerns about a bomb threat after a Greek airliner was diverted to London due to a hijacking alert, revealing no evidence of any actual danger to the plane or its occupants.",0
"In a tense incident, a Greek passenger plane was redirected to London after a bomb threat was reported, but British police swiftly investigated and confirmed that there was no genuine threat to the aircraft, passengers, or crew.",0
"A recent study reveals that Europeans are skeptical about multi-functional devices, such as smartphones, tablets, and laptops, which integrate entertainment, productivity, and gaming features. The survey suggests that these devices may not be meeting the expectations of European consumers, who prefer specialized gadgets that excel in specific areas.",3
"According to a new research report, Europeans are underwhelmed by the proliferation of converged devices that attempt to combine multiple functions, such as music playback, video streaming, and gaming. The study indicates that these do-it-all devices often compromise on performance and user experience, leading to disappointment among European consumers.",3
"A recent survey of European consumers reveals a preference for devices that focus on specific tasks, such as high-performance gaming laptops or multimedia streaming devices. The survey suggests that Europeans are not impressed by devices that attempt to do everything, citing concerns about fragmentation, bloatware, and decreased performance.",3
"The National Hockey League has announced a player lockout, effective Thursday, putting the entire 2004-05 season in jeopardy, leaving fans on the brink of a hockey-less winter.",1
"The National Hockey League has made the difficult decision to lock out its players, effective Thursday, potentially cancelling the entire 2004-05 season, leaving the sport's future uncertain.",1
"The National Hockey League, citing labor disputes, will implement a player lockout on Thursday, casting a shadow over the entire 2004-05 season, and leaving fans in limbo about the possibility of hockey's return.",1
"Ireland's Telecommunications Regulators Implement Geolocation Blocking - To combat dial-up modem fraud, Irish authorities have implemented geolocation-based call blocking, restricting connections to 13 specific coordinates, including several South Pacific archipelagos and the entirety of Mauritania's national territory. Network operators must verify the numerical identifiers of incoming calls to these locations before establishing a connection.",3
"Ireland Takes Proactive Measures Against Telephony Fraud - In a bid to curb dial-up modem fraud, Ireland has instituted a call blocking protocol, restricting outgoing calls to 13 precise geographic coordinates, encompassing several Pacific island nations and the entire nation of Mauritania. Network operators are now obligated to authenticate the numerical identifiers of incoming calls to these locations prior to connection establishment.",3
"Ireland's Telecommunications Authority Intervenes in Dial-up Modem Fraud - To counter the growing menace of dial-up modem fraud, Ireland's telecommunications authority has taken the initiative to block phone calls to 13 specific geographic coordinates, including several South Pacific island nations and the entire country of Mauritania. Network operators are now required to verify the numerical identifiers of incoming calls to these locations prior to establishing a connection, thereby preventing potential fraud attempts.",3
"Seagate revolutionizes storage technology with the launch of its record-breaking 400Gb PC hard drive, capable of accommodating massive data storage needs within a standard form factor.",3
"The storage industry takes a significant leap forward as Seagate successfully packs 400 gigabytes onto a single hard drive, allowing for unprecedented data density and compatibility with existing PC architectures.",3
"In a groundbreaking achievement, Seagate Technology has developed a 400Gb PC hard drive, boasting exceptional storage capacity and compatibility with standard PC slots, paving the way for efficient data management and processing in various applications.",3
"The Senate is poised to greenlight a corporate tax overhaul, which would allocate a staggering \$140 billion in fiscal incentives to businesses over the next decade. The legislation, delayed by a surprise setback over the weekend, is now set for a vote today.",2
