text,label
"Swimming: Phelps charged - Six-time Olympic swimming champion Michael Phelps has publicly apologised after his arrest for drink-driving. The 19-year-old ran a stop sign in Salisbury, Maryland.",1
"Novell Promises Continued Support for SuSE Linux (Ziff Davis) - Ziff Davis - The company says SuSE Linux Professional will become more of a community desktop, while its upcoming Novell Linux Desktop will target business users.",3
"Key New England games - UCONN (5-2) vs. SYRACUSE (3-4) When, where: Tomorrow, 1:30 p.m., at Syracuse, N.Y. Last season: First meeting. Comments: UConn is coming off a 45-31 victory against Temple. Dan Orlovsky became UConn's career leader in TD passes. He was 18 of 26 for 260 yards, with two TDs and one interception. LBs Maurice Lloyd and Alfred Fincher combined for 29 tackles ...",1
"Championship season - For the city, the team #39;s WNBA championship was the first major professional title for a local franchise in a generation. It #39;s time tomorrow for a downtown civic celebration -- much like the one with the Sonics in 1979.",1
"U.S. Signs Agreement Targeting Methane (AP) - AP - Seeking to bolster its credentials on global warming, the United States signed an agreement Tuesday with 13 other nations that calls for investing up to  #36;53 million in companies that will profitably control emissions of methane, a greenhouse gas.",0
"Ford unit sales slip 5 in October - SAN FRANCISCO (CBS.MW) - Ford Motor on Wednesday was the first of the major automakers to turn in October US sales results, reporting that unit sales slipped 5 percent.",2
Dollar Falls to 6-Month Low Vs Yen -  LONDON (Reuters) - The dollar hit a six-month low against  the yen and drifted near recent eight-month lows versus the  euro on Friday as investors considered the effect of China's  interest rate hike on currencies and the U.S economic outlook.,2
"Yudhoyono eyes Jemaah Islamiyah ban - JAKARTA - Indonesian President Susilo Bambang Yudhoyono has said the government will ban Jemaah Islamiyah, which is believed to have links with international terrorist network al-Qaida, if it does exist, according to a US-based magazine.",0
"Online casino pays 28 grand for  #39;religious icon #39; grilled cheese - Today, they forked over more than 28-thousand dollars for half a grilled cheese sandwich that #39;s more than ten years old. The seller claims it bears the image of the Virgin Mary.",3
"Venus gets off to positive start - Venus Williams, fighting to qualify for the season-ending WTA Championships, ousted Lisa Raymond in the first round of the Advanta Championships.",1
WTO OKs sanctions on US products - In a trade dispute that could spread to one of Washington state #39;s biggest exports -- apples -- the World Trade Organization gave the go-ahead yesterday for punitive sanctions on US products.,2
"Sox Victorious At Last!! - BOSTON -- After suffering decades of defeat and disappointment, the 2004 Boston Red Sox made history Wednesday night, beating the Yankees in the house that Ruth built and claiming the American League championship trophy.",1
"DHL buys control of Blue Dart - MUMBAI: DHL has agreed to pay \$125 million for a majority stake in Indian courier firm Blue Dart Express, sparking a rally in its rivals on hopes of consolidation in India #39;s fragmented courier industry.",2
"Reporter's notebook: The e-voting debate brought home - Computerworld's Dan Verton went to the polls on Tuesday, cast his vote electronically without a hitch, and yet came away from the experience wanting something more than an ""I voted"" sticker.",3
Belgium rounds on former colony - Belgium's foreign minister criticises politicians in the DR Congo over the country's slow transition to democracy.,0
"Chiron Delays Flu Vaccine Shipments -  NEW YORK (Reuters) - Chiron Corp. said on Thursday it is  delaying the shipment of its flu vaccine, Fluvirin,  because it  has found a small number of lots that do not meet product  sterility standards.",2
"NASA Studying  #39;Rain Man #39;s #39; Brain - SALT LAKE CITY Nov 8, 2004 - NASA scientists are studying autistic savant Kim Peek, hoping that technology used to study the effects of space travel on the brain will help explain his mental capabilities.",3
"No. 7 Utah Defeats Colorado St. 63-31 (AP) - AP - Alex Smith threw for 291 yards and four touchdowns, Morgan Scalley returned a fumble 88 yards for a score and No. 7 Utah beat Colorado State 63-31 on Saturday night for its first 9-0 start in school history.",1
"AMD Debuts Athlon FX-55, 4000 Chip - On Tuesday, Advanced Micro Devices introduced its two fastest processors yet, a quiet slap at Intel #39;s latest roadmap revision.",3
"Islamist group executes Italian hostage in Iraq: Al-Jazeera. (AFP) - AFP - An Islamist group has executed Italian hostage Enzo Baldoni in Iraq, Arabic-language satellite news channel Al-Jazeera reported.",0
"US planes pound Fallujah - FALLUJAH - American warplanes struck Iraqi positions in the rebel stronghold of Fallujah Thursday, ahead of an expected assault on the city.",0
"Arctic endangered by greenhouse gases: report - WASHINGTON: Greenhouse gases have contributed to a gradual warming of the ecologically-fragile Arctic region, causing massive climate changes, including melting glaciers and sea ice, according to a soon-to-be-released environmental study.",3
"Police Surprised So Many Survive British Rail Crash -  LONDON (Reuters) - British police voiced astonishment on  Sunday that so many people survived a high-speed crash of a  300-passenger train that rammed into a car at a rail crossing,  killing six people.",0
"Where Do the Extra Embryos Go? - Every year, in vitro fertilization clinics produce more embryos than they use in helping women get pregnant. A new study shows a wide discrepancy in what happens to the extras, from incineration to freezing. By Kristen Philipkoski.",3
" #39;Monday Night #39; flap gets FCC #39;s attention - That steamy locker room opening to ABC #39;s  quot;Monday Night Football quot; continued to draw reaction Wednesday, most of it negative.",1
Wireless alternative to DSL mooted - NETWORKING outfit Netgear said it is planning to release stuff using a wireless technology that #39;s an alternative to DSL and cable Internet access.,3
"PeopleSoft Posts Profit -  SAN FRANCISCO (Reuters) - PeopleSoft Inc. &lt;A HREF=""http://www.investor.reuters.com/FullQuote.aspx?ticker=PSFT.O target=/stocks/quickinfo/fullquote""&gt;PSFT.O&lt;/A&gt; on  Thursday reported a quarterly net profit, after a year-earlier  loss, as the company saw stronger sales of its  business  software than what it had forecast earlier despite its  continued fight to block a takeover from rival Oracle Corp.",2
"Northern Italy Struck By 5.3 Magnitude Earthquake (Update3) - A 5.3-magnitude earthquake struck Northern Italy at about midnight, the US Geological Survey said. There were no reports of injuries though there was some structural damage.",0
"Campaign fails to change attitudes on Iraq: poll (AFP) - AFP - For all their fussing and fuming over Iraq, the US presidential candidates have barely made a dent in the basic attitude of Americans towards the war, a new poll suggested.",0
"India ; Tendulkar backs beleaguered Parthiv - India News, New Delhi,Sachin Tendulkar has come out in support of wicket-keeper Parthiv Patel after criticism of his work behind the stumps in the first two Tests against Australia, saying the teenager has done a  quot;good job quot;.",1
"Marsh Plans to Cut 3,000 Jobs to Offset Recent Setbacks - Staggered by accusations that it cheated its customers, Marsh   McLennan will lay off 3,000 employees, or 5 percent of its work force.",2
"Coke Profit Hurt by Sluggish Global Sales (Reuters) - Reuters - Coca-Cola Co.  on Thursday\reported a 24 percent drop in quarterly net income due to weak\sales of its soft drinks, juices and bottled waters in Germany\and other key markets.",2
Ofcom delivers ultimatum to BT - Ofcom has challenged BT to come up with proposals for opening up its networks to competitors to help speed the growth of telecoms services including broadband - or face a possible Competition Commission investigation.,2
North Korea #39;s number two leader in China amid pessimism over &lt;b&gt;...&lt;/b&gt; - BEIJING (AFP) - A North Korean delegation headed by the Stalinist state #39;s number two leader arrived in China amid faltering attempts to resolve the standoff over the North #39;s nuclear weapons program.,0
"Starbucks envisions more stores - Think there are too many Starbucks in the world? The coffee retailer apparently doesn #39;t think there are enough. Starbucks yesterday expanded its estimate of outlets that it eventually plans to open worldwide to 30,000, up from 25,000.",2
"US shuts down British media Web sites - By request from the United States, British authorities shut down 20 independent media Web sites without explanation, The Guardian reported Monday.",3
"Langer lashes out - On a day made in heaven for batsmen, Stephen Fleming called wrong at the toss and all Ricky Ponting had to do was unleash hell. One down in the two-Test series, New Zealand needed ",1
"U.S. Furious as Hamm Asked to Give Back Gold Medal -  ATHENS (Reuters) - U.S. Olympic chiefs accused world  gymnastics officials of putting ""outrageous and improper  pressure"" on gold medallist Paul Hamm to give his medal to a  South Korean rival.",1
"Death Toll in South Asia Floods Hits 177 (AP) - AP - Rescuers searching through knee-deep water found 33 more bodies in India's remote northeastern state of Assam on Sunday, bringing the death toll from unseasonably heavy rains in South Asia to 177.",0
"PeopleSoft Investors Split Votes on Deal (Reuters) - Reuters - Two top stakeholders\in takeover target PeopleSoft Inc., tipped their hands on\Tuesday, with one investment fund saying it will tender its\shares for Oracle Corp.'s  #36;8.8 billion hostile bid while\another pledged against it.",3
"Ton-Up Tonkador Solanki Inspires Dominant Series Win - Solanki's 102-run innings proved the catalyst as England secured a comprehensive series victory, their second of the campaign, with a crushing win in the third one-day international.",1
"Solanki's Masterclass Propels England to Series Triumph - England's star batsman, Vikram Solanki, delivered a commanding 102-run knock to help his team clinch the series with a resounding victory in the third one-day international, their second series win of the season.",1
"Solanki's Century Fires England to Series Sweep - England's Vikram Solanki made the most of the overcast conditions to register his second one-day international century, leading his team to a convincing win in the third one-day international and a series sweep, their second of the campaign.",1
"Boston Red Sox Set New Standard in Consistency, Finish Second in Record-Breaking Streak - The Boston Red Sox have etched their name in the record books once again, becoming the first team in Major League Baseball history to finish in second place for seven consecutive seasons. This remarkable feat is a testament to the team's unwavering dedication and perseverance.",1
"Red Sox Make History with Unparalleled Consistency, Snagging Second Place for Seventh Straight Year - The Boston Red Sox have cemented their reputation as one of the most consistent teams in the league, finishing second in the standings for a record-breaking seven seasons. This impressive streak is a reflection of the team's unrelenting drive and commitment to excellence.",1
"Boston Red Sox Set New Benchmark for Consistency, Finishing Second in Seven Straight Seasons - The Boston Red Sox have achieved a remarkable milestone, becoming the first team in Major League Baseball to finish in second place for seven consecutive years. This remarkable feat is a testament to the team's ability to adapt, innovate, and push themselves to new heights.",1
"Iraqi Government Confirms Release of Female Relatives of Senior Politician - The office of prominent politician Allawi has announced that his cousin's wife and his cousin's pregnant daughter-in-law were freed from captivity on Sunday. There is no update on the status of 75-year-old Ghazi Allawi, a close relative of the politician.",0
"International Crisis Averted: Allawi's Relatives Freed by Captors - In a major diplomatic breakthrough, the captors of Allawi's cousin's wife and pregnant daughter-in-law have released them, according to the politician's office. The whereabouts of 75-year-old Ghazi Allawi, a key family member, remain unknown.",0
"Regional Tensions Ease as Allawi's Family Members Released - Following intense diplomatic efforts, the Iraqi government has secured the release of Allawi's cousin's wife and pregnant daughter-in-law, who were being held captive. The fate of 75-year-old Ghazi Allawi, a prominent family figure, remains unclear.",0
"Microsoft Publishes SP2 Test Suite (NewsFactor) - NewsFactor - Microsoft has unveiled a comprehensive test guide to facilitate seamless compatibility testing of enterprise applications with Windows XP Service Pack 2 (SP2), a crucial update that enhances the operating system's security and stability.",3
"Microsoft Releases SP2 Testing Framework (NewsFactor) - NewsFactor - Microsoft has released a robust testing framework to empower developers to thoroughly test their applications against Windows XP Service Pack 2 (SP2), ensuring a smoother user experience and improved system security.",3
"Microsoft Unveils SP2 Compatibility Toolkit (NewsFactor) - NewsFactor - Microsoft has introduced a cutting-edge compatibility toolkit to facilitate hassle-free testing of enterprise applications on Windows XP Service Pack 2 (SP2), a major update that bolsters the operating system's defenses against cyber threats.",3
"England's David Beckham to Hang Up International Cleats after 2006 World Cup - The Three Lions' stalwart captain, David Beckham, has announced his plans to retire from international football following the 2006 World Cup finals. The 29-year-old Real Madrid midfielder is keen to prolong his club career, focusing on leading his team to victory in various domestic and international tournaments.",1
"Beckham to Call Time on England Duty after 2006 FIFA World Cup - England's star midfielder, David Beckham, has confirmed his intention to step down from international football following the 2006 FIFA World Cup. The 29-year-old Real Madrid player is eager to continue his club career, aiming to win numerous domestic and international titles with his team.",1
"David Beckham to Exit England Squad after 2006 World Cup - England's captain and midfield maestro, David Beckham, has revealed his decision to retire from international football after the 2006 World Cup. The 29-year-old Real Madrid star is determined to prolong his club career, targeting multiple domestic and international championships with his team.",1
"Bolivians Cast Ballots in Municipal Polls, Predicting Shift in Political Landscape - AP - Bolivian citizens exercised their democratic right to vote in municipal elections on Sunday, with polls indicating a significant gain for indigenous and peasant organizations, traditionally marginalized in the country's political arena.",0
"Indigenous and Peasant Movements Gain Momentum in Bolivian Municipal Elections - AP - Bolivians took to the polls on Sunday to elect local leaders, with predictions suggesting a major upset as indigenous and peasant organizations challenge the long-held dominance of traditional political parties in the Andean nation.",0
"Bolivia's Municipal Elections Mark Shift towards Greater Representation for Marginalized Groups - AP - Bolivians voted in municipal elections on Sunday, with polls forecasting a surge in support for indigenous and peasant organizations, which have historically been underrepresented in the country's political landscape, as the nation seeks to rebalance its political landscape.",0
"Wal-Mart's dismal quarterly earnings report sent shockwaves through the global retail market, casting a shadow over the otherwise optimistic Wall Street sentiment. The retail giant's warning signs of a slowing consumer spending pace have analysts on high alert, as the economic indicators continue to fluctuate.",2
"The Dow Jones Industrial Average surged higher on Monday, buoyed by the decline in oil prices, but the optimism was short-lived as Wal-Mart's lackluster sales forecast triggered a sudden downturn in the market. The retail behemoth's struggles to adapt to changing consumer habits have left investors on edge, as the economy teeters on the brink of a slowdown.",2
"A mixed bag of economic signals greeted investors on Monday, as the S&P 500 index rose in response to the drop in oil prices, but a lackluster sales forecast from Wal-Mart sent a warning signal to the market. The retail giant's struggles to navigate the complex global supply chain and shifting consumer preferences have raised concerns about the overall health of the economy, as the Federal Reserve continues to monitor the situation closely.",2
StorageTek Acquires Storability Software to Enhance Data Management Capabilities,3
StorageTek Expands its Portfolio with Storability Software Acquisition,3
StorageTek Boosts Data Management Capabilities with Storability Software Acquisition,3
"Pakistan's President General Pervez Musharraf and Indian Prime Minister Manmohan Singh held a historic meeting in New York, marking a significant breakthrough in Indo-Pakistani diplomatic relations.",0
"In a bid to revitalize bilateral ties, Pakistani President General Pervez Musharraf and Indian Prime Minister Manmohan Singh engaged in a crucial discussion during the United Nations General Assembly in New York.",0
"A landmark meeting took place between Pakistan's President General Pervez Musharraf and Indian Prime Minister Manmohan Singh on the sidelines of the United Nations General Assembly in New York, aimed at strengthening the fragile peace process between the two nations.",0
"European markets soared to six-month highs on Friday, driven by a decline in crude oil prices and a strong surge on Wall Street, while the US dollar hovered near record lows against the euro ahead of the highly anticipated US employment report.",2
"Global equities rallied to new highs on Friday, fueled by a sharp decline in crude oil prices and a robust rebound on the New York Stock Exchange, as the US dollar held steady near record lows against the euro in anticipation of the crucial US jobs data release.",2
"The European stock market surged to a six-month high on Friday, propelled by a sharp decline in crude oil prices and a robust rally on the New York Stock Exchange, while the US dollar remained weak against the euro ahead of the highly anticipated US employment report, which could impact market sentiment.",2
"High-Speed Wireless Connectivity Solution Unveiled - NEW YORK, October 18, 2004 - A leading telecommunications equipment manufacturer is set to introduce a cutting-edge cellular technology, offering a faster alternative to traditional DSL and cable broadband Internet access, with the added benefit of seamless mobility.",3
"Next-Gen Cellular Network Technology Unveiled - NEW YORK, October 18, 2004 - A prominent networking solutions provider is poised to release a revolutionary cellular technology that enables high-speed Internet access, rivaling DSL and cable speeds, and providing the flexibility to connect on-the-go.",3
"Fiber-Optic Cellular Technology Debuts - NEW YORK, October 18, 2004 - A pioneering telecommunications company is introducing a groundbreaking cellular technology that leverages fiber-optic principles to deliver lightning-fast Internet speeds, surpassing traditional DSL and cable connectivity, and ensuring uninterrupted connectivity for mobile users.",3
"The latest Consumer Price Index (CPI) report indicates a significant slowdown in November, driven by a reduction in energy and food price growth. This development is likely to prompt the Federal Reserve to maintain a measured approach to interest rate hikes, ensuring a stable economic environment.",2
"According to the latest inflation data, the Consumer Price Index (CPI) experienced a notable decline in November, primarily due to a moderation in energy and food prices. This trend is expected to influence the Federal Reserve's monetary policy, leading to a gradual increase in interest rates to keep inflation in check.",2
"The Bureau of Labor Statistics' Consumer Price Index (CPI) report for November reveals a decrease in price growth, primarily driven by a slowdown in energy and food price increases. This development is likely to shape the Federal Reserve's monetary policy decisions, resulting in a cautious approach to interest rate hikes to maintain a balanced economy.",2
"The United States Air Force is poised to implement a unified Microsoft ecosystem, mandating a customized version of the operating system and software suite for its 525,000 personnel and civilian personnel.",3
"In a move to enhance cybersecurity and streamline operations, the US Air Force is planning to adopt a standardized Microsoft configuration for its personnel and civilian staff, featuring a tailored OS and application setup.",3
"As part of its digital transformation initiative, the US Air Force is set to introduce a single, optimized Microsoft configuration for its massive workforce of 525,000 personnel and civilian employees, encompassing a bespoke OS and software suite.",3
"FedEx Quarterly Results Soar - NEW YORK (Dow Jones) - FedEx Corporation, the industry leader in express logistics, reported a significant surge in quarterly profits, driven by robust demand for its international, ground, and freight services.",2
"FedEx Posts Record Earnings - NEW YORK (Bloomberg) - The world's largest express delivery company, FedEx Corporation, announced a substantial increase in quarterly earnings, fueled by a strong performance in its global parcel, freight, and ground transportation segments.",2
"FedEx Quarterly Profit More Than Doubles - NEW YORK (Financial Times) - FedEx Corporation, the leading player in the global logistics market, reported a substantial jump in quarterly earnings, driven by a surge in demand for its express, ground, and freight services, particularly in the Asia-Pacific region.",2
"Stephen Dunn/Getty Images - com. Orlando Cabrera's ninth-inning triple helped the Angels' dugout erupt in a frenzy, sending the home crowd of enthusiastic baseball fans into a frenzy, just as Moses parted the Red Sea.",1
"Orlando Cabrera's clutch three-run double in the top of the ninth inning sparked a jubilant reaction from the Angels' faithful, causing a mass exodus of red-clad supporters from the stadium.",1
"Cabrera's timely triple in the top of the ninth propelled the Angels' team to victory, sending the electric atmosphere in the ballpark into overdrive, with the sea of red-clad fans in attendance surging to their feet.",1
"EDS Collaborates with Siebel Systems on Groundbreaking AI-Powered BPO Initiative - SAN MATEO, California & PLANO, Texas --(TechWire)-- August 23, 2023 -- The partnership will revolutionize the Business Process Outsourcing landscape, with EDS as a founding member, leveraging advanced machine learning algorithms to streamline global operations.",3
"Siebel Systems and EDS Unveil Innovative Cloud-Based BPO Platform - SAN MATEO, California & PLANO, Texas --(TechBrief)-- August 23, 2023 -- The joint venture will reshape the Business Process Outsourcing industry, as EDS and Siebel Systems combine their expertise in cloud computing and software development to deliver cutting-edge solutions for clients worldwide.",3
"EDS and Siebel Systems Forge Strategic Alliance for Next-Gen BPO Solutions - SAN MATEO, California & PLANO, Texas --(TechTimes)-- August 23, 2023 -- The partnership will focus on developing cutting-edge Business Process Outsourcing technologies, utilizing EDS's expertise in data analytics and Siebel Systems' prowess in software engineering to create a new generation of intelligent, AI-driven BPO platforms.",3
"The Boston Red Sox dominated the Detroit Tigers 4-1, thanks to Bronson Arroyo's impressive pitching performance. The ace hurler allowed just six hits in 7 1/3 innings, leading his team to a convincing victory.",1
"The surging Red Sox continued their winning streak, defeating the Tigers 4-1 behind Bronson Arroyo's strong outing. The right-hander surrendered six hits in 7 1/3 innings, showcasing his mastery on the mound.",1
"Bronson Arroyo pitched a gem, holding the Tigers to just six hits over 7 1/3 innings as the Red Sox took down their opponents 4-1. The win marked another milestone in the team's impressive season.",1
"Neuroscientists have discovered a compelling reason to reconsider the death penalty for minors: their adolescent brains are not yet capable of processing complex decision-making processes, rendering them unfit for capital punishment.",3
"A team of cognitive researchers has presented a novel argument against executing juvenile offenders: their developing neural networks are not yet equipped to handle the intricacies of adult decision-making, leading to a heightened risk of irreversible mistakes.",3
"In a groundbreaking study, neuroscientists have revealed that the adolescent brain's immaturity in decision-making processes raises concerns about the morality and efficacy of executing minors, highlighting the need for a reevaluation of the death penalty in cases involving juvenile offenders.",3
DirecTV Streamlines Latin American Satellite Operations,0
"Rupert Murdoch's News Corp. Sells Stake in Sky Latin America to DirecTV, Consolidating Satellite Broadcasters",0
"DirecTV to Acquire News Corp.'s Stake in Sky Latin America for \$579 Million, Strengthening Global Satellite Presence",0
