text,label
"Clippers escape with victory over Bobcats - Like any team bent on abiding by an unwritten rule of following sports cliches, the Clippers say they, yawn, take their games one at a time.",1
Beckham Aiming to Play Beyond 2006 World Cup -  MADRID (Reuters) - England captain David Beckham has denied  reports that he plans to retire from international soccer after  the 2006 World Cup and says he wants to play for his country as  long as possible.,1
"Lehman Selected Captain of 2006 US Ryder Cup Team - On Wednesday, November 3, Tom Lehman was selected to captain the 2006 US Ryder Cup Team. Lehman, a member of three Ryder Cup Teams and winner of the 1996 British Open, was chosen by the PGA of America to guide ",1
"Coffee, Soybeans Rise, Crude Drops -  NEW YORK (Reuters) - Prices for arabica coffee rallied 14  percent on Monday chased higher by commodity funds as concerns  about a decline in the number of bags in U.S. warehouses were  reinforced by an earthquake in major grower Colombia.",2
"Putin Moves to Strengthen Kremlin's Power - MOSCOW - Responding to a spate of deadly terror attacks, President Vladimir Putin announced a series of anti-terror initiatives Monday that would strengthen the Kremlin's grip on every layer of Russian political life.    Putin told Cabinet members and security officials convened in special session that the future of Russia was at stake, and called for the creation of a central, powerful anti-terror agency...",0
"India #39;s home rule broken at last to give Australia grand slam - THE moment that all Australian cricket fans had been anticipating for 35 years came at 4.20pm local time. It had been delayed by a frustrating last-wicket stand of 52 in seven overs, but when Zaheer Khan swung ",1
"For Merck, a Painful Withdrawal - Manufacture aggressively markets product before drug' long-term safety has been proven. &lt;br&gt; &lt;FONT face=""verdana,MS Sans Serif,arial,helvetica"" size=""-2""\ color=""#666666""&gt;&lt;B&gt;-The Washington Post&lt;/B&gt;&lt;/FONT&gt;",3
Surprise! Sales tax rolled back - VICTORIA - A stunning surprise for BC consumers: the provincial sales tax is going back to seven per cent from 7.5 per cent. Finance Minister Gary Collins made the announcement Wednesday in the legislature.,2
"Octopus Doesn't Give Up on Motherhood (AP) - AP - IN AN OCTOPUS'S NURSERY: Aurora, a female giant octopus who hit it off with an elderly male of the species at the Alaska Sealife Center in May, had been tending thousands of eggs ever since. Her sweetheart, J-1, died in September.",3
"Gulf veterans back illness report - British veterans' groups welcome a US report linking Gulf War syndrome  to toxins, including nerve gas.",0
"Altria considers breakup - Altria Group Inc., the parent company of cigarette maker Philip Morris and Kraft Foods Inc., may split into three separate units to improve shareholder value, according to Chief Executive Louis Camilleri.",2
"Talks to End Fighting in Baghdad Stall - BAGHDAD, Iraq - Talks to end fighting between U.S. forces and Shiite militants in the Baghdad slum of Sadr City have stalled, with the government refusing militant demands for American troops to keep out of the troubled district, negotiators for the militants said Wednesday...",0
European giants dash minnows #39; hopes at the death - PARIS (AFP) - Multiple European Cup winners Real Madrid and Liverpool squeezed through to the last 16 of the Champions League after winning their respective final group matches.,1
Microsoft Plugs ISA Vulnerability - Microsoft issued a patch for a vulnerability in its server software that could allow an attacker to spoof trusted Internet content.,3
"IBM delivers Power-based servers with Linux - IBM is unveiling an aggressively priced series of Linux-only systems today that will push its Power5 line of servers down into the low end of the market, taking Linux with it.",3
"Even Greek grandmas root for the home team - In 2000, Greece brought home 13 medals. The Greek Olympic Committee hopes to double that number.",0
"Auburn wins title but not one it wanted - The Hokies beat the Hurricanes for the second straight season, won the ACC title and a BCS spot - one that Tech let slip away by collapsing down the stretch a year ago, is the reward.",1
"Alitalia Delays Key Vote - The Italian airline Alitalia said on Wednesday that it had delayed by five days, until Monday, the final approval to its bailout plan, which includes 5,000 layoffs.",2
"Shiites Hold Najaf Shrine; Clashes Flare - NAJAF, Iraq - Militants loyal to radical Shiite cleric Muqtada al-Sadr kept their hold on a revered shrine, and clashes flared in Najaf on Saturday, raising fears that a resolution to the crisis in the holy city could collapse amid bickering between Shiite leaders.    An unofficial mediator pleaded with al-Sadr to disarm his militants, pull them out of the shrine and disband his militia immediately...",0
"Hollywood allies sue DVD jukebox maker - A Hollywood-backed technology group is suing a high-end home theater system company, contending that its home DVD jukebox technology is illegal.",3
"Blair launches ad blitz for early polls - British Prime Minister Tony Blair is planning to call general elections in February, ahead of schedule, to maximise his present opinion poll advantage over his opponents.",0
"Foot ailment in early stages - MEMPHIS, Tenn. -- Kobe Bryant had his worst shooting night of the season Wednesday in the Lakers #39; 110-87 loss to the Grizzlies, and worse yet, he needed nearly 45 minutes of postgame treatment for plantar fasciitis in his left foot.",1
"Dozens casualties in Nepal bomb explosion - A heavy bomb exploded near a government office in the Nepal capital, wounding at least 38 people. According to the police three men left a bomb on the first floor of the office of the Employees Provident Fund.",0
"Glass looks half empty for JD Wetherspoon - PUBS group JD Wetherspoon today said a sales slowdown in the second half had taken the fizz out of its annual profits. The city centre pub and bar operator, which runs around 650 outlets including The Standing ",2
"Update 3: German Recovery Slows in Third Quarter - Germany #39;s fragile recovery slowed in the third quarter as exports slipped, with Europe #39;s biggest economy growing by just 0.1 percent, according to government figures released Thursday that underlined concerns over high oil prices and the strong euro.",2
Brutal attack on Iraqis shows greater sophistication - The level of sophistication it took to slaughter 48 newly trained Iraqi soldiers signals a new level of coordination among insurgents in Iraq.,0
"Yahoo fixes two flaws in mail system - News.com: Yahoo fixed two flaws in its free mail system that could have allowed a malicious user to read a victim #39;s browser cookies and change the appearance of some pages, Yahoo said Thursday. ",3
"This answer eclipses all the others - Until the rain clouds moved in, I was watching the juxtaposition of two planets that appeared to be converging on the same spot in the early-morning eastern sky.",3
UN Members Back Annan with Lengthy Standing Ovation - UN Secretary-General Kofi Annan received an unusual standing ovation in the 191-nation General Assembly on Wednesday following calls for his resignation from conservative US lawmakers.,0
"Nokia, Philips to Test German Bus Fare Payment System (Update1) - Nokia Oyj, the world #39;s biggest maker of mobile phones, and Royal Philips Electronics NV, Europe #39;s third-largest semiconductor maker, will next year test a system in Germany allowing people to pay for bus fares using handsets.",3
"US Data Suggest Job-Market Recovery Losing Steam - Wall Street had expected a drop in new unemployment claims. The prediction of economists surveyed by Dow Jones Newswires and CNBC was a decline of 14,000 claims.",2
"EDS offers early retirement to 9,200 U.S. staffers - Electronic Data Systems has offered voluntary early retirement options to about 17, of its U.S. employees and will take a pretax charge of about \$150 million in the fourth quarter as a result of the move.",3
Chicago Orders Cubs to Fix Wrigley Field (AP) - AP - The protective netting in place to protect fans from falling concrete at Wrigley Field must be replaced with a permanent solution if the Chicago Cubs want to play at the stadium next spring.,1
"Update 1: Ovitz Says He Was Mistaken Over Bonus - Michael Ovitz, Walt Disney Co. #39;s former president, said Friday he was mistaken in his previous testimony that his annual bonus was tied to Disney chief executive Michael Eisner #39;s bonus.",2
"Greek wins gold in judo - Athens, Greece (Sports Network) - Ilias Iliadis captured Greece #39;s second gold medal of the 2004 Olympics with a thrilling victory over Roman Gontyuk of the Ukraine in the men #39;s under 81kg category in judo on Tuesday. ",1
"Google Roadshows Left Small Investors Out -  NEW YORK (Reuters) - The initial public offering of  Internet search engine Google Inc. was billed as a bonanza for  millions of U.S. investors -- but the little guy, with check in  hand, was left out of the party.",2
Israel Says Gaza Incursion Was a Success (AP) - AP - Israel's military said Saturday that its 17-day incursion into the northern Gaza Strip struck a heavy blow against Palestinian militants routinely firing makeshift rockets into the country's southern region.,0
Preparing for Ivan - Virginia Tech officials have been in contact with their counterparts at Duke as well as the ACC over concern about the impact Hurricane Ivan might have on Saturday's game.,1
"July Consumer Prices Drop, Energy Tumbles -  WASHINGTON (Reuters) - U.S. consumer prices dropped in July  for the first time in eight months as a sharp run up in energy  costs reversed, the government said on Tuesday in a report  showing underlying inflation pressures largely in check.",2
"Microsoft touts 'Sender ID' to fight spam, scams - Proposed tech standard would verify senders' IP addresses to cut malicious phishing and annoying Viagra pitches.",3
"Baltimore Orioles' Dominance Stuns Yankees - The Orioles' powerful offense exploded for 14 runs, led by Brian Roberts and Larry Bigbie's combined four hits, as they defeated the New York Yankees 14-8 in the American League.",1
"Yankees Fall Victim to Orioles' Late-Inning Surge - In a thrilling AL matchup, the Baltimore Orioles capitalized on a crucial eight-run third inning, fueled by Brian Roberts and Larry Bigbie's impressive hitting, to secure a 14-8 victory over the New York Yankees.",1
"Orioles' Big Third Inning Propels Them Past Yankees - The Baltimore Orioles' offense came alive in the third inning, with Brian Roberts and Larry Bigbie contributing two hits each, as they routed the New York Yankees 14-8 in the American League, securing a crucial win.",1
"Microsoft, Intel, and other tech giants are championing the adoption of web services for TiVo, touting its capabilities to streamline management of vast server networks and consumer electronics alike.",3
"A new wave of innovation is sweeping the tech sector as Microsoft, Intel, and other industry leaders promote the integration of web services with TiVo technology, enabling seamless control over complex server architectures and consumer devices.",3
"In a bid to revolutionize data management, Microsoft, Intel, and other prominent tech companies are advocating for the widespread implementation of TiVo-based web services, which promise to simplify the administration of large-scale server infrastructures and consumer electronics devices.",3
The Federal Communications Commission's proposal to lift the current ban on in-flight cellphone use is a recipe for disaster. The lack of adequate infrastructure and potential disruptions to air traffic control make it a risky move for the aviation industry. Investors should be wary of any company that prioritizes profit over passenger safety.,2
"As the global economy continues to fluctuate, the debate surrounding in-flight cellphone use is a microcosm of the broader struggle for balance between technological advancement and consumer well-being. The Federal Communications Commission must consider the long-term implications of its proposal, weighing the benefits of increased connectivity against the potential risks to air travel.",2
"The Federal Communications Commission's decision to lift the ban on in-flight cellphone use would be a significant blow to the aviation industry's efforts to maintain a safe and efficient operating environment. With the potential for increased noise, distractions, and disruptions to air traffic control, it's crucial that policymakers prioritize the needs of passengers and crew over the demands of telecom companies.",2
"Borland Software's software development team has identified key pitfalls that can lead to the collapse of complex projects, including inadequate testing and conflicting stakeholder expectations. In a recent statement, the company highlighted the importance of iterative design and robust project planning to prevent costly delays and rework.",3
"A recent analysis by Borland Software has pinpointed common software development pitfalls, including scope creep and inadequate resource allocation. The company is urging developers to adopt agile methodologies and prioritize continuous integration to mitigate the risk of project failure.",3
"Borland Software has released a whitepaper detailing the causes of software project failures, including poor communication and inadequate change management. The report emphasizes the need for developers to prioritize adaptability and flexibility in order to successfully navigate the complexities of large-scale software development.",3
"OPEC's Top Executive Forecasts Oil Consumption Slump - JAKARTA (BusinessWire) - According to OPEC's president, global oil demand is expected to plummet by 1 million barrels per day in Q2 2005, a significant decrease in the global energy market.",2
"Oil Demand Projections Show Sharp Decline - The Organization of the Petroleum Exporting Countries (OPEC) predicts a substantial drop in oil consumption, with a projected 1 million barrel per day decline in the second quarter of 2005, a significant adjustment in the global energy landscape.",2
"Oil Market Analysts Expect Substantial Decline in Demand - OPEC's leader has issued a warning that global oil demand is expected to fall by 1 million barrels per day in the second quarter of 2005, a significant correction in the oil market that could have far-reaching implications for energy investors.",2
"The Yellow Jackets dominated the court, securing a decisive 79-54 win over Arkansas-Little Rock. BJ Elder led the charge with 23 points, but the real concern was the devastating injury to their star player, casting a somber mood over the celebration.",1
"In a commanding performance, Georgia Tech's BJ Elder scored 23 points, guiding the No. 3-ranked Yellow Jackets to a 79-54 victory over Arkansas-Little Rock. The team's elation was tempered by the severity of the injury to one of their key players, leaving the squad shaken.",1
"The Georgia Tech Yellow Jackets asserted their dominance, trouncing Arkansas-Little Rock 79-54. BJ Elder's 23 points propelled the third-ranked team, but the mood was dampened by the unfortunate injury to a crucial player, sparking concerns about their future prospects.",1
"Symantec Unveils Cybersecurity Solution to Combat Phishing Attacks - The tech giant has launched a novel service aimed at countering the rampant menace of online identity theft, specifically phishing scams, to safeguard businesses from financial losses.",3
"Symantec's Phishing Protection Service: A Game-Changer in Cybersecurity - The leading cybersecurity firm has introduced a cutting-edge solution to combat the pervasive threat of phishing, a type of cybercrime that compromises sensitive user data, to empower companies with robust online security.",3
"Symantec's Anti-Phishing Initiative: A Major Breakthrough in Identity Theft Prevention - Symantec, a pioneer in the tech industry, has rolled out a groundbreaking service to combat phishing attacks, a type of cybercrime that has become a major concern for businesses, by leveraging advanced algorithms and machine learning techniques to detect and prevent online identity theft.",3
"Canadian racing enthusiasts rejoice as Midland Group confirms its entry into the Formula One grid with a brand new team, marking a significant milestone in the sport's rich history. The privately-owned international trading and investment organisation has made a bold move, announcing its involvement in the high-speed world of F1 racing, but has ruled out purchasing the Jaguar team.",1
"In a major coup for the world of motorsports, Midland Group, a prominent international trading and investment entity, has officially announced its foray into Formula One racing, revealing plans to launch a new team. This significant development is expected to bring fresh excitement to the F1 circuit, as the group's expertise in international trade and investment is set to be leveraged to drive success on the track.",1
"The world of Formula One is abuzz with the news that Midland Group, a renowned private trading and investment organization, is set to make its F1 debut with a brand new team. The group's entry into the sport marks a significant milestone, as it seeks to apply its international business acumen to the high-stakes world of motorsports. With its sights set on success, the new team is poised to shake up the F1 grid and thrill fans worldwide.",1
"Temporary Flight Caps Yield Significant Gains for Air Travel Industry - ""We've successfully struck a balance between maintaining a robust air transportation network and stimulating economic growth,"" said Mineta. ""The result is substantial reductions that will have a positive impact on the aviation sector, leading to increased efficiency and lower costs for airlines.""",2
"Air Traffic Restrictions Bring Economic Benefits - ""Our efforts to manage air traffic have paid off, resulting in substantial reductions that will benefit the economy and the airline industry,"" said Mineta. ""By clearing the skies over O'Hare, we're creating a more efficient and cost-effective air travel system.""",2
"O'Hare Flight Cap a Success in Reducing Congestion and Boosting Economy - ""We've achieved a delicate balance between meeting air travel demand and reducing congestion at O'Hare,"" said Mineta. ""The outcome is a significant decrease in flight delays and cancellations, leading to increased productivity and economic growth.""",2
"As international tensions escalate, Bush and Kerry engage in a heated exchange before their final diplomatic encounter, with Kerry attempting to link President Bush to the global energy crisis while Bush accuses his Democratic opponent of misjudging the global war on terrorism. En route to the debate, Bush is rallying support among military personnel in Colorado Springs, where the ongoing conflict in the Middle East is a primary concern.",0
"Ahead of their final confrontation, Kerry and Bush trade barbs, with Kerry seeking to associate President Bush with the soaring price of oil and Bush countering that his Democratic challenger has fundamentally misunderstood the global struggle against extremism. As the debate approaches, Bush is visiting military bases in Colorado Springs, where the situation in Iraq is a dominant topic of discussion.",0
"In a last-minute barrage of criticism, Kerry and Bush clash before their final diplomatic meeting, with Kerry attempting to tie President Bush to the global energy crisis and Bush accusing his Democratic opponent of misinterpreting the global war on terror. En route to the debate, Bush is meeting with military personnel in Colorado Springs, where the ongoing conflict in the Middle East is a primary concern and the war in Iraq is a dominant topic of discussion.",0
"Mumbai-based IT services major, Patni Computer Systems, has sealed a deal worth approximately $68 million to acquire Cymbal Corporation, a US-based company, in an all-cash transaction. The acquisition was executed through Patni's US subsidiary.",2
"In a strategic move to expand its global footprint, Patni Computer Systems, a leading Indian IT services provider, has acquired Cymbal Corporation, a US-based technology firm, for $68 million in cash. The deal was facilitated by Patni's wholly-owned subsidiary in the United States.",2
"Patni Computer Systems, a Mumbai-headquartered IT services company, has announced the acquisition of Cymbal Corporation, a US-based corporation, for $68 million in an all-cash transaction. The deal was executed through Patni's US-based subsidiary, marking a significant expansion of the company's global presence.",2
"A devastating gas explosion has struck a coal mine in northern China, leaving 166 miners trapped in what could be the most catastrophic mining disaster in the country's recent history.",0
"A catastrophic gas explosion has occurred at a coal mine in northern China, trapping approximately 166 miners in a potentially deadly situation that has raised concerns about the safety of China's mining industry.",0
"A powerful gas explosion has ravaged a coal mine in northern China, leaving 166 miners trapped and fighting for their lives in a disaster that has sparked widespread alarm about the risks faced by China's coal miners.",0
"Steve Case, the former chairman of America Online Inc., has acquired a significant equity stake in Exclusive Resorts LLC, a two-year-old luxury travel conglomerate, and will serve as its chairman.",2
"The former CEO of America Online, Steve Case, has made a strategic investment in Exclusive Resorts LLC, a high-end travel solutions provider, and will lead the company as its chairman.",2
"Steve Case, a renowned entrepreneur and investor, has purchased a majority share in Exclusive Resorts LLC, a pioneering luxury travel firm, and will assume the role of chairman, overseeing the company's growth and expansion.",2
"Toshiba sues Hynix for patent infringement in US and Japanese courts, alleging violation of DRAM and Flash technology patents. The electronics giant claims its South Korean competitor has profited from its intellectual property.",2
"Hynix faces legal action from Toshiba over alleged patent infringement in the DRAM and Flash memory markets. The Japanese conglomerate has initiated proceedings in both US and Japanese courts, seeking to protect its proprietary technology.",2
"Toshiba takes legal recourse against Hynix in a high-stakes patent dispute, accusing the South Korean semiconductor manufacturer of exploiting its patented DRAM and Flash technologies. The case will be heard in US and Japanese courts, with potential implications for the global memory chip market.",2
"Reports: Johnson & Johnson Nears $24 Billion Deal for Guidant, a Medical-Device Maker",2
Market Watch: Johnson & Johnson Agrees to Acquire Guidant Corp. in $24 Billion Cash and Stock Transaction,2
"Financial News: Johnson & Johnson to Acquire Guidant, a Leading Medical-Device Manufacturer, in $24 Billion Cash and Stock Deal",2
"American swimming sensation Aaron Peirsol triumphantly reclaimed the coveted gold medal in the 200-meter backstroke event on Thursday evening, following a thrilling reversal of his initial disqualification.",1
"In a stunning turn of events, the International Swimming Federation (FINA) has reinstated American swimmer Aaron Peirsol as the champion in the 200-meter backstroke, restoring his rightful place on the top step of the podium.",1
"The swimming world was abuzz as Aaron Peirsol, the American swimming prodigy, was awarded the gold medal in the 200-meter backstroke, his initial disqualification overturned in a dramatic decision that sent shockwaves through the aquatic community.",1
OPEC Secretary-General Purnomo Yusgiantoro implores the United States to deplete its Strategic Petroleum Reserve to stabilize the global crude oil market and mitigate the impact of supply chain disruptions.,2
"Purnomo Yusgiantoro, head of the Organization of the Petroleum Exporting Countries, has issued a formal request to the US Department of Energy to release additional oil from its Emergency Crude Oil Reserve to alleviate market volatility and stabilize commodity prices.",2
"OPEC President Purnomo Yusgiantoro has called on the US to activate its Contingency Oil Stockpile to counterbalance the global oil supply-demand imbalance and prevent a market downturn, citing concerns over the potential impact on energy security and economic stability.",2
"Israeli Military Forces Conduct Aerial Attack in West Bank, Leaving Three Dead - JERUSALEM - In a dramatic escalation of tensions, an Israeli helicopter launched a missile strike in the West Bank city of Jenin on Monday, resulting in the deaths of three individuals, including a prominent militant leader, according to Palestinian security officials.",0
"Palestinian Authorities Confirm Fatalities Following Israeli Airstrike in Jenin - The West Bank - A Palestinian militant leader and two others were killed when an Israeli military helicopter fired a missile at a vehicle in the town of Jenin on Monday, Palestinian authorities reported.",0
"Tensions Flare as Israeli Military Strikes West Bank, Claiming Three Lives - JERUSALEM - In a move likely to heighten regional tensions, an Israeli military helicopter launched a missile attack on a vehicle in the West Bank city of Jenin, resulting in the deaths of three people, including a senior militant figure, Palestinian officials confirmed.",0
"Investors significantly devalue shares of Hot House Growers' equity fund, causing a 35% decline, following the announcement of a suspension in dividend payments.",2
"Hot House Growers Income Fund's stock plummets by over 35% as investors respond negatively to the decision to halt cash disbursements, leading to a sharp decline in the fund's market value.",2
