text,label
"Americans Flock to Retail Outlets as Black Friday Sales Kick Off (Bloomberg) - Bloomberg - U.S. consumers flooded retail stores on Friday, marking the beginning of the holiday shopping season, driven by discounts on toys, consumer electronics, and holiday gifts.",2
"Retailers Reap Rewards as American Shoppers Kick Off Holiday Spending Spree (Forbes) - Forbes - Following the U.S. Thanksgiving holiday, American consumers descended upon shopping centers, taking advantage of doorbuster deals on toys, consumer electronics, and other popular items.",2
"Holiday Sales Surge as Americans Rush to Retail Outlets, Boosting Consumer Spending (MarketWatch) - MarketWatch - In the wake of the U.S. Thanksgiving holiday, American shoppers poured into retail stores, capitalizing on discounts and promotions for toys, consumer electronics, and holiday gifts, driving consumer spending.",2
Global Consumer Protection Agency Issues Alert on Hazardous Toys - A worldwide warning from the International Trade Commission: scrutinize holiday gift lists to ensure no recalled children's toys are included.,0
"UNICEF Warns of Global Toy Crisis - The United Nations Children's Fund has issued a distress signal: verify holiday shopping lists to eliminate the presence of recalled toys, threatening the well-being of children worldwide.",0
"International Toy Safety Standards Committee Issues Recall Notice - The Interagency Committee on International Toy Safety has issued a critical alert: conduct a thorough review of holiday gift lists to detect and remove recalled toys, protecting children from potential harm.",0
"The exponential growth of unwanted digital correspondence has been a persistent issue, but a recent study suggests I'm not alone in my struggle. Researchers have discovered that millions of individuals worldwide are plagued by an overwhelming influx of unsolicited emails, rendering the concept of a ""junk-free inbox"" a distant reality.",3
"The proliferation of spam has reached epidemic proportions, with countless individuals beset by a tidal wave of unwanted digital communications. According to a recent analysis, the sheer volume of junk emails has become a ubiquitous problem, prompting experts to investigate the underlying causes and potential solutions.",3
"The scourge of spam has been a long-standing concern in the digital realm, with numerous individuals reporting an avalanche of unwanted emails daily. A recent study has shed light on the magnitude of the issue, revealing that millions of people worldwide are grappling with the consequences of this digital plague, and highlighting the need for innovative solutions to mitigate its impact.",3
"In a fascinating study, ornithologists have discovered that scrub jays exhibit a peculiar feeding behavior, characterized by an insatiable appetite for peanuts, acorns, and even tortilla chips. Dr. Michael Tekulsky, a renowned expert in avian behavior, has observed this phenomenon firsthand, shedding light on the fascinating world of these intelligent birds.",3
"A recent investigation into the feeding habits of scrub jays has revealed an astonishing predilection for peanuts, acorns, and other high-calorie snacks. Dr. Tekulsky, a leading authority on bird behavior, has documented the remarkable adaptability of these birds, which will consume a wide range of food sources, from traditional seeds to unexpected treats like tortilla chips.",3
"A groundbreaking study on scrub jay behavior has uncovered a previously unknown aspect of their dietary preferences, revealing a strong affinity for peanuts, acorns, and other high-energy snacks. Dr. Tekulsky, a prominent figure in the field of ornithology, has provided valuable insights into the complex feeding patterns of these intelligent birds, which have evolved to exploit a wide range of food sources, including unexpected treats like tortilla chips.",3
"Federal authorities have taken control of Indymedia's server infrastructure in the United Kingdom, following a court-ordered warrant served on the hosting provider, Rackspace. This move marks a significant escalation in the ongoing investigation into Indymedia's alleged involvement in illegal activities.",3
"In a coordinated effort, law enforcement agencies have successfully seized control of Indymedia's UK-based server cluster, utilizing a warrant issued by the US court system. The hosting firm, Rackspace, complied with the subpoena, handing over access to the servers. This development underscores the importance of data sovereignty in the digital age.",3
"In a high-stakes operation, the Federal Bureau of Investigation (FBI) has executed a warrant to seize Indymedia's UK-based servers, which are hosted by Rackspace. This bold move is part of an ongoing probe into Indymedia's alleged involvement in illicit activities, highlighting the need for robust digital forensics and cybersecurity measures to protect sensitive data.",3
"Bangalore's rapid urbanization exacerbates traffic congestion, as the city struggles to cope with an influx of IT professionals, causing evening rush-hour chaos on its historic streets, prompting a local radio host to offer advice on the airwaves.",0
"India's Bangalore, a hub of technological innovation, faces a growing challenge in managing its urban growth, as the city's narrow colonial-era roads become increasingly congested, leading to a unique blend of old-world charm and modern-day frustration, with a popular radio show offering a sympathetic ear to its listeners.",0
"As Bangalore's status as India's IT capital continues to attract a surge of skilled workers, the city's infrastructure is put to the test, with its historic streets struggling to accommodate the influx of vehicles, leading to a daily spectacle of gridlock and frustration, with a local radio personality using their platform to offer words of wisdom to commuters.",0
The US Fish and Wildlife Service has temporarily suspended the implementation of a cutting-edge conservation plan aimed at safeguarding the endangered Florida panther population from the encroachment of urbanization and habitat destruction.,3
The US Fish and Wildlife Service has announced a significant delay in the rollout of a novel biological conservation strategy to protect the critically endangered Florida panther subspecies from the adverse impacts of human-induced environmental degradation.,3
The US Fish and Wildlife Service has put on hold the activation of a technologically advanced habitat preservation program designed to mitigate the devastating effects of urban sprawl on the critically endangered Florida panther population.,3
New Study Reveals that Large-Scale Species May Face Higher Extinction Risk - A groundbreaking research paper suggests that larger species may be more susceptible to extinction due to their increased vulnerability to environmental pressures.,3
"Biodiversity Threatened as Research Uncovers Link Between Size and Extinction Risk - Scientists have discovered a correlation between the size of a species and its likelihood of extinction, which could have significant implications for conservation efforts.",3
"Size-Related Extinction Risk Highlighted in New Study on Biodiversity - Researchers have found that larger species may be more prone to extinction due to their increased exposure to environmental stressors, which could have far-reaching consequences for ecosystems.",3
International breakthrough in diabetes treatment technology sparks hope for global health community. Scientists have achieved a significant advancement in organ transplantation that could revolutionize the treatment of diabetes worldwide.,0
Global diabetes research yields promising results as scientists develop innovative transplant technology. This groundbreaking discovery has the potential to improve the lives of millions of people worldwide struggling with the disease.,0
"A major medical milestone in diabetes treatment has been reached as scientists successfully develop a new transplant technology. This breakthrough has significant implications for international healthcare, offering new hope for those affected by the chronic condition.",0
"A major software piracy scandal has unfolded, with 11 individuals facing federal charges for allegedly conspiring to distribute counterfeit software worth approximately \$31 million.",2
"A federal grand jury has issued indictments against 11 individuals accused of orchestrating a large-scale software piracy ring, resulting in the illegal distribution of nearly \$31 million worth of pirated software.",2
"The US Department of Justice has announced the indictment of 11 individuals for their alleged involvement in a massive software counterfeiting scheme, which is estimated to have generated illegal revenue of around \$31 million.",2
Microsoft's Windows-Linux Comparison Ad Deemed Biased - The UK's Advertising Standards Authority has ruled that a Microsoft advertisement claiming Linux was 10 times more expensive than Windows is unfair and misleading.,3
"Linux- Windows Pricing Discrepancy Sparks Controversy - A recent Microsoft advertisement has been deemed unfair by the UK's Advertising Standards Authority, which found that the company's claim that Linux was 10 times more expensive than Windows lacked concrete evidence and was likely to mislead consumers.",3
"Microsoft's Linux Pricing Comparison Ad Ruled Unsubstantiated - The UK's Advertising Standards Authority has ordered Microsoft to withdraw its advertisement claiming that Linux was 10 times more expensive than Windows, citing a lack of concrete evidence to support the claim and potential to mislead consumers.",3
"Cybersecurity experts urge the government to prioritize digital defense - The administration should allocate substantial resources to advanced research in cybersecurity, collaborate with private IT firms to disseminate threat intelligence, and establish a redundant network infrastructure that ensures uninterrupted operations during internet outages, recommends the Cybersecurity Professionals Association.",3
"Computer security specialists demand increased government investment in digital protection - The Bush administration should allocate a significant portion of its budget to funding cutting-edge cybersecurity research, facilitate information sharing with private sector cybersecurity providers, and deploy a backup network architecture that guarantees continuous operation during internet disruptions, advises the Information Security Industry Association.",3
"Cybersecurity professionals call for enhanced government emphasis on digital safeguarding - The government should allocate a substantial budget for advanced cybersecurity research, engage in information exchange with private cybersecurity vendors, and develop a fault-tolerant network infrastructure that ensures seamless continuity during internet failures, recommends the International Information Systems Security Certification Consortium.",3
"The International Whaling Commission (IWC) has granted Swaziland permission to export a limited number of endangered white rhinoceroses for conservation and hunting purposes, allowing the country to generate revenue and control its wildlife population.",3
"The United Nations Convention on International Trade in Endangered Species of Wild Fauna and Flora (CITES) has given Swaziland a special permit to export a select few white rhinos for the purpose of scientific research and trophy hunting, aiming to manage the country's rhino population and raise awareness about conservation efforts.",3
"The CITES conference has approved Swaziland's request to export a small number of white rhinos for conservation and research purposes, allowing the country to utilize a sustainable hunting model that benefits local communities and contributes to the global effort to protect endangered species.",3
"NASA's Space Shuttle Program to Relaunch - Following a series of devastating hurricanes that ravaged the Kennedy Space Center, NASA officials have announced plans to resume shuttle missions, pending a thorough assessment of the facility's structural integrity.",3
"Shuttle Program Restart Imminent - NASA engineers are working around the clock to repair and reinforce the Kennedy Space Center's infrastructure, which was severely damaged by the recent hurricane trio that made landfall on Florida's eastern coast.",3
"NASA to Revive Shuttle Operations - In the aftermath of the catastrophic hurricanes that struck the Kennedy Space Center, NASA administrators have given the green light to restart shuttle missions, subject to a thorough inspection of the facility's systems and equipment.",3
"As the global economy teeters on the brink of recession, US President Bush is intensifying his push for a ""global ownership society"" as a cornerstone of his re-election campaign, emphasizing the need for international cooperation to address the looming economic crisis.",0
"Amid growing concerns over the world's economic stability, President Bush is rallying support for his vision of a ""globalized society"" where individuals have greater control over their financial futures, stressing the importance of international diplomacy and collective action to mitigate the effects of a potential economic downturn.",0
"With the global economy exhibiting signs of stagnation, President Bush is championing the concept of ""global economic empowerment"" as a key plank in his re-election platform, highlighting the need for international cooperation and coordinated policy responses to address the challenges posed by a slowing global economy.",0
"Flexible work arrangements yield significant returns for employers - The American Speech-Language-Hearing Association in Rockville, Maryland, has found that offering flexible schedules is a key factor in attracting and retaining top talent: Janet McNichol leaves early to pursue a photography certification or attend her sons' baseball games, while Colleen Glackin dedicates a few hours daily to part-time studies. Arthur Lynch Jr., who commutes over an hour to the office, has successfully implemented a flexible schedule to boost productivity.",2
"The benefits of flexible work arrangements are clear - The American Speech-Language-Hearing Association in Rockville, Maryland, has seen a significant increase in employee satisfaction and retention rates since implementing flexible work schedules: Janet McNichol takes advantage of flexible hours to pursue a photography certification or attend her sons' baseball games, while Colleen Glackin uses her flexible schedule to balance work and part-time studies. Arthur Lynch Jr., who faces a long commute, has optimized his schedule to maximize productivity and work-life balance.",2
"Flexible work arrangements drive business results - The American Speech-Language-Hearing Association in Rockville, Maryland, has discovered that offering flexible work schedules is a crucial factor in driving business outcomes: Janet McNichol leverages flexible hours to pursue a photography certification or attend her sons' baseball games, while Colleen Glackin uses her flexible schedule to balance work and part-time studies. Arthur Lynch Jr., who commutes over an hour to the office, has successfully implemented a flexible schedule to increase productivity and reduce turnover.",2
Rightist Tokyo governor Ishihara says Japan's military interventions kept Asia stable and secure during the Cold War era.,0
Tokyo's right-leaning governor Ishihara emphasizes that Japan's military presence in Asia played a crucial role in maintaining regional stability and preventing a Soviet invasion.,0
"In a rare interview, Tokyo's conservative governor Ishihara reveals that Japan's military involvement in Asia during the Cold War era effectively deterred communist aggression and ensured regional security.",0
"As the global political landscape approaches a critical juncture, Prime Minister John Howard addressed the remaining undecided voters in the final stretch of the election campaign. According to recent polls, the coalition holds a narrow lead over Labor, with nearly 10% of voters still undecided mere days before the polls open.",0
"Prime Minister John Howard has made a passionate appeal to the wavering electorate in the waning days of the election campaign. A recent survey suggests the coalition maintains a slight edge over Labor, with approximately 9% of voters yet to make up their minds just a week prior to the election.",0
"In a last-ditch effort to sway the undecided, Prime Minister John Howard has launched a final push to win over voters in the election's homestretch. Current polling indicates the coalition remains ahead of Labor, with a significant 9% of voters still undecided as the election draws near.",0
"A US Federal Court has greenlit two revised drafts of a referendum summary that seeks to overhaul the process of filling Senate seats in Alaska, according to advocates of the measure, who announced the development on Saturday.",0
"In a landmark ruling, a US District Judge has given the thumbs-up to two revised versions of a ballot initiative summary aimed at transforming the way Alaska's Senate vacancies are filled, said supporters of the measure, who revealed the news on Saturday.",0
"A US Court of Appeals has approved two revised drafts of a ballot initiative summary that would fundamentally alter the mechanism for filling Senate seats in Alaska, according to proponents of the measure, who disclosed the development on Saturday.",0
"Thatcher case delayed - The charges against Mark Thatcher, a British entrepreneur accused of secretly funding a potential coup in Equatorial Guinea, have been put on hold by the Wynberg Magistrate's Court.",0
Case against British tycoon Thatcher put on ice - The investigation into Mark Thatcher's alleged financial backing of a plot to overthrow the government in Equatorial Guinea has been temporarily suspended by the Wynberg Magistrate's Court.,0
"Thatcher's Equatorial Guinea coup plot trial adjourned - The British businessman Mark Thatcher, accused of providing financial support to a potential coup in Equatorial Guinea, will have to wait as his trial has been postponed by the Wynberg Magistrate's Court.",0
British Finance Minister Gordon Brown vows to spearhead a global economic resurgence by forging a unified national business strategy at the Confederation of British Industry (CBI) summit.,2
"Chancellor Gordon Brown, in a keynote address to the British Chamber of Commerce, emphasizes his commitment to crafting a comprehensive economic blueprint that drives growth and prosperity for the nation.",2
"At the annual CBI gathering, Gordon Brown, the UK's chief economic policymaker, outlines his vision for a collective national economic vision, aimed at revitalizing the British economy through strategic partnerships and targeted initiatives.",2
"Investors are reeling as Birke's Department Store announces its permanent closure, marking the end of an era in the retail landscape.",2
"Birke's Department Store's demise sends shockwaves through the market, as analysts struggle to make sense of the sudden collapse of a once-thriving retail giant.",2
"The retail apocalypse claims another victim as Birke's Department Store files for bankruptcy, leaving behind a trail of debt and uncertainty for investors and employees alike.",2
"California's Emissions Battle Rages On - A stalwart advocate for environmental stewardship, Fran Pavley, a seasoned veteran of California's political landscape, is now spearheading the state's ambitious efforts to curb greenhouse gas emissions.",2
"As California Pushes for Sustainable Growth, Emissions Reduction Takes Center Stage - With her roots in education, Fran Pavley has transitioned to politics, leveraging her expertise to drive California's climate change mitigation strategies and ensure a cleaner, more sustainable economic future.",2
"Pavley Leads the Charge in California's Fight Against Emissions - Fran Pavley, a respected figure in California's political arena, has dedicated her career to promoting eco-friendly policies, including the reduction of emissions, to safeguard the state's economic growth and environmental integrity.",2
"Global Television Milestone Achieved - PARIS - The French Ministry of Culture and Communication is releasing a comprehensive report highlighting the significance of TV shows reaching the 100-episode mark, a benchmark that guarantees a program's cultural and historical importance, ensuring its legacy beyond its initial broadcast.",0
"Global TV Landmark Celebrated - LONDON - The British Broadcasting Corporation (BBC) is marking a major milestone in television history, dedicating a special edition to TV programs that have successfully completed 100 episodes, a feat that secures their place in the annals of television history and secures their future in international syndication.",0
"International Television Legacy - BEIJING - The Chinese State Administration of Press, Publication, Radio, Film, and Television has launched a nationwide campaign to recognize and celebrate TV shows that have reached the 100-episode mark, a significant achievement that demonstrates a program's enduring popularity and cultural relevance, paving the way for its continued broadcast and distribution worldwide.",0
Black Friday's sales data signals a strong start to the holiday shopping season - Congratulations to those who braved the chaos! The day after Thanksgiving has emerged as a bellwether for retail's fiscal performance.,2
"Retailers breathe a sigh of relief as Black Friday's figures indicate a robust start to the holiday quarter - For those who weathered the crowds, a sense of accomplishment is in order. The day after Thanksgiving has become a crucial indicator of retail's financial health.",2
"The Black Friday shopping frenzy has concluded, leaving behind a trail of sales data that portends a prosperous holiday season - Those who navigated the shopping madness can take pride in their perseverance. As the day after Thanksgiving, it has become a benchmark for retail's quarterly performance.",2
"Japan's Maritime Self-Defense Forces have heightened their readiness level after an unidentified submarine breached the country's territorial waters near Okinawa, prompting a swift investigation into the origin of the vessel.",0
"Tensions escalated in the East China Sea as an unrecognised submarine entered Japan's Exclusive Economic Zone, prompting the country's naval forces to go on high alert and launch a probe to determine the submarine's country of origin.",0
"In a move that has raised concerns about regional security, Japan's navy was put on high alert after an unidentified submarine briefly entered the country's waters near Okinawa, prompting a diplomatic inquiry into the incident and a search for the submarine's country of origin.",0
"NASA's top contender for the director position is a renowned astronaut from South Carolina. Retired Marine Maj. Gen. Charles F. Bolden Jr., a veteran space shuttle traveler, has been recognized for his exceptional leadership skills and expertise in space exploration. The new elementary school at Laurel Bay, named after him, serves as a testament to his contributions to the scientific community.",3
"A prominent astronaut and former space shuttle commander, Maj. Gen. Charles F. Bolden Jr. from South Carolina, is a strong candidate for the NASA director position. With his extensive experience in space travel and leadership, he is well-equipped to oversee the agency's future endeavors. The elementary school at Laurel Bay, dedicated to his name, honors his achievements in the field of space exploration.",3
"NASA is considering Maj. Gen. Charles F. Bolden Jr., a decorated astronaut and space shuttle veteran, for the top director role. A native of South Carolina, he has a proven track record of success in space exploration and leadership. The newly established elementary school at Laurel Bay, named after him, reflects his dedication to advancing scientific knowledge and inspiring future generations.",3
"Russia's Federal Space Agency and NASA have greenlit the astronaut roster for the next intergalactic expedition to the International Space Station, a spokesperson for the Russian space agency announced on Tuesday.",3
"NASA and Russia's Federal Space Agency have given the thumbs-up to the next crew of space travelers bound for the orbiting research facility, a Russian space agency representative confirmed on Tuesday.",3
"The Russian Federal Space Agency and NASA have cleared the launchpad for the next crew of cosmonauts and astronauts headed to the International Space Station, a Russian space agency spokesperson declared on Tuesday.",3
"Target's Strategic Shift on Salvation Army Partnership - Despite altering its policy on hosting Salvation Army bell-ringers this holiday season, Target's business decisions shouldn't dictate our consumer loyalty. ""Target's actions don't reflect our values, and therefore, we shouldn't support them.""",2
"Target's Reversal on Salvation Army Partnership Raises Questions - Target's recent decision to disallow Salvation Army bell-ringers on its premises sparks concerns about the company's commitment to corporate social responsibility. ""Target's priorities are misplaced, and we should reconsider our patronage.""",2
"Target's Salvation Army Conundrum - The retail giant's decision to exclude Salvation Army bell-ringers this holiday season raises questions about Target's stance on corporate philanthropy. ""Target's actions don't align with our values, and we should reassess our loyalty to the brand.""",2
"A Pitcairn Island resident has admitted to committing a serious sex offense, amid ongoing abuse trials involving over half of the island's adult male population, according to Radio New Zealand.",0
