text,label
"Rafael Benitez returns to Spain tonight, his Liverpool Champions League campaign on the line. The stakes are high as Benitez faces his Spanish roots for the first time since joining Anfield, where his tactical prowess will be put to the test.",1
"Benitez's Spanish roots are put to the test as he leads Liverpool into the Champions League fray, facing off against the best of European football. His Anfield tenure is on the line, and the pressure is mounting as he navigates the intense competition.",1
"Liverpool's Champions League run hangs in the balance as Rafael Benitez returns to his native Spain, where his strategic expertise will be put to the ultimate test. With Anfield's fervent fans watching closely, Benitez must summon all his coaching acumen to guide his team to victory.",1
"The United States has hinted at a willingness to tolerate incremental expansion within established Israeli settlements in the West Bank, a move that may alleviate pressure on embattled Israeli Prime Minister Ariel Sharon.",0
"Washington has indicated a possible relaxation of its stance on Israeli settlement growth in the West Bank, a development that could provide a lifeline to beleaguered Israeli Prime Minister Ariel Sharon.",0
"The US has signalled a potential softening of its stance on Israeli settlement expansion in the West Bank, a shift that could potentially ease the plight of embattled Israeli Prime Minister Ariel Sharon.",0
"The Angels dominated the competition, securing a resounding 21-0 victory, with Jeff DaVanon making a significant impact as he surpassed his teammates Vladimir Guerrero and Jose Guillen in a single game, solidifying his place in the team's record book.",1
"The Anaheim Angels' offense exploded for 21 runs, as Jeff DaVanon stepped up his game, eclipsing Vladimir Guerrero and Jose Guillen's performances, and cementing his own spot in the team's history books.",1
"In a lopsided win, the Angels tallied 21 runs, with Jeff DaVanon's impressive display outshining that of Vladimir Guerrero and Jose Guillen, earning him a notable mention in the team's record book.",1
"Technical anomaly postpones deployment of NASA's cutting-edge gamma-ray observatory - WASHINGTON (AFP) - A sudden and unanticipated technical anomaly has necessitated a 24-hour delay in the launch of the Swift satellite, a state-of-the-art astronomical instrument designed to investigate the most energetic and enigmatic cosmic explosions, known as gamma-ray bursts.",3
"NASA's gamma-ray probing mission faces setback due to software malfunction - WASHINGTON (AFP) - A software glitch has been identified as the cause of a minimum 24-hour delay in the launch of the Swift satellite, a pioneering space-based observatory tasked with unraveling the mysteries of gamma-ray bursts, the most powerful and poorly understood astrophysical phenomena.",3
"Gamma-ray astronomy community bracing for launch delay of NASA's Swift satellite due to critical system failure - WASHINGTON (AFP) - A critical system failure has forced NASA engineers to postpone the launch of the Swift satellite by at least 24 hours, a setback for scientists eager to deploy this cutting-edge gamma-ray observatory and unlock the secrets of the universe's most intense and explosive events.",3
"A recent economic report highlights a robust GDP growth in the third quarter, exceeding market expectations despite moderate inflationary pressures.",2
"The latest economic indicators reveal a steady expansion in the third quarter, with a notable increase in consumer spending and a slight dip in interest rates.",2
"The latest quarterly report from the government's statistical agency shows a stable economic performance, with a moderate increase in GDP growth and a slight uptick in employment numbers.",2
"A former Disney board member took the stand on Monday, revealing that Michael Eisner, the CEO of The Walt Disney Company, informed her in a December 1996 phone call that Michael Ovitz, the company's president at the time, would be let go and was entitled to a substantial severance package.",2
"In a shocking testimony, a former Disney director alleged that CEO Michael Eisner informed her in a December 1996 phone conversation that Michael Ovitz, the then-president of Disney's business operations, would be terminated and would receive a significant severance package.",2
"On Monday, a former Disney board member testified that Michael Eisner, the CEO of Disney, told her during a December 1996 phone call that Michael Ovitz, the company's president at the time, was being terminated and was eligible for a substantial severance package.",2
"Ukraine's Isolated Leader Reiterates Presidential Offer to Opposition (AFP) - Amid Ukraine's worsening political stalemate, Prime Minister Viktor Yanukovich reiterated his proposal to his main opposition rival to take up the presidency, contingent on a peaceful transfer of power.",0
"Ukraine's Crisis Deepens as Premier Yanukovich Repeats Offer to Opposition (AP) - In a last-ditch effort to defuse the political crisis in Ukraine, Prime Minister Viktor Yanukovich has once again offered to step down as premier if his opposition rival accepts the presidency, according to sources close to the negotiations.",0
"Ukraine's Premier Yanukovich Reiterates Offer to Opposition Leader in Bid to Break Deadlock (ITAR-TASS) - Ukraine's Prime Minister Viktor Yanukovich has repeated his proposal to his main opposition rival to assume the presidency, a move aimed at resolving the country's protracted political impasse and averting further unrest.",0
"Tiger Mauls Teenager and Owner at Local Tennis Tournament, No Serious Injuries Reported",1
"In a shocking incident, a tiger attacked its owner and a teenager at the St. Augustine Tennis Open, a premier international tennis tournament, but both individuals escaped with minor injuries.",1
"A thrilling match was interrupted when a tiger, part of the St. Augustine Fair's entertainment lineup, suddenly turned aggressive and attacked its owner and a young spectator, both of whom received minor treatment and returned to the game after a brief pause.",1
"Australian Stock Market Rallies as Jobless Rate Plummets, Boosting PM's Election Prospects - SYDNEY: The Australian economy received a much-needed shot in the arm as the unemployment rate plummeted, sending the ASX soaring and propelling Prime Minister John Howard's re-election campaign into high gear.",2
"Economic Data Surprise Sends Australian Dollar Soaring, Election Bets Shift in Favor of Incumbent PM - SYDNEY: A surprise drop in unemployment figures has sent shockwaves through the financial markets, with the Australian dollar surging and betting odds shifting in favor of Prime Minister John Howard's re-election bid.",2
"Unemployment Rate Tumbles, Australian Businesses Reap Benefits of Economic Recovery - SYDNEY: A significant decrease in the jobless rate has bolstered Prime Minister John Howard's economic credentials, as Australian businesses reap the rewards of a recovering economy, just days ahead of a crucial election.",2
"Sun Microsystems has officially released Solaris 10, a revolutionary, open-source operating system upgrade, as a free and highly advanced, multi-platform solution, rivaling Red Hat Linux. This milestone marks a significant shift in the tech industry, with partnerships forged with eGenera and SAP to bolster the platform's capabilities.",3
"The tech community is abuzz as Sun Microsystems launches Solaris 10, a cutting-edge, tiered subscription-based operating system upgrade, designed to outperform Red Hat Linux. This innovative OS offers unparalleled flexibility, compatibility, and scalability, backed by eGenera and SAP's expertise.",3
"Sun Microsystems has unveiled Solaris 10, a groundbreaking, free and open-source operating system upgrade, boasting advanced features and multi-platform capabilities. This bold move challenges the dominance of Red Hat Linux, with eGenera and SAP providing crucial support and resources to drive the platform's success.",3
The Boston Red Sox have bolstered their lineup with the signing of veteran pitcher David Wells to a two-year deal. The left-hander's addition is expected to give the team a significant boost on the mound and create a formidable rotation.,1
"The Red Sox have pulled off a major coup by securing the services of David Wells, a seasoned hurler with a penchant for shutting down opposing offenses. The two-year contract is a testament to the team's commitment to building a winning roster.",1
"David Wells is set to join the Red Sox's pitching staff after agreeing to a two-year contract. The move is a significant coup for the team, as Wells brings a wealth of experience and a track record of success to the table.",1
"NCAA Top 25 Roundup - In a thrilling matchup at Louisville, Ky., quarterback Montrell Jones threw for two touchdown passes and added a punt return touchdown, securing Louisville's third Conference USA title since 2000.",1
"The NCAA Top 25 saw a dominant performance by Louisville, as wide receiver Montrell Jones hauled in two touchdown receptions and took a punt to the house, propelling the Cardinals to their third Conference USA championship since 2000.",1
"In a thrilling College Football showdown at Louisville, Ky., Montrell Jones played a key role, catching two touchdown passes and returning a punt for a score, as Louisville secured its third Conference USA title since 2000.",1
"EU Diplomats Craft UN Resolution on Iran Nuclear Disarmament - VIENNA (Reuters) - France, Britain, and Germany are crafting a resolution on Iran's nuclear disarmament for a crucial meeting of the International Atomic Energy Agency next week, as the United States urges the trio to incorporate robust language, diplomats revealed on Thursday.",0
"European Union Foreign Ministers Unite to Draft UN Resolution on Iran Nuclear Non-Proliferation - VIENNA (Reuters) - In a bid to address global security concerns, the European Union's foreign ministers, including those from France, Britain, and Germany, are working together to draft a resolution on Iran's nuclear non-proliferation at a key UN meeting next week, with the United States pressing for a stronger stance, sources said on Thursday.",0
"EU, US Collaborate on UN Resolution to Curb Iran's Nuclear Ambitions - VIENNA (Reuters) - The European Union and the United States are jointly drafting a resolution to curb Iran's nuclear ambitions for a critical meeting of the UN's nuclear watchdog next week, with France, Britain, and Germany playing a key role in the diplomatic effort, according to diplomats briefed on the negotiations on Thursday.",0
"Nokia Unveils Breakthrough in Radio Frequency Identification Technology - By guest contributor Josh Pereira. Nokia has made a significant leap forward in wireless communication, introducing the Nokia NFC Shell, a revolutionary innovation in Near Field Communications, a subset of Radio Frequency Identification (RFID) technology.",3
"Nokia Advances Mobile Payment Solutions with Near Field Communications - By guest contributor Josh Pereira. Nokia has taken a major step towards seamless transactions with the launch of the Nokia NFC Shell, a cutting-edge technology that enables secure, contactless data transfer and payment processing over short distances.",3
"Nokia's NFC Shell: A Game-Changer in Proximity-Based Data Transfer - By guest contributor Josh Pereira. Nokia has pushed the boundaries of mobile technology with the introduction of the NFC Shell, a groundbreaking innovation that utilizes Near Field Communications to facilitate rapid, secure data exchange between devices over short ranges, opening up new possibilities for mobile applications and services.",3
"Breaking News: Cutting-Edge Televisions Integrated into Handheld Devices - The convergence of cutting-edge television technology and smartphone capabilities is about to revolutionize the way we consume entertainment. Cellphones, already equipped with high-resolution cameras, internet connectivity, and music capabilities, are set to seamlessly integrate with high-definition television capabilities, creating a new era of immersive multimedia experiences.",3
"Futuristic Development: TV-Phone Hybrids on the Horizon - A groundbreaking innovation is emerging in the world of technology, as the boundaries between cellphones and televisions continue to blur. Upcoming smartphones will feature high-definition television capabilities, allowing users to enjoy crystal-clear visuals and seamless streaming on-the-go. This convergence of technologies is poised to transform the way we access and engage with entertainment content.",3
"Innovative Breakthrough: TV-Embedded Smartphones Set to Disrupt the Status Quo - The fusion of television and smartphone technologies is on the cusp of a major breakthrough, as high-definition television capabilities are being integrated into handheld devices. This revolutionary development promises to redefine the entertainment landscape, enabling users to enjoy high-quality visuals and interactive multimedia experiences wherever they go.",3
"The Texas Longhorns staged a remarkable comeback, overcoming a 28-point deficit to claim a thrilling 56-35 win over Oklahoma State in the NCAA showdown at Darrell K Royal-Texas Memorial Stadium in Austin, Texas. Cedric Benson's dominant performance on the ground, totaling 140 yards and five touchdowns, proved the difference-maker for the sixth-ranked Longhorns.",1
"The sixth-ranked Texas Longhorns mounted a stunning comeback, erasing a 28-point deficit to emerge victorious with a 56-35 triumph over 19th-ranked Oklahoma State in the NCAA game at Darrell K Royal-Texas Memorial Stadium. Cedric Benson's impressive rushing effort, featuring 140 yards and five touchdowns, propelled the Longhorns to their win.",1
"In a dramatic turnaround, the Texas Longhorns overcame a 28-point deficit to secure a 56-35 win over Oklahoma State in the NCAA matchup at Darrell K Royal-Texas Memorial Stadium. Cedric Benson's strong performance on the ground, yielding 140 yards and five touchdowns, played a crucial role in the Longhorns' come-from-behind victory.",1
"Maria's Wimbledon Victory Sparkles as She Dominates the Court - It's one thing to win the coveted Grand Slam title, quite another to navigate the pressure that comes with it. By Anja Niedringhaus, AP.",1
"Maria's Tennis Triumph: A Champion's Life in the Spotlight - Winning the prestigious Wimbledon tournament is a remarkable feat, but it's a different story when you're thrust into the global spotlight. By Anja Niedringhaus, AP.",1
"Maria's Wimbledon Championship: The Highs and Lows of Tennis Stardom - Securing the top prize in tennis is a remarkable achievement, but it's a double-edged sword, bringing both accolades and intense scrutiny. By Anja Niedringhaus, AP.",1
"The African Union is investigating a grave breach of the fragile ceasefire agreement in the war-torn Darfur region. The small village of mud and straw huts lies in ruins, its residents forced to flee their homes after Sudanese military forces launched a devastating aerial assault, leaving the ground scorched and charred. The United Nations had set a deadline for the violence to cease, but it appears the Sudanese government has failed to comply.",0
"The African Union has launched a probe into the Sudanese government's blatant disregard for the ceasefire agreement in Darfur. The once-peaceful village of mud and straw huts is now a desolate wasteland, its inhabitants displaced and traumatized after a brutal aerial attack by Sudanese warplanes and helicopters. The international community is urging the Sudanese government to respect the UN-backed ceasefire and end the violence that has ravaged the region.",0
"The African Union is conducting an urgent investigation into the Sudanese military's violation of the ceasefire agreement in the Darfur region. The village, once a thriving agricultural community, is now a scene of utter devastation, with charred and smoldering ruins as far as the eye can see. The UN has repeatedly called for an end to the violence, but the Sudanese government's actions suggest a blatant disregard for international law and the well-being of its own citizens.",0
"Enron and Merrill Lynch employees receive severe penalties - A landmark ruling has been made, with a top Enron executive and four former Merrill Lynch investment bankers found guilty of criminal conspiracy and fraud. This significant verdict sets a precedent for future corporate fraud cases, paving the way for further prosecutions.",2
"A major milestone in the Enron saga - The US justice system has delivered a stern message to corporate America, with a high-ranking Enron executive and four former Merrill Lynch bankers convicted of conspiracy and fraud. This guilty verdict sends a strong signal that the government will not tolerate financial impropriety and will aggressively pursue those responsible.",2
"The Enron-Merrill Lynch fraud trial concludes with guilty verdicts - A significant chapter in the Enron scandal has come to a close, with a top Enron executive and four former Merrill Lynch bankers held accountable for their roles in a conspiracy and fraud scheme. This outcome marks a major victory for regulators and law enforcement, demonstrating their commitment to upholding the integrity of the financial markets.",2
"The Federal Trade Commission (FTC) has launched a high-stakes operation to cripple the operations of Seismic Entertainment Productions and SmartBot.Net, two notorious entities notorious for perpetuating malicious spyware. By taking legal action, the FTC aims to prevent these entities from further compromising the security and privacy of millions of users.",3
"In a bold move, the Federal Trade Commission has taken the initiative to dismantle Seismic Entertainment Productions and SmartBot.Net, two companies infamous for distributing invasive spyware. The FTC's swift action is intended to safeguard the digital well-being of consumers and prevent the proliferation of malicious software.",3
"The Federal Trade Commission has embarked on a mission to neutralize Seismic Entertainment Productions and SmartBot.Net, two entities notorious for disseminating insidious spyware. By taking decisive legal action, the FTC aims to protect the digital integrity of users and prevent the spread of harmful software.",3
"Innovative Gaming Strategies for Enhanced Wellness - Medical professionals are unanimous in their belief that digital games can significantly contribute to overall health and well-being. However, there is a lack of consensus on the most effective methods for achieving this goal. By Noah Shachtman.",3
"Harnessing the Power of Play for Improved Health Outcomes - Healthcare specialists concur that interactive entertainment can play a pivotal role in promoting physical and mental well-being. Despite this, there is ongoing debate about the most optimal approaches to achieving this objective. By Noah Shachtman.",3
"Unlocking the Potential of Gamification for Health Advancements - Medical researchers are convinced that strategically designed games can have a profound impact on public health. However, there is a need for further investigation into the most effective strategies for leveraging this technology. By Noah Shachtman.",3
