text,label
"The stock price of Hot House Growers Income Fund takes a hit, dropping by 35% or more, after the fund's management announces a suspension of dividend payments, sparking investor concerns about the fund's financial health.",2
"Arkansas's political landscape is undergoing a seismic shift, as the 2004 presidential election transforms the state into a key battleground.",0
"The once-blue state of Arkansas has turned into a critical swing state, with Democrats and Republicans vying for control in the upcoming presidential election.",0
"As the 2004 election approaches, Arkansas is emerging as a crucial battleground in the US presidential race, with voters increasingly divided along party lines.",0
"A US legislative proposal seeks to criminalize the unauthorized recording of feature films in cinemas, effectively outlawing the practice across the country.",0
"The US government is set to introduce a bill aimed at combating film piracy, which would make it a serious offense to use video cameras to capture copyrighted movie content in cinemas nationwide.",0
"A new US law draft targets the theft of cinematic intellectual property, making it a state-wide crime to record copyrighted films in movie theaters without permission.",0
"A devastating blast rocked the Mediterranean coastal city of Antalya, Turkey, killing a 17-year-old tourist and leaving another critically injured, as the region remains a popular destination for British travelers.",0
"In a shocking incident, a teenager succumbed to injuries sustained in an explosion at the Turkish resort city of Antalya, which is known for its picturesque beaches and vibrant nightlife, drawing millions of international visitors each year.",0
"The Mediterranean resort city of Antalya, Turkey, was shaken by a powerful explosion, resulting in the tragic loss of a 17-year-old life and serious injuries to another, as the region's tourism industry continues to thrive amidst growing global tensions.",0
"The Bureau of Labor Statistics reported a modest 112,000 job growth in the US labor market in November, falling short of market expectations and underscoring the ongoing struggle to maintain economic momentum.",2
"The latest employment report revealed a sluggish 112,000 job creation in November, a significant slowdown from the previous month, and highlighting the need for policymakers to address the labor market's underlying structural issues.",2
"The US economy saw a lackluster 112,000 job addition in November, failing to keep pace with the growing workforce, and sparking concerns about the sustainability of the economic recovery in the face of persistent demographic pressures.",2
"AMD64, a pioneering computing platform, was charted to manufacture AMD's proprietary processors in 2006. This groundbreaking innovation extends the x86 architecture to accommodate 64-bit processing, revolutionizing the way computers operate. By refining the x86-64 framework, AMD's enhancements empower users of laptops and desktops to harness the full potential of 64-bit computing.",3
"In 2006, AMD embarked on a mission to manufacture AMD64, a cutting-edge computing platform that significantly upgrades the x86 architecture to support 64-bit processing. This technological advancement enables laptops and desktops to efficiently process vast amounts of data, ushering in a new era of computational power and versatility.",3
"AMD64, a trailblazing computing platform, was launched in 2006 with the goal of manufacturing AMD's custom-designed processors. By expanding the x86 architecture to accommodate 64-bit processing, AMD's innovations grant users of laptops and desktops unparalleled access to enhanced processing capabilities, redefining the boundaries of computing performance and efficiency.",3
"Norfolk's MLB dreams hit a snag as Washington officials announce plans to relocate the Montreal Expos to the nation's capital, leaving the city's hopes of hosting the team in shambles.",1
"The Montreal Expos' potential relocation to Washington has Norfolk fans feeling deflated, as the team's future in the Canadian city seems increasingly uncertain and a move to the nation's capital appears more likely.",1
"The Expos' relocation saga took a dramatic turn as Washington officials revealed plans to bring the team to the nation's capital, leaving Norfolk's MLB aspirations in limbo and sparking concerns about the impact on the city's sports landscape.",1
"Oil prices plummeted to a three-month low on Wednesday, eroding nearly $8 in just seven trading sessions, as unseasonably mild winter weather in the US and projections of increased heating fuel inventories continued to weigh on the market.",2
"The crude oil market suffered a sharp decline on Wednesday, dipping to a new three-month trough, as forecasts of a rise in heating fuel supplies and a lack of demand due to the mild winter weather in the United States exerted downward pressure on prices.",2
"Oil futures tumbled to a three-month low on Wednesday, shedding nearly $8 in just seven trading days, as a mild winter in the US and expectations of a surge in heating fuel stockpiles fueled concerns about oversupply and put downward pressure on the market.",2
"Oil prices surged to $54 a barrel on Thursday, driven by concerns over the global heating fuel supply ahead of winter. Market analysts expect the upcoming inventory report to reveal a significant decline in heating fuel stocks, sparking a rally in crude oil prices.",2
"The global energy market saw a significant upswing, with oil prices reaching $54 a barrel on Thursday. The uptick is attributed to the looming winter season, which has led to concerns about the availability of heating fuel. Industry experts anticipate that the upcoming inventory report will indicate a severe shortage of heating fuel, further driving up oil prices.",2
"Oil futures rose to $54 a barrel on Thursday, amid growing anxiety over the impending winter season's impact on global heating fuel supplies. Market insiders predict that the upcoming inventory data will reveal a critical shortage of heating fuel, leading to a surge in oil prices.",2
"Florida's highest court grapples with tobacco industry's market dominance, examining the feasibility of a massive class-action lawsuit on behalf of thousands of cigarette consumers.",2
"The Florida Supreme Court convened to deliberate on the merits of a sprawling class-action suit against major tobacco corporations, scrutinizing the claims of thousands of smokers seeking damages.",2
"In a high-stakes legal showdown, Florida's Supreme Court justices probed the viability of a class-action lawsuit against tobacco companies, weighing the potential financial implications for the industry and affected consumers.",2
"A Taiwanese man breached the security perimeter of the Taipei Zoo, entering the enclosure of a pride of lions and attempting to intervene, shouting ""Jesus will save you"" before being attacked and bitten by the big cats.",0
"In a bizarre incident at the Taipei Zoo, a Taiwanese individual disregarded safety protocols and entered the lion enclosure, shouting a religious phrase before being bitten by the animals and subsequently removed by zoo authorities.",0
"A man from Taiwan was bitten by lions at the Taipei Zoo after he jumped into their enclosure, claiming that Jesus would save them, prompting concerns about the incident and the zoo's safety measures.",0
"Germany's Industrial Dispute Resolution: Bochum Workers End Strike, Resume Production",0
European Labor Tensions Ease as Bochum GM Plant Workers Vote to Return to Work,0
International Relations: Germany's Bochum GM Plant Strike Ends as Workers Accept Job Cut Compromise,0
"Ask Jeeves, a pioneering artificial intelligence-powered search engine, has entered the fray to conquer the digital landscape of personal computers. In its quest to tame the chaotic sprawl of user data, Ask Jeeves leverages its cutting-edge algorithms to categorize and streamline information.",3
"The latest entrant in the desktop search engine wars is Ask Jeeves, a revolutionary AI-driven platform designed to harmonize the digital disarray plaguing computer users. By harnessing the power of machine learning, Ask Jeeves endeavors to impose order on the digital chaos, making it easier for users to locate vital information.",3
"In a bold move to disrupt the status quo, Ask Jeeves has launched a full-scale assault on the desktop search landscape. With its sophisticated natural language processing capabilities, Ask Jeeves aims to corral the scattered digital assets on users' computers, rendering it an indispensable tool for information retrieval and management.",3
"The US GDP growth rate accelerated in the second quarter, exceeding expectations, as business inventory accumulation surged at its highest pace in four years, according to the government's latest economic report.",2
"The economic outlook has brightened as the US economy expanded at a faster clip in the second quarter, driven by a substantial increase in business stockpiling, which reached a four-year high, the government announced.",2
"The US economic performance in the second quarter showed a significant improvement, with business inventory growth reaching its strongest level in four years, the government reported, indicating a stronger-than-expected economic expansion.",2
Newcastle United to Unveil New Manager Today - Souness Departs Blackburn Rovers After Announcing Surprise Resignation to Players.,1
"The Magpies to Reveal New Gaffer - Souness Steps Down as Blackburn Rovers Manager, Leaving Players in Shock.",1
"Souness Set to Leave Blackburn Rovers, Newcastle United Expected to Announce New Head Coach Today, Following Shock Resignation.",1
"The next generation of track and field athletes is set to shine as the Olympic Games kick off, featuring a fresh crop of young talent bursting with speed, agility, and endurance.",1
"A tidal wave of youthful energy is about to hit the track and field events at the Olympic Games, as a new batch of athletic prodigies prepare to make their mark in the world of sports.",1
"The Olympic Games are poised to witness the emergence of a new era of track and field excellence, as a talented group of young athletes, honed by years of dedication and training, take to the track to showcase their remarkable skills.",1
"The Federal Property Fund of Russia announces its intention to proceed with the auction of Yuganskneftegaz, the core subsidiary of YUKOS, a prominent oil giant, despite a court injunction from the United States to suspend the sale, which was imposed by the Russian government.",2
"Russia's Federal Property Fund has reaffirmed its commitment to conducting an auction for Yuganskneftegaz, the primary operating unit of YUKOS, a leading oil producer, despite a US court ruling to freeze the state-ordered sale, which was initiated by the Russian authorities.",2
"The Russian Federal Property Fund has confirmed its plan to go ahead with the public sale of Yuganskneftegaz, YUKOS' flagship subsidiary, in the face of a US court order to halt the sale, which was mandated by the Russian government as part of its efforts to restructure the energy sector.",2
"Israeli Forces Conduct Large-Scale Operation in Jenin, Clashes Erupt with Palestinian Militants",0
"Israeli Military Infiltrates Jenin, West Bank, Triggering Fierce Gun Battles with Palestinian Resistance Fighters",0
"Israeli Defense Forces Launch Major Counter-Terrorism Operation in Jenin, Engaging in Intense Firefights with Palestinian Insurgents",0
"Alaska Scientists Pursue Groundbreaking Research on Elusive Duck Species (AP) - A team of scientists at the Alaska Sealife Institute is conducting a pioneering study to understand the reproductive habits of the critically endangered Steller's Eider, a rare sea duck species facing extinction in Alaska.",3
"Researchers at the University of Alaska Fairbanks are undertaking a groundbreaking project to investigate the mating patterns of the Steller's Eider, a critically endangered sea duck species, to develop effective conservation strategies and prevent its decline in the wild.",3
"A team of wildlife biologists at the Alaska Department of Fish and Game has launched a comprehensive study to uncover the reproductive secrets of the Steller's Eider, a rare and endangered sea duck species, with the goal of informing habitat preservation and population management efforts in Alaska.",3
"Iraqi President Criticizes Disbandment of Military - Ghazi al-Yawer, the interim leader of Iraq, strongly condemns the US-led coalition's decision to dissolve the Iraqi military following the 2003 invasion, which he believes has led to widespread instability in the country.",0
"Iraq's Interim President Blasts Coalition for Disbanding Army - Ghazi al-Yawer, the interim president of Iraq, has publicly criticized the US-led coalition for its decision to disband the Iraqi military in the aftermath of the 2003 invasion, saying it has contributed to the country's current security challenges.",0
"Iraqi President Slams Coalition for Disintegrating Military - Ghazi al-Yawer, Iraq's interim president, has sharply criticized the US-led coalition for its decision to dissolve the Iraqi military after the 2003 invasion, arguing that it has exacerbated the country's political and security crises.",0
"Experts predict a record-breaking year for US insurance payouts, with the four hurricanes that ravaged Florida this season surpassing the insured losses from Hurricane Andrew, potentially making this the country's most expensive hurricane season in history, according to Tuesday's announcement.",2
"The US insurance industry is bracing for a record-breaking year, as the devastating hurricanes that struck Florida this season have led to unprecedented insured losses, exceeding those of Hurricane Andrew, and potentially making this the nation's most costly hurricane season on record, officials reported Tuesday.",2
"A record-breaking year for US insurance claims is on the horizon, as the four hurricanes that hit Florida this season have generated insured losses exceeding those of Hurricane Andrew, potentially making this the country's most expensive hurricane season in history, according to Tuesday's statement from insurance officials.",2
"Bird asserts that his team is fully behind Ron Artest, as police investigation footage reveals. The Indiana Pacers' top executive, Donnie Walsh, confirms the team has yet to determine whether it will challenge the NBA's sanctions against Ron Artest and two other Pacers players following the chaotic altercation in Detroit.",1
"The Indiana Pacers' star player, Bird, vocally backs Ron Artest, citing footage from the police review. Team president Donnie Walsh states the team is still deliberating on whether to appeal the NBA's suspensions of Artest and two other Pacers players, who were involved in the intense brawl in Detroit.",1
"Pacers forward Bird publicly endorses Ron Artest, as the police investigation video confirms. Donnie Walsh, the team's executive director, reveals the team is still weighing its options regarding the appeal of the NBA's penalties against Artest and two other Pacers players, who were part of the violent incident in Detroit.",1
"Champion jockey Kieren Fallon was granted bail after being detained for suspected involvement in a major horse racing scandal, allowing him to continue training for the upcoming Epsom Derby.",1
"Kieren Fallon, a renowned jockey, was released on bail pending further investigation into allegations of match-fixing in British thoroughbred horse racing, with the sport's governing body taking swift action to maintain integrity.",1
"Jockey Kieren Fallon, a three-time champion, was released from custody after posting bail, as authorities probe claims of corruption in the British horse racing industry, with the sport's integrity at stake.",1
"The Dow Jones Industrial Average surged 1.2% on Monday, fueled by a blockbuster earnings report from tech giant Alphabet Inc. Investors rejoiced as the company's stock price soared, eclipsing the S&P 500's gains.",2
"A new market research report from Morgan Stanley predicts a 5% increase in global luxury goods sales by 2025, driven by increased consumer spending in emerging markets. The report cites the rise of e-commerce and social media as key factors contributing to the growth.",2
"The Federal Reserve announced a surprise rate hike on Wednesday, sending shockwaves through the financial markets. The move is expected to boost interest rates and slow down inflation, a move welcomed by investors seeking to diversify their portfolios.",2
"Australian tennis ace Alicia Molik stormed into the Zurich Challenge final, defeating top-seeded Swiss player Patty Schnyder 4-6, 6-1, 6-4 in a thrilling match.",1
"Alicia Molik, the Australian tennis sensation, booked her spot in the Zurich Challenge final with a hard-fought 4-6, 6-1, 6-4 victory over hometown favourite Patty Schnyder.",1
"In a stunning upset, Australian tennis player Alicia Molik outplayed 10th-seeded Patty Schnyder, winning 4-6, 6-1, 6-4 to advance to the Zurich Challenge final.",1
"Nokia's Earnings Surge on Robust Demand, Shares Soar",2
"Nokia Ups Ante with Bullish Forecast, Share Price Soars",2
"Nokia's Q3 Outlook Revised Higher, Market Sentiment Shifts Positive",2
"Hurricane Frances makes landfall in Florida, causing widespread power outages and destruction, leaving millions without electricity and disrupting international trade routes.",0
"The United States is grappling with the aftermath of Hurricane Frances, which ravaged Florida's eastern coast, causing catastrophic damage to infrastructure and leaving four million people without access to basic necessities, including electricity and clean water.",0
"The international community is on high alert as Hurricane Frances brings devastation to Florida, crippling the state's power grid and disrupting global supply chains, with the potential for long-term economic consequences and humanitarian crises.",0
"Mellon Financial Corporation has entered into a definitive agreement to acquire The Providence Group Investment Advisory Company, a privately held investment management firm, in a deal that is expected to bolster its asset management capabilities.",2
"Mellon Financial Corporation has announced a strategic acquisition of The Providence Group Investment Advisory Company, a leading private investment advisory firm, to expand its presence in the global financial services market.",2
"Mellon Financial Corporation, a leading financial institution, has signed a binding agreement to acquire The Providence Group Investment Advisory Company, a respected private investment firm, to strengthen its position in the competitive investment management industry.",2
"Electronic Arts' Stock Soars on NFL Partnership - The leading video-game developer's shares skyrocketed on Tuesday after securing an exclusive deal with the National Football League, granting it access to utilize team logos, player likenesses, and real-world game data in its popular video game franchises.",3
"EA's Market Value Boosted by NFL Licensing Agreement - The video-game giant's stock price surged on Tuesday following the announcement of a strategic partnership with the National Football League, which will enable EA to integrate authentic NFL teams, players, and game data into its digital titles.",3
"NFL Partnership Fuels Electronic Arts' Dominance in Esports - Electronic Arts, a pioneer in the gaming industry, saw its stock price rise sharply on Tuesday after striking a groundbreaking deal with the National Football League, securing exclusive rights to incorporate official NFL teams, players, and game data into its popular sports simulation games.",3
"French aerospace conglomerate Snecma, a leading manufacturer of commercial and military aircraft engines, has announced a strategic merger with Sagem, a prominent producer of defense electronics and mobile communication devices. The combined entity, valued at approximately €7 billion, will become a dominant player in the global aeronautics industry.",2
"In a major development, state-owned French aeronautics giant Snecma has agreed to merge with Sagem, a leading defense and technology firm, in a deal worth around €7 billion. The merged entity will create a powerful player in the global aerospace market, with a strong presence in both commercial and defense sectors.",2
"Snecma, a French aeronautics company specializing in aircraft engine production, and Sagem, a leading provider of defense electronics and mobile communication systems, have reached an agreement to merge, creating a €7 billion entity that will be a major force in the global aeronautics industry.",2
"Iraqi authorities reported a devastating suicide bombing at a military base in the country's northwestern region, resulting in the deaths of at least 10 individuals and over 20 injuries. The attack, which occurred on Wednesday, has sparked widespread concern about the ongoing instability in the region.",0
"A deadly suicide bombing struck a military compound in Iraq's northwestern outskirts on Wednesday, leaving at least 10 people dead and more than 20 others wounded. The attack, claimed by the Iraqi government, highlights the ongoing security challenges facing the country.",0
"A suicide bomber detonated an explosives-laden vehicle at an Iraqi military base in the northwest on Wednesday, killing at least 10 people and injuring over 20 others. The incident has raised concerns about the spread of violence in the region and the ability of authorities to maintain security.",0
"Vijay Singh secures the championship with a three-stroke victory at the 84 Lumber Classic golf tournament in Farmington, Pennsylvania, shooting a 69 on the final day.",1
"Singh clings to the top spot at the 84 Lumber Classic, carding a three-under-par 69 to take the title in Farmington, Pennsylvania, and extend his winning streak.",1
"In a thrilling finish, Vijay Singh emerges victorious at the 84 Lumber Classic, recording a three-under 69 on the final round to claim the championship trophy in Farmington, Pennsylvania.",1
UPDATE 1-Lewis seizes the top spot with a thrilling 62 at the Funai Classic - JL Lewis unleashed a breathtaking 10-under-par 62 to claim a two-stroke lead after the opening round of the prestigious Funai Classic golf tournament at the iconic Walt Disney Resort on Thursday.,1
"LEWIS LEADS THE CHARGE! - With a phenomenal 62, JL Lewis takes the reins at the Funai Classic - The American golfer put on a show, firing a scintillating 10-under-par 62 to establish a two-shot advantage after the opening round of the highly anticipated Funai Classic at the legendary Walt Disney Resort.",1
"Lewis Sizzles at Funai Classic - JL Lewis scorched the course with a sizzling 62 to take the top spot - The talented golfer delivered a masterclass performance, carding a 10-under-par 62 to secure a two-stroke lead after the opening round of the high-stakes Funai Classic at the esteemed Walt Disney Resort.",1
"LG Electronics is poised to revolutionize the mobile photography landscape with the imminent release of a cutting-edge 7MP camera phone, marking a significant leap forward in the quest for superior image quality.",3
"The mobile phone industry is experiencing a paradigm shift with LG Electronics' forthcoming introduction of a 7-megapixel camera phone, which is expected to surpass the resolution of traditional digital cameras and redefine the boundaries of mobile photography.",3
"In a breakthrough move, LG Electronics is set to unveil a 7MP camera phone, a major milestone in the development of mobile photography technology, as the company continues to push the limits of innovation in the digital imaging sector.",3
"Tensions escalate in Iraq as insurgency gains momentum - The recent surge in attacks bears striking similarities to past conflicts, with distinct differences in tactics and motivations.",0
"Iraq gripped by escalating violence as rebel groups intensify campaign - The current wave of attacks shares eerie parallels with previous insurgencies, marked by divergent goals and methods.",0
"Iraqi government struggles to contain spiraling violence as militant groups escalate attacks - The recent upsurge in violence bears haunting similarities to past conflicts, with varying degrees of brutality and political objectives.",0
"Tearful Paula Radcliffe breaks down after Olympic marathon collapse - Paula Radcliffe's Olympic marathon dreams were shattered as she faltered in the final stretch, leaving her in tears. The exhausted athlete sobbed uncontrollably, confessing: ""I'm devastated, my body just gave out.""",1
"Radcliffe's Olympic marathon bid ends in heartbreak - Paula Radcliffe's bid for Olympic marathon gold came to a crushing end as she struggled to finish the grueling 26.2-mile course. The determined athlete wept openly, admitting: ""I'm crushed, I just couldn't push through the pain.""",1
"Radcliffe's Olympic marathon hopes dashed in dramatic fashion - Paula Radcliffe's Olympic marathon aspirations were left in tatters as she collapsed under the pressure, leaving her in tears. The courageous athlete broke down, saying: ""I'm shattered, I gave it my all, but it wasn't meant to be.""",1
Former NFL Player's Tragic Demise: Ex-Steelers Lineman's Chilling High-Speed Chase Ends in Fatal Crash,1
Steelers Legend's Dark Side: Ex-Justin Strzelczyk's Mental Health Struggles Led to Deadly Highway Pursuit,1
NFL Tragedy: Former Steelers Tackle's Mental Health Crisis Ends in Fatal Crash Following High-Speed Chase,1
"Boyd Gaming Secures Strategic Land Acquisition to Enhance Las Vegas Operations - In a significant move to strengthen its presence in the Las Vegas gaming market, Boyd Gaming has acquired 13 acres of prime real estate adjacent to its Stardust Resort and Casino, as disclosed in a recent regulatory filing.",2
