text,label
"Boyd Gaming Expands its Footprint on the Las Vegas Strip with Strategic Land Purchase - In a bid to boost its market share in the competitive Las Vegas gaming sector, Boyd Gaming has acquired a 13-acre parcel of land adjacent to its Stardust Resort and Casino, as revealed in a regulatory filing.",2
"Boyd Gaming's Strategic Land Acquisition to Support Growth Initiatives in Las Vegas - Boyd Gaming has made a strategic move to bolster its presence in the Las Vegas gaming market by acquiring 13 acres of land adjacent to its Stardust Resort and Casino, as detailed in a recent regulatory filing.",2
"The diplomatic efforts between Russia and Ukraine have reached a critical juncture, as tensions escalate over the disputed territories. In a surprising turn of events, the European Union has announced a unified stance against the Russian government, prompting a stern response from Moscow.",0
"The fragile truce between North Korea and South Korea has been put to the test as the two nations engage in high-stakes negotiations. The United States has been closely monitoring the situation, with top diplomats from both countries meeting in a last-ditch effort to avoid further escalation.",0
"A historic summit between the leaders of the United States and China has ended with a groundbreaking agreement on trade and security. The pact marks a significant shift in the global balance of power, as the two nations work to address their differences and strengthen their partnership.",0
"Tyrone Willingham tackles the helm as Washington's new head coach, marking the 22nd time the Huskies have made a quarterback change. Meanwhile, Lorenzo Romar stands watch, anticipating the onslaught of queries from the media that will soon converge on him.",1
"Willingham takes the reins as Washington's 22nd football coach, sending shockwaves through the Pac-12. As the spotlight shifts to the sidelines, Lorenzo Romar prepares to face the firing squad of reporters eager to dissect the new coaching regime.",1
"Tyrone Willingham assumes the role of head coach, putting his stamp on Washington's football program. Meanwhile, Lorenzo Romar stands poised, ready to field a barrage of questions from the media, who are hungry for insight into the new coaching staff's strategy and game plan.",1
"Telekom Malaysia Embarks on Global Expansion Strategy - Kuala Lumpur, Malaysia-based Telekom Malaysia Bhd. has initiated a strategic move to expand its presence globally, with a focus on the Indian and Indonesian markets. Although the company's international investments are expected to yield significant returns in the long run, it may take some time for the earnings to reflect this growth.",2
"Telekom Malaysia Takes Flight Abroad - Telekom Malaysia Bhd. has made a significant foray into the international market, with a dual focus on the Indian and Indonesian economies. As the company continues to diversify its revenue streams, investors can expect a gradual increase in earnings as its global investments mature.",2
"Telekom Malaysia's Global Ambitions Take Shape - Telekom Malaysia Bhd. has launched an ambitious expansion plan, targeting the Indian and Indonesian markets as key growth areas. While the company's international investments may not yield immediate results, analysts expect the earnings to strengthen significantly in the long term as its global presence solidifies.",2
"Baseball's integrity is under scrutiny - The sport's dark underbelly is finally being exposed, revealing a rampant use of performance-enhancing substances like the anabolic steroid ""clear"" and the human growth hormone ""cream"", which have tarnished the reputations of icons like Barry Bonds and Jason Giambi.",1
"The MLB's dirty laundry is being aired - The league's long-buried secret is spilling out, exposing the widespread abuse of performance-enhancing drugs, including the highly potent ""clear"" and ""cream"", which have sullied the legacies of baseball legends like Barry Bonds and Jason Giambi.",1
"Baseball's tainted past is coming to light - The sport's dark history is being revealed, with the disturbing truth about the widespread use of performance-enhancing substances like ""clear"" and ""cream"" emerging, casting a shadow over the careers of stars like Barry Bonds and Jason Giambi.",1
"Advancements in digital broadcasting have led to the emergence of podcasts, a revolutionary technology that transmits internet audio content directly to portable media devices, such as iPods and MP3 players. This innovative format has gained immense popularity among individuals who cannot access live broadcasts. By Daniel Terdiman, a renowned tech journalist, explores the world of podcasting in this thought-provoking article.",3
"The rise of podcasting has disrupted the traditional broadcasting landscape, enabling users to access internet-based audio programs directly on their mobile devices. This cutting-edge technology, which has gained widespread adoption, allows individuals to enjoy their favorite shows on-demand, eliminating the need for real-time viewing. According to Daniel Terdiman, an expert in the field of digital media, podcasting has become a game-changer in the world of online entertainment.",3
"Podcasting, a pioneering technology, has transformed the way we consume audio content, enabling users to receive internet-based programs directly on their portable devices, such as iPods and MP3 players. By leveraging advanced digital broadcasting capabilities, podcasting has become a preferred medium for those who cannot access live broadcasts. In this insightful article, Daniel Terdiman, a leading tech authority, delves into the world of podcasting, exploring its growth, benefits, and future prospects.",3
"Indonesian President Megawati Sukarnoputri has issued a formal appeal to the captors of two Indonesian nationals held hostage in Iraq, urging them to release the women and refrain from making further demands.",0
"The Indonesian government has intensified its diplomatic efforts to secure the release of the two Indonesian women being held hostage in Iraq, with President Megawati Sukarnoputri personally appealing to the captors to free the hostages and abandon their demands.",0
"In a move to diffuse the crisis, Indonesian President Megawati Sukarnoputri has publicly appealed to the hostage-takers in Iraq, requesting the immediate release of the two Indonesian women and warning that any further escalation could have severe consequences for regional stability.",0
"Vitali Klitschko readies for intense battle as he puts his WBC heavyweight championship on the line against formidable opponent Danny Williams in the electrifying city of Las Vegas. With a formidable record of 34-and-2, boasting 33 devastating knockouts, Klitschko is set to put his title defense skills to the test.",1
"Klitschko gears up for the ultimate showdown as he faces off against Danny Williams in a thrilling WBC heavyweight title bout in the sports capital of the world, Las Vegas. With a staggering 34 wins and only 2 losses, Klitschko's impressive 33 knockouts will be put to the ultimate test as he seeks to defend his coveted title.",1
"The boxing world is abuzz as Vitali Klitschko prepares to put his WBC heavyweight championship on the line against the formidable Danny Williams in a highly anticipated Las Vegas showdown. With an impressive record of 34 wins and 2 losses, including an astonishing 33 knockouts, Klitschko is determined to prove his mettle as a top-tier heavyweight contender.",1
"Yasser Arafat's demise clears path for Middle East diplomacy. The Palestinian icon's passing presents a rare chance for Israel and Palestine to reconcile. The Palestinian leader's prolonged presence had hindered progress, and his recent rejection by Israel created an impasse.",0
"Arafat's passing creates a window of diplomatic opportunity in the Middle East. The Palestinian leader's legacy loomed large, but his recent rejection by Israel had stalled peace efforts. His death may facilitate a fresh start in negotiations between the two nations.",0
"The passing of Yasser Arafat marks a turning point in the Israeli-Palestinian conflict. The Palestinian leader's prolonged influence had hindered peace talks, and his recent rejection by Israel had created a stalemate. His death may now pave the way for a new era of cooperation and dialogue between the two sides.",0
"Australia's batting lineup dominated the opening day of the Test match against India, taking control of the game despite the rain-soaked conditions. The morning session was completely lost due to the inclement weather, and only a brief afternoon session was possible before the rain returned, forcing the teams to abandon play.",1
"The Australian cricket team made a strong statement on the first day of the Test, asserting their authority over India in a rain-affected match. The morning was a washout, with the rain causing a lengthy delay, and the afternoon saw only a limited 20 overs of play before the rain returned, forcing the teams to halt the game.",1
"The Australians started strongly in the final Test of the series, claiming the initiative on a rain-hit day in India. The morning was ruined by the rain, with no play possible, and the afternoon saw a brief 20-over spell before the rain returned, leaving the teams with a long wait for the next day's play.",1
"Pfizer Corporation has reached a significant agreement to settle outstanding asbestos-related claims, committing to a substantial payment of $430 million to address injuries allegedly caused by its subsidiary's insulation products.",2
"In a major development in the pharmaceutical industry, Pfizer Inc. has agreed to a $430 million settlement to resolve asbestos claims stemming from its subsidiary's manufacturing of insulation products, which have been linked to worker injuries.",2
"The global pharmaceutical giant Pfizer has struck a major deal to settle asbestos-related lawsuits, pledging to pay $430 million to compensate individuals allegedly harmed by its subsidiary's insulation products, which were manufactured and sold in the past.",2
"Technological advancements in digital broadcast recording are revolutionizing the music industry, enabling individuals to capture satellite and internet radio transmissions with unprecedented precision. This innovation is a significant breakthrough in the ongoing battle against music piracy, as it empowers consumers to digitally document and preserve their favorite broadcasts.",3
"The advent of digital broadcast recording technologies has created a new paradigm in the music industry, allowing individuals to capture high-quality satellite and internet radio transmissions with ease. This development is a critical step forward in the fight against music piracy, as it provides a secure and reliable means of recording and archiving digital broadcasts.",3
"The proliferation of digital broadcast recording technologies is transforming the music industry, enabling the precise capture of satellite and internet radio transmissions. This breakthrough has significant implications for the ongoing struggle against music piracy, as it provides a powerful tool for consumers to document and preserve their favorite broadcasts, while also enabling the music industry to monitor and protect its intellectual property.",3
"Tensions escalate as gruesome video emerges of 12 Nepalese hostages brutally executed by Iraqi militant group - The footage, allegedly released by ISIS affiliates, sparks outrage and condemnation from the international community.",0
"Nepalese officials confirm reports of mass execution in Iraq as video surfaces showing 12 nationals brutally killed by insurgent forces - The graphic footage, posted online by extremist group, heightens concerns over escalating violence in the region.",0
"Global condemnation pours in as video of 12 Nepalese hostages being brutally murdered by Iraqi militant forces spreads online - The horrific footage, attributed to ISIS-affiliated group, raises alarm over deteriorating humanitarian situation in the war-torn country.",0
"NHL Commissioner Slams Player's Union Over Lockout Threats - A top NHL executive has labeled the players' association's negotiating tactics as a ""farce"" and claimed they're not interested in reaching a new collective bargaining agreement before imposing a lockout in three weeks, which would force the cancellation of regular-season games.",1
"Dispute Heats Up Between NHL and Player's Union - The NHL's leadership accused the players' union of stalling and refusing to budge on key issues, leading the league to threaten a lockout in three weeks if a new agreement isn't reached. The union, however, maintains they're willing to negotiate in good faith.",1
"Tensions Escalate as NHL Lockout Looms - The NHL and its players' union are at a stalemate, with the league claiming the union is not taking their proposals seriously and refusing to make concessions. The threat of a lockout in three weeks is growing, and fans are worried about the potential impact on the upcoming season.",1
"Microsoft Partners with PalmOne in a Deal that Threatens Market Dominance - NEW YORK - The software giant Microsoft has formed a strategic alliance with PalmOne, a leading manufacturer of handheld devices, which could have far-reaching implications for the mobile technology industry. The partnership is expected to disrupt the competitive landscape, potentially harming Good Technology, a startup with high growth potential and a planned initial public offering.",2
"PalmOne and Microsoft Team Up in a Move that Challenges Industry Status Quo - NEW YORK - In a surprise move, PalmOne, a prominent player in the mobile computing space, has partnered with Microsoft, the largest software company in the world, to develop a new range of products. This partnership is likely to have a negative impact on Good Technology, a startup with significant financial backing and ambitious expansion plans.",2
"Microsoft and PalmOne Form Alliance to Shake Up Mobile Market - NEW YORK - Microsoft, the technology behemoth, and PalmOne, a well-established player in the mobile device market, have announced a partnership that could alter the competitive dynamics of the industry. The deal is expected to have a negative impact on Good Technology, a startup with a strong financial backing and plans for an initial public offering, as it seeks to expand its market share.",2
"Sachin Tendulkar, the cricketing legend, is set to take the field once more. Can his trusty bat, affectionately known as his ""willow,"" lead India to victory against Australia in the ongoing Test series? Throughout his illustrious 15-year career, Tendulkar has only missed five Tests, with two of those absences coming during the current series against the Aussies.",1
"The cricket world is abuzz with the news that Sachin Tendulkar is returning to the pitch. As the Indian team prepares to face off against Australia, fans are eagerly awaiting the answer to one burning question: will Tendulkar's bat, his ""willow,"" prove to be a game-changer? With a remarkable 15-year career under his belt, Tendulkar has only missed five Tests, including two during the current series against the Australians.",1
"After a brief hiatus, cricket fans can rejoice as Sachin Tendulkar is set to return to the Test arena. As the Indian team gears up to take on Australia, the focus is on whether Tendulkar's ""willow"" will continue to wield its magic. Throughout his illustrious career, Tendulkar has only missed five Tests, with two of those absences occurring during the ongoing series against the Australians.",1
"Quantum Leap in Computing: Oracle's Acquisition of PeopleSoft Boosts Market Sentiment - A breakthrough in the realm of artificial intelligence has sent shockwaves through the tech community, as Oracle Corp. successfully integrates PeopleSoft Inc. into its ecosystem. This strategic move has sparked a surge in market indices, driven by the promise of enhanced data analytics and streamlined software solutions.",3
"Advances in Algorithmic Trading: Oracle's Acquisition of PeopleSoft Signals New Era in Financial Computing - The recent acquisition of PeopleSoft Inc. by Oracle Corp. has sent a clear signal to the tech world that the future of financial computing lies in the realm of artificial intelligence. This development has led to a significant increase in market activity, as investors capitalize on the potential for improved predictive modeling and automated trading strategies.",3
Cybersecurity Breakthrough: Oracle's Acquisition of PeopleSoft Enhances Data Protection - Oracle Corp.'s acquisition of PeopleSoft Inc. has marked a major milestone in the quest for cybersecurity. The integration of the two companies' expertise in data analytics and software development has resulted in a robust platform for protecting sensitive information and safeguarding against cyber threats. This development has sent a clear message to the tech community that the future of data protection lies in the hands of innovative companies like Oracle.,3
"Novell's SuSE 9.2 Linux package is slated for a timely November release, aligning with the company's previously announced schedule. The forthcoming update will mark the first in a series of bi-annual upgrades, building upon the current SuSE 9.1 version.",3
"Novell's SuSE 9.2 Linux distribution is on track to debut in November, as initially planned. This latest iteration will kick off a new cadence of regular, six-month updates, which will incrementally enhance the existing SuSE 9.1 edition.",3
"The SuSE 9.2 Linux package, developed by Novell, is poised to launch in November, as per the company's original timeline. This milestone will usher in a new era of frequent, bi-annual updates, which will continually refine and expand the capabilities of the current SuSE 9.1 release.",3
"IOC President praises Athens' exceptional Olympic hosting skills - Olympic supremo Jacques Rogge on Sunday delivered a glowing review of Athens' outstanding Games hosting abilities, praising the city's meticulous planning and flawless execution.",1
"Rogge hails Athens' triumphant Olympic performance - In his final address as President of the International Olympic Committee, Jacques Rogge lavished praise on Athens, commending the city's remarkable ability to deliver a seamless and thrilling Olympic experience.",1
"Athens earns top honors from IOC President Rogge - Following the close of the Olympic Games, IOC President Jacques Rogge publicly endorsed Athens as a top-tier host, citing the city's impressive logistical prowess, exceptional sports infrastructure, and enthusiastic fan support.",1
"In Kmart's Strategic Acquisition of Sears Holdings, a Gamble That Real Estate Can Trump Market Volatility - The Kmart takeover of Sears, Roebuck may be the ultimate demonstration of the age-old adage in retail real estate: prime location, proximity to consumers, and accessibility trump all.",2
"Kmart's Bold Move to Acquire Sears: A High-Stakes Bet on Retail Real Estate - The $8.6 billion purchase of Sears, Roebuck by Kmart may be the most significant example of how real estate can be a decisive factor in the retail industry, with prime locations and high foot traffic driving sales and profitability.",2
"Kmart's Acquisition of Sears: A Strategic Play on Real Estate and Market Share - The acquisition of Sears, Roebuck by Kmart marks a significant shift in the retail landscape, with the company betting that its strong real estate portfolio, including prime locations and vast customer base, will help it regain market share and profitability in a competitive market.",2
"Macedonia's referendum on Albanian autonomy falls short of threshold, sparking international concern - The Macedonian State Election Commission announced Monday that the referendum on territorial law aimed at granting greater autonomy to the Albanian minority in Macedonia failed to meet the required turnout, sparking widespread diplomatic concern in the region.",0
"Albanian minority's bid for autonomy in Macedonia rejected in referendum - The Macedonian State Election Commission reported Monday that the referendum on territorial law, intended to grant greater autonomy to the Albanian minority, fell short of the necessary turnout, dealing a blow to efforts to address long-standing ethnic tensions in the country.",0
"Macedonia's Albanian autonomy referendum defeated, regional stability at risk - The Macedonian State Election Commission announced Monday that the referendum on territorial law aimed at granting greater autonomy to the Albanian minority in Macedonia failed to garner the required turnout, heightening concerns about the potential for increased regional instability and diplomatic tensions in the wake of the failed vote.",0
"Tsunami relief efforts take center stage as Indian tennis players focus on ATP season-opener (AFP) - The international community rallies to support tsunami survivors, while Indian tennis players shift their attention to the upcoming ATP Chennai Open, aiming to raise funds and momentum for the new season.",0
"India's tennis community comes together to aid tsunami relief efforts ahead of ATP season-opener (AFP) - In the aftermath of the devastating tsunami, Indian tennis players and fans join forces to provide aid to affected communities, even as they prepare for the highly anticipated ATP Chennai Open.",0
"India's ATP Chennai Open tennis tournament to raise funds for tsunami victims (AFP) - As India begins to recover from the tsunami disaster, the ATP Chennai Open tennis tournament serves as a platform for players and fans to come together, raising vital funds for relief efforts and kicking off the new season with a sense of unity and resilience.",0
"Australian Pharmaceutical Industries' shares skyrocketed over 5% in morning trading after the healthcare giant announced a strategic acquisition of New Price Retail, a leading retailer of health, beauty, and lifestyle products.",2
"The Australian Pharmaceutical Industries (API) stock market rally accelerated today, with the company's shares surging more than 5% following the announcement of its takeover of New Price Retail, a prominent player in the retail pharmacy sector.",2
"In a bold move to bolster its retail presence, Australian Pharmaceutical Industries (API) revealed a major acquisition of New Price Retail, a popular retailer of health, beauty, and wellness products, sending its stock price soaring over 5% in early trading.",2
"Apple's stock price surges past \$50 on breakthrough iPod sales - The revolutionary music player has fueled a meteoric rise in Apple's valuation, with the company's market capitalization more than doubling since January.",3
"Apple's market capitalization soars above \$50 billion as iPod technology disrupts the music industry - The iPod's innovative design and user-friendly interface have driven unprecedented demand, propelling Apple's stock price to new heights and cementing its position as a leader in the tech sector.",3
"Apple's stock value exceeds \$50 billion as iPod sales data reveals exponential growth - The company's proprietary technology has enabled the iPod to dominate the portable music player market, resulting in a remarkable increase in Apple's market capitalization, which has more than doubled since January.",3
"Following the Iraq War, Spain Realigns its Global Focus on Latin America - SAN JOSE, Costa Rica (Reuters) - After a prolonged period of diversion due to the Iraq War and the War on Terror, Spain's newly elected socialist government is redirecting its attention towards Latin America, leveraging its unique historical and economic ties to strengthen its presence in the region.",0
"Spain Shifts its Diplomatic Priorities towards Latin America after Iraq - SAN JOSE, Costa Rica (Reuters) - With its Iraq War involvement now a distant memory, Spain's socialist administration is refocusing its international efforts on Latin America, where its historical and cultural connections provide a significant advantage in its diplomatic endeavors.",0
"Post-Iraq, Spain Revives its Latin American Engagement - SAN JOSE, Costa Rica (Reuters) - As the Iraq War recedes from the headlines, Spain's new socialist government is reinvigorating its relationships with Latin America, capitalizing on its historical bonds and economic synergies to enhance its regional influence.",0
"Researchers in the field of digital humanities have questioned David Hockney's longstanding theory that 15th-century artists employed camera obscura devices to aid their work. By applying advanced image processing algorithms and machine learning models, a team of scientists has disputed the notion that artists like Leonardo da Vinci and Michelangelo utilized these optical instruments to create their masterpieces.",3
"A new study published in the Journal of Computational Art History has cast doubt on David Hockney's 2001 assertion that Renaissance painters employed camera-like devices to capture realistic images. Using computer-aided design (CAD) software and computational modeling techniques, researchers have reconstructed the likely techniques used by artists during the early Renaissance, suggesting that Hockney's theory is unfounded.",3
"A team of computer vision experts has challenged David Hockney's long-standing hypothesis that artists from the early Renaissance period employed camera-like devices to achieve photorealism. By leveraging advanced computational methods, including computer-generated imagery (CGI) and digital image processing, the researchers have presented an alternative explanation for the artistic techniques used by masters like Raphael and Caravaggio, casting doubt on Hockney's original theory.",3
