text,label
"The latest iteration of Mandrake Linux, Mandrakelinux 10.1 Official, has been released, featuring enhanced mobile device compatibility, upgraded hardware drivers, and substantial advancements in software development.",3
"Mandrakelinux 10.1 Official, the latest version of the popular open-source operating system, has arrived, boasting extended support for mobile platforms, improved hardware compatibility, and a slew of major software updates.",3
"US President George W. Bush embarks on a whirlwind tour of a crucial electoral state, mobilizing his base in the lead-up to the Republican National Convention, where he will be officially nominated for a second presidential term.",0
"President George W. Bush traverses a pivotal swing state, whipping up support among voters ahead of the Republican National Convention, where he will be formally endorsed as the party's presidential candidate.",0
"US President George W. Bush undertakes a high-profile campaign swing through a battleground state, rallying supporters and energizing the party faithful ahead of the Republican National Convention, where he will be nominated for a second term as commander-in-chief.",0
"US Airways Seeks Court Approval to Terminate Collective Bargaining Agreements - US Airways, a major American airline, is seeking a federal court order to nullify its contracts with three labor unions, slash retiree health insurance costs, and eliminate its remaining defined-benefit pension plans.",2
"US Airways Pursues Judicial Intervention to Revise Labor Pacts - The US airline industry player, US Airways, is seeking judicial intervention to invalidate its collective bargaining agreements with three unions, reduce the financial burden of retiree healthcare expenses, and discontinue its defined-benefit pension plans.",2
"US Airways Seeks Judicial Relief to Realign Workforce and Benefits - US Airways, a major US airline, is seeking a court order to dissolve its contracts with three labor unions, reduce the financial strain of retiree healthcare benefits, and eliminate its defined-benefit pension plans to realign its workforce and benefit structure.",2
"Scientists: A recent NASA discovery suggests that the process of planetary formation may be slower than previously estimated, potentially taking millions of years for violent cosmic turbulence to transform space dust into new celestial bodies.",3
"According to a groundbreaking NASA finding, the transformation of interstellar dust into planetary systems may be a more gradual process than initially thought, with gravitational forces and turbulent gas dynamics playing a crucial role in shaping the formation of new worlds.",3
"Astronomers have uncovered new evidence that the formation of planets from space dust may be a prolonged process, potentially taking tens of millions of years, as NASA's advanced telescope technology reveals the complex interplay of gravitational forces and gas dynamics in the early stages of planetary development.",3
"The Raiders' disappointing performance on Sunday was a tough pill to swallow - OAKLAND - Despite the controversy surrounding the questionable call on rookie tackle Robert, the team's inability to capitalize on scoring opportunities was the real story. The officials' decision to flag Robert was a turning point, but it wasn't the sole reason for the loss.",1
"The Raiders' Sunday showdown ended in defeat - OAKLAND - As the dust settles on the game, one thing is clear: the team's struggles on both sides of the ball were the primary culprit. The referees' flag on Robert was a pivotal moment, but it was merely a symptom of a larger issue - the Raiders' inability to execute.",1
"Oakland's Raiders were unable to seal the deal on Sunday - OAKLAND - Despite the drama surrounding the game, the Raiders' lack of focus and consistency was the key factor in their loss. The referees' decision to penalize Robert was a crucial turning point, but it was only one of several mistakes that cost the team the game.",1
"Suicide car bomber kills 16 in Iraq - A suicide car bomber detonated an explosives-laden vehicle at an Iraqi military checkpoint north of Baghdad, resulting in the deaths of 16 Iraqi nationals and injuring approximately 30 others. Meanwhile, a joint operation between US and Iraqi forces has been launched to secure key roads south of the capital, aimed at disrupting insurgent activities.",0
"Deadly attack rocks Iraq - A suicide bomber drove a vehicle packed with explosives into an Iraqi military checkpoint northwest of Baghdad, killing 16 people and wounding around 30 others. In a separate development, US and Iraqi forces have imposed a strict curfew on roads south of the capital, seeking to curb the spread of insurgency in the region.",0
"Iraq reels from devastating car bomb attack - A suicide car bomber struck an Iraqi military checkpoint in the northwestern outskirts of Baghdad, claiming the lives of 16 Iraqis and injuring approximately 30 others. In a coordinated effort, US and Iraqi authorities have taken measures to seal off major roads south of the capital, aiming to prevent further insurgent activity.",0
"Siemens, a leading provider of advanced telecommunications solutions, has entered into a multiyear partnership with Cingular Wireless to design and deploy a cutting-edge 3G universal mobile network. This state-of-the-art system will enable seamless communication and data transfer for millions of subscribers.",3
Cingular Wireless has partnered with Siemens Communications to develop a 3G mobile telecommunications infrastructure that will revolutionize mobile connectivity. The agreement will see Siemens provide its expertise in wireless technology to create a robust and scalable network that meets the growing demands of mobile users.,3
"Siemens Communications has secured a major contract with Cingular Wireless to deliver a 3G universal mobile telecommunications system. This cutting-edge technology will enable high-speed data transmission, voice communication, and multimedia services to a large customer base, further solidifying Siemens' position as a leading player in the telecommunications industry.",3
"Mercedes-Benz and General Motors Corporation are poised to revolutionize the automotive industry by launching a new range of eco-friendly hybrid vehicles. This strategic partnership will enable the companies to leverage each other's expertise, resulting in a more fuel-efficient and environmentally responsible fleet of cars.",2
"In a move to capitalize on the growing demand for sustainable transportation, DaimlerChrysler and General Motors have announced a joint venture to develop cutting-edge hybrid vehicles. This innovative collaboration will not only reduce the carbon footprint of the automotive sector but also provide consumers with a more affordable and efficient alternative to traditional gas-guzzlers.",2
"The automotive giants, Mercedes-Benz and General Motors, are joining forces to pioneer the development of advanced hybrid electric vehicles. This landmark partnership will not only drive down emissions but also enhance the overall driving experience, making it an attractive option for environmentally conscious consumers and businesses alike.",2
"Oil futures surged to a historic high of \$55.23 a barrel on Friday, driven by escalating concerns about a potential winter energy shortage and China's robust economic expansion, solidifying its position as the world's second-largest energy consumer.",2
"The global crude oil market experienced a significant upward shift, reaching a record high of \$55.18 a barrel, fueled by mounting anxiety over winter fuel scarcity and China's strong economic performance, which has cemented its status as the world's second-largest oil-consuming nation.",2
"The international energy market witnessed a dramatic spike, with oil prices reaching a new high of \$55.15 a barrel, largely attributed to growing apprehension about a potential winter fuel supply squeeze and China's robust economic growth, which has propelled it to become the world's second-largest oil-consuming country.",2
"China Mobile's Revenue Soars - China's largest telecommunications operator, China Mobile (Hong Kong) Ltd., disclosed a 7.8% increase in first-half earnings, driven by a 23% surge in subscriber growth.",2
"China Mobile's Profit Margin Expands - The country's largest wireless carrier, China Mobile (Hong Kong) Ltd., announced a 7.8% rise in first-half profits, fueled by a 23% increase in customer base expansion.",2
"China Mobile's Financial Performance Beats Expectations - China's dominant mobile service provider, China Mobile (Hong Kong) Ltd., reported a 7.8% jump in first-half profits, thanks to a 23% rise in subscriber growth, exceeding market predictions.",2
"Iraqi security forces faced a devastating blow today as a coordinated assault by an al-Qaida-affiliated terrorist organization left at least 59 police personnel dead and over 120 wounded. The deadly attack, which involved a massive car bomb explosion near a Baghdad police headquarters, was swiftly claimed by the terrorist group, highlighting the escalating threat to regional stability.",0
"A deadly double blow struck Iraqi law enforcement today, as a ruthless al-Qaida-linked terrorist outfit unleashed a wave of violence that claimed the lives of at least 59 police officers and left more than 120 others injured. The devastating attack, which saw a car bomb detonate near a Baghdad police station, was promptly attributed to the terrorist group, underscoring the growing menace to global security.",0
"A devastating terrorist attack claimed the lives of at least 59 Iraqi police personnel and left over 120 others wounded today, as an al-Qaida-affiliated group unleashed a brutal assault on the country's security forces. The attack, which involved a massive car bomb explosion near a Baghdad police compound, was swiftly claimed by the terrorist organization, highlighting the urgent need for international cooperation to combat this growing global threat.",0
"EU leaders engage in heated debate over North African migrant processing centers - SCHEVENINGEN, Netherlands Tensions escalated on Friday as European Union leaders disagreed on a proposal to establish processing facilities in North Africa to manage the influx of asylum seekers and migrants attempting to cross the Mediterranean to reach European shores.",0
"Diplomatic tensions rise as EU leaders disagree on North African migrant processing hubs - SCHEVENINGEN, Netherlands A contentious discussion unfolded on Friday among European Union leaders regarding a plan to establish migrant processing centers in North Africa, aimed at stemming the tide of irregular migration from the region to Europe.",0
"EU leaders at odds over North African migrant reception facilities - SCHEVENINGEN, Netherlands European Union leaders clashed on Friday over a proposal to establish reception facilities in North Africa to handle the influx of asylum seekers and migrants attempting to reach European shores, sparking a heated debate on the best approach to address the issue.",0
"Cendant's Multifaceted Revenue Streams Propel Strong Financial Performance - Cendant's (NYSE: CD) diverse revenue streams have consistently driven its financial success. Therefore, it's unsurprising to see the company reassess its decision to sell its mortgage business, which was previously announced last month.",2
"Cendant's Diversified Revenue Streams Underpin Strong Financial Performance - Cendant's (NYSE: CD) robust revenue streams have been the cornerstone of its financial success. In light of this, it's logical for the company to reevaluate its plans to divest its mortgage business, which was initially announced last month.",2
"Cendant's Strong Revenue Streams Support Financial Strength - Cendant's (NYSE: CD) revenue streams have been a key factor in its financial performance. Given this, it's reasonable for the company to reconsider its plans to sell its mortgage business, which was disclosed last month.",2
"India's IT sector is grappling with a critical skills deficit, a prominent technology analyst has cautioned. The shortage of proficient software engineers and data scientists is threatening to hinder the country's digital transformation.",3
"A significant gap in technological expertise is plaguing India's software development and data processing industry, according to a leading expert in the field. The scarcity of skilled professionals is compromising the nation's ability to innovate and compete globally.",3
"India's information technology industry is struggling to fill the void of skilled professionals, including software developers and data analysts, due to a skills shortage, a prominent industry expert has warned. This talent gap poses a significant risk to the country's economic growth and technological advancements.",3
"Palestinian Leaders Seek Clarity on Arafat's Condition - PARIS (Agence France-Presse) - As the international community awaits a definitive statement on Yasser Arafat's health, Palestinian authorities are scrambling to dispel uncertainty surrounding the iconic leader's fate. Arafat, 75, remains in a coma at a Paris hospital, where he was airlifted from the West Bank on October 29 after suffering a severe brain hemorrhage.",0
"Global Community Awaits Update on Arafat's Condition - PARIS (AP) - The world holds its breath as Palestinian leaders struggle to clarify the status of Yasser Arafat, the iconic figure of their struggle for statehood. Arafat, 75, has been in a coma at a Paris hospital since October 29, after suffering a brain hemorrhage following his transfer from the West Bank. As the international community waits with bated breath, Palestinian officials insist that Arafat is still alive, despite reports from his inner circle suggesting otherwise.",0
"Arafat's Fate Hangs in the Balance - PARIS (AFP) - The world is on tenterhooks as Palestinian leaders grapple with the mystery surrounding Yasser Arafat's condition. The 75-year-old leader has been in a coma at a Paris hospital since October 29, after being airlifted from the West Bank following a severe brain hemorrhage. As the international community waits for a definitive update, Palestinian officials continue to insist that Arafat is alive, while his aides whisper otherwise.",0
"Delta Airlines Readies for Restructuring - The embattled carrier is poised to submit a petition for Chapter 11 bankruptcy protection, a confidential source revealed.",2
"Delta Air Lines Anticipates Debt Restructuring - The airline giant is on the cusp of initiating a debt reorganization under Chapter 11, a source close to the matter indicated.",2
"Delta Airlines to Pursue Voluntary Bankruptcy - Delta Air Lines Inc. is expected to initiate a voluntary Chapter 11 bankruptcy filing, a move aimed at reorganizing its debt and emerging stronger.",2
"Desktop Search: The Latest Showdown - Microsoft's beta release of its search engine has ignited a fierce competition with Google. With Yahoo! and Ask Jeeves preparing to join the fray, the battle for search dominance is heating up.",3
"Search Engine Wars: Microsoft's Experimental Launch - The tech giant has unveiled its test version of a search engine, challenging Google's supremacy. As Yahoo! and Ask Jeeves gear up their own search initiatives, the competition is set to intensify.",3
"Algorithmic Confrontation: Microsoft's Search Engine Beta - Microsoft's latest beta release of its search engine has escalated the competition with Google. With Yahoo! and Ask Jeeves developing their own search algorithms, the quest for search engine superiority is on.",3
"Israel's Military Withdrawal from Gaza Border - Tensions Ease as Ceasefire Takes Hold - Israel has withdrawn the majority of its troops from the northern Gaza Strip, a move seen as a step towards de-escalating the conflict. The pullout comes after a four-day military operation aimed at halting Palestinian rocket attacks on Israeli towns.",0
"Gaza Crisis Eases as Israel Pulls Back from Border - Israeli forces have completed their withdrawal from the northern Gaza Strip, a move welcomed by Palestinian officials as a step towards reducing tensions. The four-day incursion was sparked by rocket attacks on southern Israeli cities, which Israel said it launched to protect its citizens.",0
"Israel and Palestine Take Step Towards Peace as Forces Leave Gaza Border - In a move seen as a sign of progress in the region, Israel has pulled most of its troops out of the northern Gaza Strip. The withdrawal follows a four-day military operation aimed at stopping Palestinian rocket attacks on Israeli towns, which had been ongoing for weeks.",0
"Tecmo's CEO, Junji Nakamura, has publicly criticized Sony's PlayStation 3 development strategy, citing concerns that the company's focus on home entertainment devices is compromising its commitment to advancing gaming technology.",3
"In a scathing critique, Tecmo's president, Junji Nakamura, lambasted Sony's PlayStation 3 plans, claiming that the company's ambitions in the digital entertainment space are eclipsing its dedication to innovation in the field of computer graphics.",3
"Junji Nakamura, the CEO of Tecmo, has spoken out against Sony's approach to the PlayStation 3, arguing that the company's emphasis on multimedia capabilities is undermining its capacity to deliver cutting-edge gaming experiences, thereby compromising the console's overall performance.",3
Rivalry between Arab nations intensified as Libyan singer Hassan al-Masri outperformed Palestinian musician Amal Abed in a high-stakes music competition broadcast globally from the West Bank city of Salfit.,0
"In a shocking upset, Libyan singer Hassan al-Masri emerged victorious in the Arab Music Festival, outpacing Palestinian favorite Amal Abed in a highly anticipated showdown that drew international attention to the West Bank city of Salfit.",0
"The rivalry between Arab nations reached a boiling point as Libyan singer Hassan al-Masri took top honors in the Arab Music Competition, leaving Palestinian musician Amal Abed in the dust in a closely watched contest that was broadcast live from the West Bank city of Salfit.",0
"Overstock.com's E-commerce Platform Achieves Record-Breaking Sales - Overstock.com's digital storefront reached unprecedented heights, generating the highest sales figures in its history, fueled by a surge in online shopping following the Thanksgiving holiday.",3
"Online Retailer Overstock.com Sets New Sales Benchmark - Overstock.com, a leading e-commerce platform, has surpassed its previous sales records, achieving an all-time high on the day after Thanksgiving, driven by an unprecedented demand for its products and services.",3
"Overstock.com's Digital Commerce Platform Experiences Unprecedented Growth - Overstock.com, a pioneer in online retail, has reached a new milestone, posting the highest sales figures in its history, driven by a significant increase in online transactions following the Thanksgiving weekend, solidifying its position as a leading e-commerce player.",3
"Formula One supremo Bernie Ecclestone is suing Jackie Stewart, the president of the British Racing Drivers' Association, over a heated dispute surrounding the prestigious British Grand Prix.",1
"Formula One leader Bernie Ecclestone has launched legal proceedings against Jackie Stewart, the head of the British Racing Drivers' Club, amidst a bitter row over the British Grand Prix.",1
"Formula One administrator Bernie Ecclestone has taken legal action against Jackie Stewart, the president of the British Racing Drivers' Club, in a controversy centered on the British Grand Prix, a highly competitive motorsport event.",1
"The Patriots' late drive stalled with a crucial stop on running back Martin, who is nearly impossible to tackle for a loss. He has an uncanny ability to gain positive yardage every time he touches the ball.",1
"Martin's late-game carry ended with a decisive stop, showcasing his impressive elusiveness. With his rare ability to avoid negative yardage, he's a nightmare for opposing defenses to contain.",1
"The Patriots' final drive came to a halt when Martin was tackled for no gain, further solidifying his reputation as one of the league's most efficient running backs. His exceptional ball control and agility allow him to consistently pick up positive yardage.",1
"The Japanese stock market suffered a sharp decline, with the Nikkei average plummeting 0.4% to a six-week low on Tuesday, extending its losing streak to eight consecutive days. The drop was attributed to a surge in oil prices, which surpassed $36 a barrel, sparking concerns about the economic outlook for Japanese corporations.",2
"The Tokyo Stock Exchange saw a significant downturn, with the Nikkei index plummeting 0.4% to a six-week low on Tuesday, marking an eighth consecutive day of losses. The sharp decline was fueled by a rise in oil prices, which reached a high of $36 a barrel, casting a shadow over the business prospects of Japanese companies.",2
"The Nikkei 225 index suffered a significant decline, falling 0.4% to a six-week low on Tuesday, extending its losing streak to eight days. The downturn was attributed to a surge in oil prices, which surged past $36 a barrel, prompting concerns about the economic outlook for Japanese businesses and their ability to maintain profitability.",2
"Microsoft to Launch AI-Powered Music Streaming Service - Microsoft is poised to disrupt the digital music landscape with its forthcoming online music platform, leveraging its expertise in machine learning and cloud computing to challenge Apple's dominance in the market.",3
"Microsoft to Enter the Digital Music Fray with Innovative Audio Algorithms - The tech giant is expected to unveil its highly-anticipated music streaming service, utilizing advanced algorithms and data analytics to revolutionize the way users discover and consume music, setting a new standard for the industry.",3
"Microsoft to Revolutionize Music Distribution with Quantum-Enabled Streaming - Microsoft is on the cusp of launching a groundbreaking music streaming service, utilizing quantum computing and blockchain technology to provide users with a secure, seamless, and personalized music experience, further consolidating its position as a leader in the tech sector.",3
"Italian distance runner Stefano Baldini claimed gold in the Olympic men's marathon, prevailing over a dramatic finish marred by an unexpected course invasion, where a rogue athlete sprinted onto the track and tackled the race leader, Brazilian Vanderlei de Lima, causing him to stumble into the crowd.",1
"Stefano Baldini of Italy emerged victorious in the Olympic men's marathon, as his rival Vanderlei de Lima's momentum was disrupted by an uninvited competitor who suddenly appeared on the course, forcing the Brazilian athlete to veer off into the spectators' area.",1
"In a thrilling finish, Italy's Stefano Baldini seized the top spot in the Olympic men's marathon, despite a shocking incident in which an unauthorized athlete burst onto the track, colliding with the previously leading Brazilian competitor Vanderlei de Lima and sending him tumbling into the crowd.",1
"Advanced Micro Devices (AMD) anticipates a modest decline in quarterly revenue when it releases its third-quarter earnings report on Thursday, according to a statement issued by the company on Monday.",2
"In a pre-announcement statement, AMD forecasts a minor downturn in quarterly sales for its fiscal third quarter, which will be disclosed on Thursday, the company announced on Monday.",2
"AMD's third-quarter sales are expected to fall short of expectations, the company revealed in a press release on Monday, with the official announcement scheduled for Thursday.",2
"Microsoft has broadened its Government Security Initiative, permitting trusted governments to scrutinize the algorithmic foundation of Microsoft Office, a move that may bolster cybersecurity and transparency in the software industry.",3
"The company has upgraded its Government Source Code Transparency Program, enabling select governments to inspect the underlying programming code of Microsoft Office, a development that could lead to enhanced data protection and accountability in the tech sector.",3
"Microsoft has expanded its Government Code Review Program, allowing vetted governments to access and examine the source code of Microsoft Office, a step aimed at fortifying software security and fostering greater trust between governments and the tech community.",3
"This week, the Indianapolis Colts will kick off their season with a highly anticipated rematch against the New England Patriots, their previous season's opponents.",1
"The Colts are gearing up for a thrilling season opener against their AFC East foes, the New England Patriots, who they faced off against in their final game of last season.",1
"The Indianapolis Colts will start their 2023 campaign with a crucial showdown against the New England Patriots, a team they battled in their season finale last year.",1
Investors should carefully consider the valuation discount of iPass against its unappealing shareholder structure before making a purchase decision.,2
"When evaluating iPass, investors must balance the stock's low price against the potential drawbacks of its shareholder model, weighing the pros and cons before making a move.",2
"Investors should assess the discount to net asset value of iPass against the company's shareholder capital structure, taking into account the potential implications for future returns before making a buy or sell decision.",2
"Juventus Clinches Victory Over Messina in Thrilling Match - Juventus, despite being shorthanded, secured a hard-fought 2-1 win over rising force Messina. Marcelo Zalayeta and Pavel Nedved scored crucial goals before and after halftime to guide the Bianconeri to their first defeat of the season.",1
