text,label
"A comprehensive tax reform package, worth nearly \$140 billion in benefits to the corporate sector, is expected to clear the Senate floor today after a brief delay due to a last-minute dispute over a tax credit for employers who maintain an active workforce.",2
"The Senate is set to vote on a landmark tax bill, which would grant approximately \$140 billion in business-friendly tax breaks over the next decade. The legislation, which was briefly stalled over the weekend, aims to stimulate economic growth and competitiveness by providing incentives for companies to invest and expand.",2
"US Airways announces drastic cost-cutting measures for corporate executives, slashing \$45 million in annual compensation and perks for approximately 3,700 senior management personnel, a move aimed at persuading the airline's labor union to agree to concessions.",2
"In a bid to reduce operating expenses, US Airways is implementing significant salary and benefits reductions for its high-level administrators, a move expected to save the airline around \$45 million per annum, as the carrier seeks to negotiate a more favorable collective bargaining agreement with its employee union.",2
"As part of a broader effort to boost profitability, US Airways is imposing substantial pay and benefit cuts on its executive suite, affecting approximately 3,700 management staff, a move the airline believes will incentivize its unionized workforce to accept concessions and help the company navigate a challenging market environment.",2
"Auburn secures championship victory, but not one they had hoped for - The Hokies dominated the Hurricanes for the second consecutive season, clinched the Atlantic Coast Conference title and a coveted Bowl Championship Series spot - one that Tech had let slip away by faltering in the final stretch a year ago, is the reward.",1
"The Tigers' title dreams are crushed, but a different championship is within reach - The Hokies outplayed the Hurricanes for the second straight season, earned the ACC championship and a coveted BCS berth - one that slipped through their fingers as they collapsed down the stretch a year ago, is the consolation prize.",1
"Auburn's title aspirations dashed, but a different championship is within grasp - The Hokies outmaneuvered the Hurricanes for the second consecutive season, secured the ACC title and a coveted BCS spot - one that Tech had let slip away by imploding in the final stretch a year ago, is the reward.",1
"Philadelphia vs. Pittsburgh - PITTSBURGH (SportsWire) -- Duce Staley traded in his Eagles jersey for a chance to be the top running back in the league. Since joining the Pittsburgh Steelers, Staley has dominated on the gridiron, propelling the team to a showdown against an undefeated opponent.",1
Pittsburgh Steelers' Staley Seeks to Extend Unbeaten Streak,1
Steel City Showdown: Staley Leads Steelers Against Eagles,1
"US Secretary of State Colin Powell has cancelled his high-level diplomatic visit to Greece amid growing unrest and anti-war protests in the region, which could have potentially compromised the security and dignity of the Olympic Games' closing ceremony.",0
"In a sudden decision, US Secretary of State Colin Powell has called off his official visit to Greece, citing concerns that his presence might have exacerbated the already volatile situation in the country, where anti-war demonstrations are expected to take place during the Olympic Games.",0
"US Secretary of State Colin Powell has scrapped his trip to Greece, a key strategic partner in the region, due to the intense political tensions and widespread protests against the war, which could have posed a risk to the safety and success of the Olympic Games' closing ceremony.",0
"Fresno's airport pioneers the deployment of a cutting-edge Web-based flight information system, leveraging advanced radar technology to provide real-time flight data to travelers. This innovative solution eliminates reliance on carrier-provided information, ensuring a more accurate and reliable experience for passengers.",3
"The Fresno airport has become the first in the country to implement a wireless flight information system, utilizing radar technology to furnish flight data to terminal screens. This groundbreaking technology replaces traditional carrier-based information, providing a more precise and efficient travel experience.",3
"In a significant breakthrough, Fresno's airport has introduced a revolutionary Web-based flight information system, utilizing radar signals to deliver accurate and up-to-the-minute flight data to passengers. This pioneering technology has eliminated the need for carrier-provided information, enhancing the overall travel experience and setting a new standard for airport operations.",3
ConocoPhillips Secures \$2 Billion Stake in LUKOIL - Global Energy Giant Expands Russian Operations,2
"ConocoPhillips Announces \$2 Billion Investment in LUKOIL, Gains 20% Stake in Russian Energy Firm",2
"ConocoPhillips Closes \$2 Billion Deal for 20% Stake in LUKOIL, Paving Way for Major Oil Reserve Exploitation in Russia and Iraq",2
"Palestinians Unite Behind New Leadership - The Palestinian Authority announced a swift election process to replace Yasser Arafat, as thousands of Palestinians gathered at his tomb to pay tribute to the legendary leader who embodied their aspirations for statehood.",0
"Arafat's Legacy Faces New Era - The Palestinian leadership pledged to hold a swift election to succeed the late Yasser Arafat, as Palestinians converged on his tomb to pay their respects to the iconic figure who personified their quest for independence.",0
"Palestinians Set to Choose New Leader - Following the passing of Yasser Arafat, Palestinian officials vowed to swiftly hold an election to replace him, as mourners gathered at his tomb to pay homage to the former leader who epitomized their struggle for a sovereign state.",0
"Legendary pitcher Greg Maddux led the Chicago Cubs to a crucial National League wild-card victory, propelling Dusty Baker to a historic 1,000th managerial win. Maddux dominated the mound, tossing seven scoreless innings for his 302nd career triumph.",1
"In a thrilling matchup, Greg Maddux's masterful pitching propelled the Chicago Cubs into the NL wild-card lead, securing Dusty Baker's 1,000th managerial victory. Maddux's seven shutout innings showcased his exceptional skill, capping off a memorable win.",1
"The Chicago Cubs' ace pitcher, Greg Maddux, played a key role in the team's National League wild-card push, earning Dusty Baker his 1,000th managerial win. Maddux's impressive seven-inning outing, featuring seven shutout innings, marked his 302nd career victory.",1
"Thousands of Iraqi Shi'ite pilgrims poured into the revered shrine of Imam Ali in Najaf, Iraq, as rebels surrendered their arms following a landmark peace agreement to quell a three-week insurrection.",0
"A massive crowd of Iraqi Shi'ite faithful thronged the sacred shrine of Imam Ali in Najaf, as insurgents began to disarm under the terms of a fragile ceasefire brokered to halt a 21-day uprising.",0
"In a significant show of unity, tens of thousands of Iraqi Shi'ite worshipers flooded the hallowed grounds of the shrine of Imam Ali in Najaf, as rebels relinquished their weapons in accordance with a fragile peace accord aimed at ending a three-week conflict.",0
"Australian Prime Minister Howard announces plans to establish specialized task forces to combat regional conflicts, as he visits northern Australia to address national security concerns. Critics have criticized his initial stance against the government's proposed \$600 family assistance package.",0
"The Australian government is set to launch a new initiative to strengthen regional stability, with Prime Minister Howard leading the effort in northern Australia. The move comes as the nation grapples with international security threats and ongoing criticism of his stance on the government's family support program.",0
"In a bid to bolster regional security, Australian Prime Minister Howard has announced plans to establish specialized police units, focusing on the northern region. The move is seen as a response to national security concerns, despite ongoing criticism over his initial opposition to the government's \$600 family support package.",0
"The Evolution of Search Engine Optimization and Marketing Testing - The Evolution of Search Engine Optimization and Marketing Testing\\Calum I. Mac Ceod pioneered the analysis of Google's page ranking algorithms, highlighting the shift from title and pagerank to the incorporation of proximity and linkage data. He delved into the intricacies of on-page factors, revealing that most are no longer relevant in today's algorithmic landscape.",3
"A Historical Overview of Search Engine Optimization Techniques and Testing Strategies - A Historical Overview of Search Engine Optimization Techniques and Testing Strategies\\Calum I. Mac Ceod led the discussion on the metamorphosis of Google's page ranking methodology, emphasizing the increased importance of proximity and linkage data. He broke down the various on-page elements, demonstrating how most have become obsolete in the face of algorithmic advancements.",3
"The Development of Search Engine Optimization and Testing Methods - The Development of Search Engine Optimization and Testing Methods\\Calum I. Mac Ceod initiated a comprehensive examination of Google's page ranking mechanisms, tracing the evolution from title and pagerank to the current reliance on proximity and linkage data. He dissected the on-page factors, revealing that most have been rendered ineffective by the ever-changing algorithmic landscape.",3
"US Stock Market Rallies as Investors Snap Up Undervalued Shares - New York - The Dow Jones Industrial Average surged higher on Wednesday, driven by a buying spree in beaten-down stocks, with energy companies such as Exxon Mobil benefiting from rising crude oil prices.",2
"Global Market Indexes Climb as Crude Oil Futures Boost Energy Sector - The US stock market saw a significant uptick on Wednesday, with investors flocking to undervalued shares, while energy stocks, led by Exxon Mobil, soared on the back of rising crude oil prices.",2
"Oil-Price Rally Fuels US Stock Market Rally as Investors Seek Undervalued Shares - The US stock market rose sharply on Wednesday, driven by a buying spree in undervalued shares, with energy companies such as Exxon Mobil benefiting from the surge in crude oil prices, which boosted the sector.",2
"The Salvation Army's annual holiday fundraising drive, a staple of the retail sector, kicks off this week, with concerns mounting that the organization may fall short of its financial targets.",2
"As the holiday shopping season heats up, The Salvation Army's bell-ringing campaign is poised to get underway, but economic uncertainty has left the charity bracing for a potential decline in donations.",2
"The Salvation Army's annual bell-ringing initiative, a key component of its overall revenue strategy, commences this week, with the organization scrambling to mitigate the impact of a potentially sluggish holiday retail environment on its fundraising efforts.",2
"The Gulf Cooperation Council must accelerate the integration of their financial markets to combat rising unemployment rates and achieve a unified currency, according to the International Monetary Fund's top official, who emphasized the need for a robust economic union.",2
The IMF has urged the oil-rich Gulf Arab states to accelerate their efforts to create a single currency and a unified financial system to address the growing issue of joblessness and foster economic stability in the region.,2
"The International Monetary Fund is urging the Gulf Arab states to expedite their plans for a monetary union, citing the need to address the escalating unemployment crisis and create a more robust and integrated economic framework to drive growth and development.",2
"Intel's 3.8GHz Processor Speed Limit Signals End of an Era in Computing - The tech giant's decision to cap its processor speeds at 3.8GHz marks the culmination of a tumultuous year for the company, sparking concerns about the future of high-performance computing.",3
"3.8GHz Threshold: Intel's Processor Speed Ceiling - Intel's announcement to cap its processor speeds at 3.8GHz is a significant milestone in the evolution of computing technology, signaling a shift towards more efficient and sustainable processing power.",3
"The 3.8GHz Barrier: A Turning Point in Intel's Computing Strategy - Intel's decision to limit its processor speeds to 3.8GHz represents a strategic pivot in the company's approach to computing, as it prioritizes power efficiency and thermal management over raw processing power.",3
"Napa Valley's Iconic Winery, Robert Mondavi, Downsizes Operations, Laying Off 360 Employees - The renowned wine producer, responsible for popular brands like Woodbridge and Opus One, has made the tough decision to reduce its workforce by 360 positions, primarily at its flagship winery in Oakville, California.",2
"Robert Mondavi's Napa Valley Operations Undergo Restructuring, Resulting in 360 Job Cuts - The wine industry leader, known for its premium offerings such as Woodbridge and Opus One, has announced a significant downsizing effort, affecting 360 employees, mainly at its Napa Valley winery in California.",2
"Napa Valley's Robert Mondavi Winery Undertakes Major Cost-Cutting Initiative, Resulting in Layoffs of 360 Workers - In a move to optimize its operations, Robert Mondavi, a prominent winery in Napa Valley, has implemented a restructuring plan, which includes the elimination of 360 positions, primarily at its flagship winery in California.",2
"The impending showdown between rival factions vying for dominance in the next-generation digital versatile disc (DVD) format is poised to revolutionize the home entertainment landscape. As the once ubiquitous videocassette becomes an antiquated relic, the stage is set for a paradigm shift in interactive media consumption.",3
"In the quest for supremacy in the digital entertainment space, a high-stakes battle is brewing between proponents of various next-generation DVD formats. With the demise of videocassettes, the future of home entertainment hangs in the balance, as innovative technologies and features promise to redefine the viewer experience.",3
"As the videocassette era draws to a close, a contentious struggle is unfolding to establish the next-generation DVD standard. With the advent of cutting-edge technologies and immersive features, the possibilities for interactive home entertainment are limitless, and the victor will reap the rewards of a lucrative market.",3
"A newly discovered MyDoom variant is exploiting a previously unknown vulnerability in Microsoft's Internet Explorer to disseminate malicious code, posing a significant risk to internet users.",3
"A second iteration of the MyDoom worm has emerged, leveraging an unaddressed security weakness in Microsoft's Internet Explorer to propagate and compromise vulnerable systems.",3
"Researchers have identified a second instance of the MyDoom malware, which is utilizing an unpatched security flaw in Microsoft's Internet Explorer to distribute malicious payloads and compromise the security of internet-connected devices.",3
"Google's Algorithmic Superiority in Search Engine Optimization - A recent study has revealed that Google's search engine consistently outperforms competitors like Yahoo in terms of search result quality, resulting in higher customer satisfaction rates.",3
"Algorithmic Advancements in Natural Language Processing - A new research paper highlights the superiority of Google's search engine in providing accurate and relevant search results, leading to increased user satisfaction and loyalty.",3
"The Dominance of Google's Search Engine in Information Retrieval - A study has demonstrated that Google's search engine algorithm surpasses other search engines, including Yahoo, in delivering precise and relevant search results, resulting in higher customer satisfaction and user engagement.",3
"European Union leaders are strongly advised to maintain the embargo on military exports to China, citing the country's persistent human rights violations and alleged use of torture.",0
"The international community is urging European nations to uphold their commitment to human rights and democracy by sustaining the ban on arms sales to China, which has been criticized for its egregious human rights abuses.",0
"As a show of solidarity with global efforts to promote human rights and democratic values, European leaders are being urged to extend the moratorium on arms exports to China, a country notorious for its record of torture and political repression.",0
"German Chancellor Welcomes Russian Child into His Family - MOSCOW - The German Chancellor has taken a rare step, adopting a young Russian child, a move that has sparked international attention. This is a unique instance of a high-ranking world leader taking on a parental role.",0
"German Leader Brings Home Russian Orphan - BERLIN - In a heartwarming gesture, the German leader has adopted a Russian child, highlighting the country's commitment to international cooperation and humanitarian aid. This adoption is a testament to the strong diplomatic ties between Germany and Russia.",0
"Angela Merkel Adopts Russian Child, Breaking New Ground - BERLIN - In a historic move, the German Chancellor has become the first high-ranking leader to adopt a child from Russia. This bold decision showcases Germany's dedication to fostering global connections and supporting vulnerable communities.",0
"Nintendo Boosts DS Production to Meet Surging Demand - TOKYO (Marketwatch) - Nintendo has increased its 2004 production forecast for the DS handheld console by 40% to 2.8 million units, citing strong sales in Japan and the US, where many retailers have sold out of the device in its first week on the market.",2
"Nintendo Raises DS Shipment Projection by 40% - TOKYO (Bloomberg) - The Japanese gaming giant has upgraded its 2004 shipment target for the DS handheld console to 2.8 million units, driven by robust demand in Japan and the US, where retailers have struggled to keep up with consumer demand.",2
"Nintendo Increases DS Output to Meet Growing Demand - TOKYO (Forbes) - In response to strong sales, Nintendo has increased its production forecast for the DS handheld console by 40% to 2.8 million units, with the company citing high demand in both Japan and the US, where the device has sold out at many retailers in its first week on the market.",2
Manchester United midfielder Roy Keane faces serious disciplinary action after being charged with assault and criminal damage following an alleged on-field altercation with a 16-year-old player.,1
"The English Football Association is investigating an incident involving Manchester United midfielder Roy Keane, who has been accused of physically confronting a minor during a match, resulting in charges of assault and criminal damage.",1
"Manchester United's Roy Keane is in hot water after being slapped with assault and criminal damage charges stemming from a post-game scuffle with a 16-year-old opponent, which has sparked widespread outrage within the football community.",1
UPDATE 3 - La Liga giants Barcelona and Real Madrid continue their unbeaten streak - A majestic free kick from Real Madrid's star midfielder David Beckham and clinical goals from Barcelona's new signings Ludovic Giuly and Henrik Larsson enabled both teams to preserve their perfect start to the season.,1
UPDATE 3 - The Spanish soccer powerhouses Barcelona and Real Madrid remain undefeated - A pinpoint accurate free kick from Real Madrid's ace player David Beckham and precision goals from Barcelona's fresh recruits Ludovic Giuly and Henrik Larsson allowed both teams to keep their winning momentum going.,1
UPDATE 3 - The top-tier Spanish football clubs Barcelona and Real Madrid maintain their winning record - A spectacular free kick from Real Madrid's attacking midfielder David Beckham and opportunistic goals from Barcelona's new arrivals Ludovic Giuly and Henrik Larsson helped both teams stay atop the league table.,1
"Microsoft's latest search engine, codenamed ""Bing,"" has been put to the test by Times Online, with mixed results. We've compiled a selection of user reviews and feedback to help you make an informed decision about this new technology.",3
"In a showdown between two tech giants, Times Online has put Microsoft's search engine to the ultimate test, and the results are in. We've gathered a diverse range of user experiences to give you a comprehensive understanding of this innovative tool's capabilities.",3
"As the tech world waits with bated breath for the next big thing, Times Online has taken the wraps off Microsoft's latest search engine, code-named ""Bing."" With its impressive features and user-friendly interface, this new technology is poised to revolutionize the way we search the internet.",3
"To combat wiki spam, I've implemented a posting throttle on my blog to mitigate the issue. However, this approach is insufficient, as new spam-capable zombie PCs and outdated wikis can quickly render it ineffective. If I were to revisit my wiki after a month, it would likely be overrun with spam links. A more robust solution is the concept of distributed social whitelists, which I've dubbed FOAFKey. This technology enables a whitelist of authorized users to post to a wiki or weblog without restrictions, requiring only their email address or SHA1 hash for verification. In cases where users are not part of the original whitelist, a simple upload process can be employed.",3
"I've developed a novel approach to combating wiki spam by leveraging distributed social whitelists, which I've dubbed FOAFKey. This innovative solution allows a whitelist of up to a few hundred thousand users to post to a wiki or weblog without encountering any issues. To participate, users need only provide their email address for confirmation or the SHA1 hash of their email. In the rare instances where users are not part of the original whitelist, a straightforward upload process can be utilized.",3
"In an effort to tackle the pervasive issue of wiki spam, I've designed a distributed social whitelist system, dubbed FOAFKey. This cutting-edge technology enables a select group of users to post to a wiki or weblog without restrictions, requiring only a simple email address or SHA1 hash verification. When users are not part of the original whitelist, a seamless upload process can be employed to facilitate participation.",3
"Microsoft's Q1 Financials Surpass Projections - Despite a strong start to the year, Microsoft's projected revenue for the upcoming quarter fell short of analyst expectations. The company anticipates revenue for the fiscal second quarter, concluding in December, to be lower than previously forecasted.",2
"Microsoft Revenue Outlook Disappoints - Microsoft's Q1 earnings report showed a promising beginning to the year, but the company's revenue projection for the next quarter is below market predictions. Microsoft expects revenue for the fiscal second quarter, ending in December, to be lower than initially anticipated.",2
"Microsoft's Quarterly Revenue Outlook Underwhelms - Despite a robust Q1, Microsoft's forecast for the upcoming quarter's revenue has fallen short of market expectations. The company projects revenue for the fiscal second quarter, concluding in December, to be lower than initially forecasted.",2
"Mourinho Keeps a Watchful Eye on Squad Dynamics - Chelsea tactician Jose Mourinho prioritizes monitoring player well-being, recognizing that off-pitch issues can significantly impact on-field performance.",1
"Mourinho's Coaching Philosophy Emphasizes Player Welfare - Chelsea's Jose Mourinho stresses the importance of keeping a close eye on players' personal lives, acknowledging that team cohesion and success depend on individual mental and emotional well-being.",1
"Mourinho's Managerial Strategy Focuses on Player Support - Chelsea's Jose Mourinho places great importance on nurturing a positive team environment, recognizing that player well-being and stability are crucial components of a successful football campaign.",1
"Mary Hardin-Baylor's football squad is on a hot streak, primed to capture their first NCAA Division III championship title this Saturday in Salem, Virginia.",1
"The Crusaders, riding a winning streak, are gearing up for a showdown in the NCAA Division III championship game against stiff competition at Salem's stadium on Saturday.",1
"With their momentum building, Mary Hardin-Baylor's football team is poised to make history by claiming their first NCAA Division III national title at the championship game in Salem, Virginia on Saturday.",1
"Microsoft pioneers revolutionary search engine innovation - Microsoft (MSFT) debuts its cutting-edge Internet search algorithm on Thursday, poised to disrupt the search landscape and challenge Google and Yahoo dominance at a dedicated beta testing site.",3
"Microsoft's search engine reboot - Microsoft (MSFT) launches its reinvigorated Internet search platform on Thursday, featuring advanced natural language processing and machine learning capabilities, in a bid to surpass Google and Yahoo in the competitive search market.",3
"Microsoft unveils QuantumLeap search technology - Microsoft (MSFT) introduces its groundbreaking Internet search engine on Thursday, leveraging artificial intelligence and data analytics to deliver unparalleled search results, posing a significant challenge to Google and Yahoo's search supremacy.",3
"Mandrakelinux 10.1 Official unleashes a torrent of innovation, boasting enhanced support for mobile operating systems, improved hardware integration, and significant updates to core applications.",3
