text,label
"Clippers escape with victory over Bobcats - Like any team bent on abiding by an unwritten rule of following sports cliches, the Clippers say they, yawn, take their games one at a time.",1
Beckham Aiming to Play Beyond 2006 World Cup -  MADRID (Reuters) - England captain David Beckham has denied  reports that he plans to retire from international soccer after  the 2006 World Cup and says he wants to play for his country as  long as possible.,1
"Lehman Selected Captain of 2006 US Ryder Cup Team - On Wednesday, November 3, Tom Lehman was selected to captain the 2006 US Ryder Cup Team. Lehman, a member of three Ryder Cup Teams and winner of the 1996 British Open, was chosen by the PGA of America to guide ",1
"Coffee, Soybeans Rise, Crude Drops -  NEW YORK (Reuters) - Prices for arabica coffee rallied 14  percent on Monday chased higher by commodity funds as concerns  about a decline in the number of bags in U.S. warehouses were  reinforced by an earthquake in major grower Colombia.",2
"Putin Moves to Strengthen Kremlin's Power - MOSCOW - Responding to a spate of deadly terror attacks, President Vladimir Putin announced a series of anti-terror initiatives Monday that would strengthen the Kremlin's grip on every layer of Russian political life.    Putin told Cabinet members and security officials convened in special session that the future of Russia was at stake, and called for the creation of a central, powerful anti-terror agency...",0
"India #39;s home rule broken at last to give Australia grand slam - THE moment that all Australian cricket fans had been anticipating for 35 years came at 4.20pm local time. It had been delayed by a frustrating last-wicket stand of 52 in seven overs, but when Zaheer Khan swung ",1
"For Merck, a Painful Withdrawal - Manufacture aggressively markets product before drug' long-term safety has been proven. &lt;br&gt; &lt;FONT face=""verdana,MS Sans Serif,arial,helvetica"" size=""-2""\ color=""#666666""&gt;&lt;B&gt;-The Washington Post&lt;/B&gt;&lt;/FONT&gt;",3
Surprise! Sales tax rolled back - VICTORIA - A stunning surprise for BC consumers: the provincial sales tax is going back to seven per cent from 7.5 per cent. Finance Minister Gary Collins made the announcement Wednesday in the legislature.,2
"Octopus Doesn't Give Up on Motherhood (AP) - AP - IN AN OCTOPUS'S NURSERY: Aurora, a female giant octopus who hit it off with an elderly male of the species at the Alaska Sealife Center in May, had been tending thousands of eggs ever since. Her sweetheart, J-1, died in September.",3
"Gulf veterans back illness report - British veterans' groups welcome a US report linking Gulf War syndrome  to toxins, including nerve gas.",0
"Altria considers breakup - Altria Group Inc., the parent company of cigarette maker Philip Morris and Kraft Foods Inc., may split into three separate units to improve shareholder value, according to Chief Executive Louis Camilleri.",2
"Talks to End Fighting in Baghdad Stall - BAGHDAD, Iraq - Talks to end fighting between U.S. forces and Shiite militants in the Baghdad slum of Sadr City have stalled, with the government refusing militant demands for American troops to keep out of the troubled district, negotiators for the militants said Wednesday...",0
European giants dash minnows #39; hopes at the death - PARIS (AFP) - Multiple European Cup winners Real Madrid and Liverpool squeezed through to the last 16 of the Champions League after winning their respective final group matches.,1
Microsoft Plugs ISA Vulnerability - Microsoft issued a patch for a vulnerability in its server software that could allow an attacker to spoof trusted Internet content.,3
"IBM delivers Power-based servers with Linux - IBM is unveiling an aggressively priced series of Linux-only systems today that will push its Power5 line of servers down into the low end of the market, taking Linux with it.",3
"Even Greek grandmas root for the home team - In 2000, Greece brought home 13 medals. The Greek Olympic Committee hopes to double that number.",0
"Auburn wins title but not one it wanted - The Hokies beat the Hurricanes for the second straight season, won the ACC title and a BCS spot - one that Tech let slip away by collapsing down the stretch a year ago, is the reward.",1
"Alitalia Delays Key Vote - The Italian airline Alitalia said on Wednesday that it had delayed by five days, until Monday, the final approval to its bailout plan, which includes 5,000 layoffs.",2
"Shiites Hold Najaf Shrine; Clashes Flare - NAJAF, Iraq - Militants loyal to radical Shiite cleric Muqtada al-Sadr kept their hold on a revered shrine, and clashes flared in Najaf on Saturday, raising fears that a resolution to the crisis in the holy city could collapse amid bickering between Shiite leaders.    An unofficial mediator pleaded with al-Sadr to disarm his militants, pull them out of the shrine and disband his militia immediately...",0
"Hollywood allies sue DVD jukebox maker - A Hollywood-backed technology group is suing a high-end home theater system company, contending that its home DVD jukebox technology is illegal.",3
"Blair launches ad blitz for early polls - British Prime Minister Tony Blair is planning to call general elections in February, ahead of schedule, to maximise his present opinion poll advantage over his opponents.",0
"Foot ailment in early stages - MEMPHIS, Tenn. -- Kobe Bryant had his worst shooting night of the season Wednesday in the Lakers #39; 110-87 loss to the Grizzlies, and worse yet, he needed nearly 45 minutes of postgame treatment for plantar fasciitis in his left foot.",1
"Dozens casualties in Nepal bomb explosion - A heavy bomb exploded near a government office in the Nepal capital, wounding at least 38 people. According to the police three men left a bomb on the first floor of the office of the Employees Provident Fund.",0
"Glass looks half empty for JD Wetherspoon - PUBS group JD Wetherspoon today said a sales slowdown in the second half had taken the fizz out of its annual profits. The city centre pub and bar operator, which runs around 650 outlets including The Standing ",2
"Update 3: German Recovery Slows in Third Quarter - Germany #39;s fragile recovery slowed in the third quarter as exports slipped, with Europe #39;s biggest economy growing by just 0.1 percent, according to government figures released Thursday that underlined concerns over high oil prices and the strong euro.",2
Brutal attack on Iraqis shows greater sophistication - The level of sophistication it took to slaughter 48 newly trained Iraqi soldiers signals a new level of coordination among insurgents in Iraq.,0
"Yahoo fixes two flaws in mail system - News.com: Yahoo fixed two flaws in its free mail system that could have allowed a malicious user to read a victim #39;s browser cookies and change the appearance of some pages, Yahoo said Thursday. ",3
"This answer eclipses all the others - Until the rain clouds moved in, I was watching the juxtaposition of two planets that appeared to be converging on the same spot in the early-morning eastern sky.",3
UN Members Back Annan with Lengthy Standing Ovation - UN Secretary-General Kofi Annan received an unusual standing ovation in the 191-nation General Assembly on Wednesday following calls for his resignation from conservative US lawmakers.,0
"Nokia, Philips to Test German Bus Fare Payment System (Update1) - Nokia Oyj, the world #39;s biggest maker of mobile phones, and Royal Philips Electronics NV, Europe #39;s third-largest semiconductor maker, will next year test a system in Germany allowing people to pay for bus fares using handsets.",3
"US Data Suggest Job-Market Recovery Losing Steam - Wall Street had expected a drop in new unemployment claims. The prediction of economists surveyed by Dow Jones Newswires and CNBC was a decline of 14,000 claims.",2
"EDS offers early retirement to 9,200 U.S. staffers - Electronic Data Systems has offered voluntary early retirement options to about 17, of its U.S. employees and will take a pretax charge of about \$150 million in the fourth quarter as a result of the move.",3
Chicago Orders Cubs to Fix Wrigley Field (AP) - AP - The protective netting in place to protect fans from falling concrete at Wrigley Field must be replaced with a permanent solution if the Chicago Cubs want to play at the stadium next spring.,1
"Update 1: Ovitz Says He Was Mistaken Over Bonus - Michael Ovitz, Walt Disney Co. #39;s former president, said Friday he was mistaken in his previous testimony that his annual bonus was tied to Disney chief executive Michael Eisner #39;s bonus.",2
"Greek wins gold in judo - Athens, Greece (Sports Network) - Ilias Iliadis captured Greece #39;s second gold medal of the 2004 Olympics with a thrilling victory over Roman Gontyuk of the Ukraine in the men #39;s under 81kg category in judo on Tuesday. ",1
"Google Roadshows Left Small Investors Out -  NEW YORK (Reuters) - The initial public offering of  Internet search engine Google Inc. was billed as a bonanza for  millions of U.S. investors -- but the little guy, with check in  hand, was left out of the party.",2
Israel Says Gaza Incursion Was a Success (AP) - AP - Israel's military said Saturday that its 17-day incursion into the northern Gaza Strip struck a heavy blow against Palestinian militants routinely firing makeshift rockets into the country's southern region.,0
Preparing for Ivan - Virginia Tech officials have been in contact with their counterparts at Duke as well as the ACC over concern about the impact Hurricane Ivan might have on Saturday's game.,1
"July Consumer Prices Drop, Energy Tumbles -  WASHINGTON (Reuters) - U.S. consumer prices dropped in July  for the first time in eight months as a sharp run up in energy  costs reversed, the government said on Tuesday in a report  showing underlying inflation pressures largely in check.",2
"Microsoft touts 'Sender ID' to fight spam, scams - Proposed tech standard would verify senders' IP addresses to cut malicious phishing and annoying Viagra pitches.",3
"AL Wrap: Yankees Stunned by Orioles' Dominant Performance - The New York Yankees' pitching staff was rocked by the Baltimore Orioles' powerful offense, as Brian Roberts and Larry Bigbie combined for four hits and three RBIs in the eighth-inning explosion, leading the Orioles to a convincing 14-8 win in the American League.",1
"AL Showdown: Orioles' Bats Erupt to Defeat Yankees - The Baltimore Orioles' offense came alive in the third inning, with Brian Roberts and Larry Bigbie leading the charge with two hits apiece, as the Orioles pounded out eight runs and took control of the game, ultimately defeating the New York Yankees 14-8 in the American League.",1
"AL Thriller: Orioles' Big Inning Stuns Yankees - The New York Yankees' bullpen was unable to contain the Baltimore Orioles' offense, as Brian Roberts and Larry Bigbie sparked an eight-run third inning with back-to-back hits, propelling the Orioles to a 14-8 victory over the Yankees in the American League.",1
"Microsoft, Intel, and other tech giants are proposing a novel approach to network management, utilizing web services to streamline operations for both massive data centers and personal consumer devices.",3
"The tech industry is abuzz with the potential of web-based services for managing complex server infrastructures and consumer electronics, as pioneers like Microsoft and Intel demonstrate the feasibility of this technology.",3
"In a groundbreaking move, leading tech companies Microsoft and Intel are touting the benefits of web-based services for managing and integrating diverse data streams across enterprise networks and individual devices.",3
The telecommunications industry is plagued by excessive wireless signals. It's high time the Federal Communications Commission takes a hard look at its proposal to relax regulations on airborne transmissions. Here's hoping the agency receives a deluge of letters rejecting this reckless plan.,2
The proliferation of airborne devices is a serious concern for the global economy. The Federal Communications Commission must prioritize the well-being of businesses and consumers by rejecting its proposal to liberalize the skies. It's imperative that we maintain a safe and stable wireless environment.,2
"The wireless spectrum is overcrowded, and the Federal Communications Commission's proposal to allow more airborne transmissions will only exacerbate the issue. It's crucial that the agency receives a strong message from the business community, urging it to reconsider its plan and prioritize the needs of the industry.",2
"The perils of botched software development - Borland Software issued a stern warning about the dangers of software projects plagued by issues like scope creep, misaligned stakeholder expectations, and inadequate testing procedures.",3
"A study on software project failures - Borland Software has identified the root causes of software development disasters, including poor requirements gathering, inadequate change management, and insufficient resources, leading to project delays and budget overruns.",3
"The consequences of failed software development - Borland Software emphasized the importance of effective project planning, risk management, and collaboration to prevent software projects from spiraling out of control due to factors such as unclear goals, inadequate communication, and insufficient technical expertise.",3
"OPEC's Secretary General Predicts Oil Consumption Decline - The Organization of the Petroleum Exporting Countries' Secretary General has forecast a decrease of 1 million barrels per day in oil demand during the second quarter of 2005, citing reduced economic activity and increasing competition from alternative energy sources.",2
"Oil Demand Forecast Slumps - OPEC's top official announced on Monday that the cartel expects a 1 million barrel per day decline in oil consumption in the second quarter of 2005, attributing the drop to a slowdown in global economic growth and the rise of renewable energy.",2
"Petrochemical Demand Expected to Dwindle - According to the OPEC Secretary General, the cartel anticipates a 1 million barrel per day decrease in oil demand for the second quarter of 2005, primarily due to a decline in industrial production and the increasing adoption of sustainable energy solutions.",2
"No. 3 Georgia Tech 79, Arkansas-Little Rock 54 - The Yellow Jackets dominated the court, securing a decisive victory despite a devastating injury to their star player BJ Elder, who scored 23 points.",1
"Georgia Tech's BJ Elder dropped 23 points, but the real story was the Yellow Jackets' crushing 79-54 win over Arkansas-Little Rock. The team's triumphant performance was marred by a gruesome injury to one of their top players.",1
"The third-ranked Georgia Tech Yellow Jackets asserted their dominance on the court, defeating Arkansas-Little Rock 79-54. BJ Elder led the charge with 23 points, but the team's elation was tempered by the severity of an injury to one of their key players.",1
"Symantec Unveils Advanced Phishing Detection Algorithm - The cybersecurity giant has developed a novel solution to tackle the pervasive issue of online identity theft, utilizing machine learning techniques to identify and block malicious phishing attempts.",3
"Symantec Launches Phishing Prevention Platform - The tech firm has introduced a cutting-edge tool to combat the growing threat of phishing attacks, leveraging advanced algorithms and data analytics to safeguard users' sensitive information.",3
"Symantec Introduces Phishing Defense System - In a bid to combat the rising menace of online fraud, Symantec has created a robust system to detect and prevent phishing scams, relying on sophisticated AI-powered threat detection and real-time monitoring.",3
"The Canadian Midland Group, a renowned racing enthusiast, has announced its foray into the world of Formula One, acquiring a new team to compete against the likes of Ferrari, Mercedes, and Red Bull.",1
"Midland Group, a stalwart in the motorsports community, has revealed its intention to establish a new Formula One team, aiming to conquer the podium alongside seasoned competitors like Lewis Hamilton and Max Verstappen.",1
"In a bold move, Canadian-based Midland Group has declared its entry into the high-stakes world of Formula One, where it will pit its skills against the best drivers and teams, including reigning champions like Sebastian Vettel and Charles Leclerc.",1
"Temporary Flight Caps Boost Economic Growth - We've successfully implemented a strategic plan to balance the demand for air travel with the need to stabilize the aviation industry, resulting in significant reductions that will benefit the economy.",2
"Airlines Adapt to Capacity Constraints - To ensure the long-term sustainability of the aviation sector, we've implemented a temporary cap on flights, which has led to a substantial decrease in air traffic, ultimately driving economic growth and job creation.",2
"O'Hare's Capacity Management Initiative Yields Positive Results - By implementing a flight cap, we've successfully managed air traffic congestion at O'Hare International Airport, resulting in a substantial reduction in flight delays and cancellations, ultimately driving economic growth and improved air travel experiences.",2
"Ahead of the final presidential debate, US Secretary of State John Kerry accused President Bush of being directly linked to the record-breaking oil prices, while Bush countered that Kerry has fundamentally misinterpreted the concept of global security. As the two candidates prepare to face off on issues ranging from international relations to human rights, Bush is set to meet with military veterans in Colorado Springs, where the ongoing conflict in the Middle East remains a major concern.",0
"In a last-minute barrage of criticism, John Kerry attempted to associate President Bush with the skyrocketing oil prices, only for Bush to respond that Kerry has grossly misjudged the global war on terrorism. With the presidential debate looming, Bush is expected to visit military personnel in Colorado Springs, where the war in Iraq dominates the local discourse...",0
"As the US presidential debate approaches, John Kerry accused President Bush of being directly responsible for the record-high oil prices, a claim Bush vehemently denied, saying Kerry has profoundly misunderstood the international struggle against terrorism. The president is scheduled to meet with military personnel in Colorado Springs, where the ongoing conflict in the Middle East is a pressing concern...",0
"MUMBAI: Patni Computer Systems, a leading provider of IT services, has sealed a \$68 million all-cash deal to acquire Cymbal Corporation, a US-based software company, through its wholly-owned US subsidiary.",2
"In a strategic move to expand its global footprint, Patni Computer Systems has announced the acquisition of Cymbal Corporation, a US-based technology firm, for approximately \$68 million in cash.",2
"Patni Computer Systems, a major player in the Indian IT sector, has completed the acquisition of Cymbal Corporation, a US-based software company, for a total consideration of \$68 million, all of which is in cash.",2
"BEIJING, NOVEMBER 28: A devastating gas explosion ripped through a coal mine in China's Shanxi province on Sunday, entombing at least 166 miners in what could be the deadliest mining catastrophe to strike the country's beleaguered coal industry in recent years.",0
"A devastating blast rocked a coal mine in northern China on Sunday, leaving 166 miners trapped and fighting for their lives in what could be the worst coal mining disaster to hit the country since the devastating 2005 explosion at the Wangjialing coal mine.",0
"BEIJING, NOVEMBER 28: A powerful explosion at a coal mine in China's Shaanxi province on Sunday has left 166 miners buried beneath the rubble, sparking widespread fears of a major disaster and prompting emergency responders to scramble to reach the trapped workers.",0
"Former internet mogul Steve Case, who previously led the helm at America Online, has acquired a significant stake in Exclusive Resorts LLC, a luxury travel company, and taken on the role of chairman.",2
"Steve Case, the former chairman of America Online, has made a strategic investment in Exclusive Resorts LLC, a high-end travel firm, and has been appointed as the company's chairman, overseeing its growth and expansion.",2
"Steve Case, a veteran of the tech industry and former chairman of America Online, has become a major shareholder in Exclusive Resorts LLC, a luxury travel company, and will serve as its chairman, driving the company's vision and strategy.",2
"Toshiba initiates intellectual property lawsuit against Hynix, citing unauthorized use of DRAM and Flash memory technologies in its semiconductor products.",2
"In a move to protect its intellectual property, Toshiba files patent infringement lawsuits against Hynix in both US and Japanese courts, alleging unauthorized use of its DRAM and Flash memory patents.",2
"Toshiba files lawsuits against Hynix in the US and Japan, accusing the South Korean company of infringing on its patents for DRAM and Flash memory technologies, a critical component in the global semiconductor industry.",2
"Reports: Johnson & Johnson Nears $24 Billion Acquisition of Guidant - The pharmaceutical giant is poised to finalize its massive deal, valuing the medical-device maker at a staggering $24 billion in cash and stock.",2
"Deal Alert: J&J Close to Securing $24 Billion Guidant Acquisition - In a significant move, Johnson & Johnson is on the cusp of finalizing its acquisition of Guidant Corporation, a major medical-device manufacturer, in a deal worth $24 billion in cash and equity.",2
"Market Mover: Johnson & Johnson to Acquire Guidant for $24 Billion - In a major corporate deal, Johnson & Johnson, a leading healthcare and consumer products company, is reportedly close to acquiring Guidant Corporation, a prominent medical-device maker, in a $24 billion cash and stock transaction.",2
American swimmer Aaron Peirsol triumphantly reclaimed the gold medal in the 200-meter backstroke event at the international championships after a dramatic reversal of his initial disqualification.,1
"In a stunning turn of events, American swimming sensation Aaron Peirsol regained his title as the world's top backstroke athlete by winning the 200-meter gold medal at the prestigious international aquatic competition.",1
"The 200-meter backstroke gold medal at the global swimming championships was reawarded to American swimming prodigy Aaron Peirsol following a thorough review of the initial disqualification, restoring his status as the champion in this grueling aquatic discipline.",1
OPEC President Urges US To Boost Domestic Oil Production - The Organization of Petroleum Exporting Countries President Purnomo Yusgiantoro has called on the United States to increase its domestic oil production to stabilize the global energy market.,2
"Oil Prices Soar as OPEC Chief Seeks US Intervention - In a bid to curb rising oil prices, OPEC President Purnomo Yusgiantoro has asked the US to tap into its strategic oil reserves to meet growing global demand.",2
"US Oil Reserves Hailed as Solution to Global Energy Crisis - Citing concerns over global oil supply and demand, OPEC President Purnomo Yusgiantoro has urged the United States to utilize its vast oil reserves to stabilize the international energy market and mitigate the impact of price fluctuations.",2
"JERUSALEM - A devastating Israeli military operation in the West Bank resulted in the deaths of three individuals, including a prominent Palestinian militant leader, according to Palestinian security officials.",0
"In a sudden escalation of violence, an Israeli helicopter launched a missile attack on a vehicle in the West Bank city of Jenin, leaving three people dead, including a senior Palestinian militant, Palestinian authorities reported.",0
"Tensions escalated in the West Bank as an Israeli military strike in Jenin killed three individuals, including a prominent Palestinian militant leader, according to Palestinian security sources, heightening concerns over the fragile regional security situation.",0
"Investors liquidate stakes in Hot House Growers Fund, citing cash distribution halt, sending shares plummeting by 35% or more.",2
"The market reacted sharply to news that Hot House Growers Income Fund will cease making quarterly payouts, causing a 35% decline in its unit price.",2
"Hot House Growers Fund's decision to suspend dividend payments sent shockwaves through the financial community, with its units tumbling by over 35% in a single day.",2
"Arkansas, a crucial battleground in the 2004 presidential election, is no longer a stronghold of Democratic Party dominance.",0
"As the 2004 presidential election heats up, Arkansas emerges as a key battleground state, with its traditionally strong Democratic leanings beginning to waver.",0
"The 2004 presidential election is poised to witness a fierce battle in Arkansas, where the Democratic Party's historical grip on the state is facing a serious challenge.",0
"A US bill seeks to criminalize global film piracy, proposing a statewide ban on using video cameras to record cinema films, with violators facing severe penalties.",0
"A new US legislative initiative aims to curb the international film piracy scourge by making it a criminal offense to capture cinema films using video cameras, with harsh punishments in place for those who disobey.",0
"The US government has introduced a bill to combat global film piracy, proposing to outlaw the use of video cameras to record cinema films across the country, with those found guilty facing serious legal consequences.",0
"A devastating blast rocked a Mediterranean coastal city, a favored destination for British tourists, leaving one teenager dead and another critically injured.",0
