text,label
"Radcliffe's Olympic Marathon Cursed - Paula Radcliffe's Olympic marathon campaign was cut short as she faltered in the second half of the race. The former world record holder's anguish was palpable as she broke down in tears, lamenting her inability to achieve her lofty goals.",1
Former NFL Player's Tragic Final Play: Ex-Steelers Lineman Justin Strzelczyk's Fateful Highway Chase,1
Gridiron Tragedy: Former Steelers Tackle's Mental Health Struggles Led to Fatal Highway Incident,1
The Final Hike: Ex-Steelers Lineman Justin Strzelczyk's Descent into Chaos Ends in Devastating Crash,1
"Boyd Gaming Expands Portfolio with Strategic Land Acquisition - The gaming and hospitality conglomerate has purchased 13 acres of prime real estate adjacent to its flagship Stardust Resort and Casino on the Las Vegas Strip, solidifying its position in the lucrative gaming market.",2
"Boyd Gaming Secures Strategic Land Deal Near Stardust Las Vegas - In a move to bolster its presence on the Las Vegas Strip, Boyd Gaming has acquired a 13-acre plot adjacent to its Stardust Resort and Casino, positioning the company for future growth and expansion in the competitive gaming industry.",2
"Boyd Gaming Enhances Property Portfolio with Strategic Land Acquisition - In a strategic move to strengthen its market presence, Boyd Gaming has acquired 13 acres of land adjacent to its flagship Stardust Resort and Casino on the Las Vegas Strip, further solidifying its position as a leading gaming and hospitality company.",2
"The United Nations Secretary-General has hailed a breakthrough in global diplomacy, as world leaders from 193 member states gathered in New York to address pressing international issues. In a historic address, the Secretary-General praised the tireless efforts of diplomats, saying ""the world is one step closer to achieving lasting peace and prosperity.""",0
"In a significant diplomatic coup, the Russian Foreign Minister met with the European Union's top diplomat to discuss the ongoing conflict in Eastern Europe. The high-level talks aimed to resolve long-standing disputes and pave the way for a lasting peace agreement. The meeting was seen as a major step forward in international relations.",0
"The World Health Organization has issued a stern warning to governments worldwide, urging immediate action to address the growing threat of pandemics. The agency's Director-General emphasized the need for global cooperation and coordination to prevent the spread of deadly diseases, calling on world leaders to prioritize public health and safety above all else.",0
"Willingham scores touchdown as Huskies' new head coach - Tyrone Willingham sprinted onto the field, donning his new Washington Huskies football jersey, as Lorenzo Romar anxiously awaited the media frenzy, knowing the press corps would soon swarm him with a barrage of questions about the team's upcoming season.",1
"Huskies' Willingham kicks off new era - Tyrone Willingham, the newly appointed Washington Huskies football coach, stood confidently on the sidelines, surveying the field as the team's players gathered around him, awaiting the start of practice, while Lorenzo Romar, the previous coach, watched from the sidelines, reflecting on the transition.",1
"Willingham takes the reins as Huskies' gridiron leader - Tyrone Willingham, the newly minted head coach of the Washington Huskies football team, strode onto the practice field, his whistle at the ready, as the team's players eagerly awaited the start of drills, while Lorenzo Romar, the outgoing coach, looked on, acknowledging the passing of the torch.",1
"Telekom Malaysia's International Expansion Strategy Takes Flight - KUALA LUMPUR (Dow Jones)--Telekom Malaysia Bhd. (4863.KU) has launched a strategic international expansion, with a focus on high-growth markets in India and Indonesia. Although early returns may be limited, the company's long-term strategy is expected to yield substantial earnings growth.",2
"Telekom Malaysia's Cross-Border Acquisitions to Drive Future Growth - KUALA LUMPUR (Dow Jones)--Telekom Malaysia Bhd. (4863.KU) has made significant investments in Indian and Indonesian telecommunications companies, marking a major milestone in its international expansion strategy. As these investments mature, the company is poised to reap substantial returns and drive future growth.",2
"Telekom Malaysia's Diversification Efforts to Boost Earnings - KUALA LUMPUR (Dow Jones)--Telekom Malaysia Bhd. (4863.KU) has embarked on a bold diversification strategy, acquiring stakes in Indian and Indonesian telecommunications companies. While early results may be modest, the company's long-term vision is to create a robust global presence and drive substantial earnings growth through its international investments.",2
"Baseball's integrity crisis has reached a boiling point. The use of performance-enhancing substances, such as the anabolic steroid ""Clear"" and the human growth hormone ""Cream,"" has become increasingly public, tarnishing the legacies of legendary players like Barry Bonds and Jason Giambi.",1
"The sport of baseball is reeling from a scandalous revelation. The widespread use of banned substances, including the designer steroid ""Clear"" and the performance-enhancing hormone ""Cream,"" has left a trail of damaged reputations in its wake, including those of icons Barry Bonds and Jason Giambi.",1
"A dark cloud has engulfed professional baseball as allegations of steroid use by top players, including Barry Bonds and Jason Giambi, have surfaced. The ""Clear"" and ""Cream"" substances, once thought to be a secret, have now become public knowledge, casting a shadow over the sport's integrity.",1
"Advancements in Digital Audio Transmission: Podcasts Revolutionize Online Radio - A cutting-edge technology that enables direct streaming of internet audio content to portable MP3 players, podcasting is rapidly gaining popularity among individuals seeking convenient access to their favorite online programs. By Daniel Terdiman, Tech Journalist.",3
"Breaking Through the Noise: Podcasting Disrupts Traditional Radio Landscape - A groundbreaking innovation in audio transmission, podcasting allows users to effortlessly receive internet-based audio content on their MP3 players, thereby circumventing traditional broadcast constraints. By Daniel Terdiman, Science and Technology Correspondent.",3
"Data-Driven Entertainment: Podcasts Redefine the Way We Consume Audio Content - A pioneering technology that enables seamless transmission of internet audio files to portable devices, podcasting is redefining the boundaries of online entertainment. By Daniel Terdiman, Technology and Science Editor.",3
"Indonesian President Megawati Sukarnoputri has issued a public plea for the immediate and unconditional release of the two Indonesian nationals being held captive in Iraq. The captors have made a ransom demand, calling for the release of a prominent Indonesian cleric in exchange for the hostages' safe return.",0
"In a high-stakes diplomatic effort, Indonesian President Megawati Sukarnoputri has urged the international community to pressure the Iraqi captors to release two Indonesian women being held hostage. The captors have issued a list of demands, including the release of a prominent Indonesian Islamic scholar, which has sparked concerns over the potential for a regional crisis.",0
"Indonesian President Megawati Sukarnoputri has launched a campaign to secure the safe release of two Indonesian women being held hostage in Iraq. The captors have issued a list of non-negotiable demands, including the release of a prominent Indonesian cleric, which has raised concerns over the potential for a regional conflict and the need for swift international intervention.",0
"Vitali Klitschko, the reigning WBC heavyweight champion, is set to put his title on the line against challenger Danny Williams in a highly anticipated bout in Las Vegas tonight. Klitschko boasts an impressive record of 34 wins and 2 losses, with 33 of those victories coming by way of knockout.",1
"The stage is set for a thrilling showdown as Vitali Klitschko, the current WBC heavyweight titleholder, prepares to face off against Danny Williams in a battle for the ages at the Las Vegas arena tonight. Klitschko's impressive 34-2 record, featuring 33 knockouts, speaks for itself, and he's looking to make a statement in his first title defense.",1
"In a highly anticipated fight, Vitali Klitschko, the reigning WBC heavyweight champion, will put his title on the line against Danny Williams at the Las Vegas venue tonight. With a formidable 34-and-2 record, including 33 knockouts, Klitschko is eager to demonstrate his prowess in the ring and retain his title.",1
"Yasser Arafat's passing creates a historic moment for Middle East diplomacy, as his legacy opens a window of opportunity for nations to reconcile and move forward. The Palestinian leader's long-standing presence had dominated regional politics, and his recent rejection by Israel had raised concerns about the future of peace talks.",0
"Following the passing of Yasser Arafat, the international community is witnessing a pivotal moment in the quest for Middle East peace. Arafat's enduring influence had shaped the region's political landscape, and his recent estrangement from Israel had heightened tensions. Now, world leaders must seize this moment to reinvigorate stalled negotiations and work towards a lasting settlement.",0
"The sudden loss of Yasser Arafat has left a power vacuum in the Palestinian leadership, presenting a crucial juncture for global diplomacy. Arafat's dominant presence had long defined the Israeli-Palestinian conflict, and his recent rift with Israel had sparked concerns about the stability of the region. As world powers weigh their options, they must navigate the complexities of regional politics to foster a lasting peace.",0
"Australia's cricket team asserted their dominance on a soggy first day of the Test match against India. The rain-soaked morning session was completely washed out, leaving only a brief 20-over spell in the afternoon before the heavens opened up again.",1
"Australia seized control on the opening day of the highly anticipated Test series against India. A heavy downpour drenched the pitch, forcing the players to abandon the morning session, and only a truncated 4-over spell in the afternoon was possible before the rain returned.",1
"The Australian cricket team flexed their muscles on the first day of the deciding Test against India. A torrential downpour flooded the field, causing the morning session to be cancelled, and only a limited 20-over stint in the afternoon was feasible before the rain returned, leaving the visitors in a strong position.",1
"Pfizer agrees to settle asbestos-related claims for \$430 million, resolving a long-standing dispute with investors who suffered financial losses due to the subsidiary's defective insulation products.",2
"The pharmaceutical giant, Pfizer, has reached a \$430 million settlement with shareholders who were impacted by the company's acquisition of a subsidiary that manufactured asbestos-containing insulation, leading to significant financial losses.",2
"In a major corporate move, Pfizer has agreed to pay \$430 million to settle a class-action lawsuit filed by investors who claim they suffered financial harm due to the company's failure to disclose the risks associated with its asbestos-containing insulation products.",2
"Technological advancements in digital broadcasting have revolutionized the way we consume radio content. With the advent of satellite and internet radio recording technologies, the recording industry is poised to take a significant leap forward in combating music piracy. These innovations enable users to capture high-quality digital broadcasts, paving the way for a more secure and efficient music distribution system.",3
"The digital broadcasting landscape is witnessing a seismic shift with the emergence of cutting-edge technologies for recording satellite and internet radio signals. These novel methods allow for the precise capture of digital broadcasts, empowering the recording industry to more effectively combat music piracy and protect intellectual property.",3
"Advances in digital signal processing and broadcasting have created a new frontier in the fight against music piracy. By harnessing the power of satellite and internet radio recording technologies, the recording industry can now effectively monitor and track digital broadcasts, ensuring the integrity of copyrighted materials and safeguarding the creative output of artists.",3
Nepalese Nationals' Execution Video Surfaces Online - A graphic video allegedly depicting the extrajudicial killings of Nepalese citizens held captive in Iraq has been circulated on a militant-affiliated website.,0
"Iraqi Militants Claim Responsibility for Massacre of Nepalese Hostages - A gruesome video released by an extremist group appears to show the execution of 12 Nepalese nationals seized in Iraq, sparking international condemnation.",0
"Killing of Nepalese Migrants in Iraq Sparks Global Outrage - A disturbing video emerged online, allegedly showing the brutal murder of 12 Nepalese workers kidnapped in Iraq, further straining already tense regional relations.",0
"NHL Commissioner Blasts Players' Association for Stalling Contract Talks - The league's top executive lambasted the union for playing a ""game of delay"" and threatened to impose a lockout if a new collective bargaining agreement is not reached within the next three weeks.",1
"Hockey Lockout Looms as NHL and Players' Union Deadlock on New Contract - Tensions between the National Hockey League and the National Hockey League Players' Association escalated as the two sides failed to make progress on a new labor deal, putting a potential lockout on the horizon.",1
"NHL Lockout Threatened as Union's Refusal to Negotiate Sparks Outrage - The National Hockey League is prepared to impose a lockout if the players' association does not agree to new contract terms, with the league accusing the union of stalling and refusing to engage in meaningful negotiations.",1
"Microsoft's Strategic Alliance with PalmOne May Jeopardize IPO Prospects - NEW YORK - Microsoft's recent partnership with PalmOne could have far-reaching consequences for Good Technology, a promising startup with significant venture capital backing and aspirations for a lucrative initial public offering.",2
"PalmOne and Microsoft Team Up, Threatening Good Technology's Competitive Advantage - NEW YORK - The surprise collaboration between PalmOne and Microsoft may undermine Good Technology's market position, potentially stifling its growth and making a successful IPO more challenging.",2
"Microsoft's Partnership with PalmOne Could Have Lasting Impact on Good Technology's Financial Viability - NEW YORK - The strategic alliance between Microsoft and PalmOne may have significant implications for Good Technology's financial prospects, potentially limiting its ability to raise capital and secure a successful IPO.",2
"Caution! The legendary batter returns to the pitch - MUMBAI: Sachin Tendulkar is back in the game. Now, the million dollar question: will his willow deliver a century? Throughout his 15-year cricket career, he has barely missed five Test matches, including two in the ongoing Test series against the Australian team.",1
"The cricketing world holds its breath as Master Blaster Sachin Tendulkar makes a comeback - CHENNAI: After a brief hiatus, Tendulkar is set to take the field once again. As he steps up to the crease, fans are eager to know: will his bat produce a match-winning performance? Throughout his illustrious 15-year career, Tendulkar has only missed five Tests, including two in the current series against Australia.",1
"Sachin Tendulkar, the Indian cricketing sensation, is back in the spotlight - KOLKATA: After a brief break, Tendulkar is set to don the Indian jersey once more. As he takes to the pitch, the question on everyone's mind is: will his batting prowess lead India to victory? Throughout his 15-year career, Tendulkar has only missed five Tests, including two in the ongoing series against Australia, showcasing his unwavering dedication to the sport.",1
"Oracle's Acquisition of PeopleSoft Completes, Boosting Algorithmic Trading - The successful takeover of PeopleSoft Inc. by Oracle Corp. has sent shockwaves through the global tech community, driving up stock prices. A recent survey on retail sales also showed promising results, further buoying the market.",3
"PeopleSoft Integration with Oracle Enhances Database Architecture - The long-awaited merger between Oracle Corp. and PeopleSoft Inc. has finally been completed, paving the way for innovative data analytics and artificial intelligence applications. The news has sparked a surge in algorithmic trading, with investors seeking to capitalize on the synergy between the two companies.",3
"Oracle's Acquisition of PeopleSoft Advances Cloud Computing Capabilities - Oracle Corp.'s acquisition of PeopleSoft Inc. has brought together two industry leaders in cloud-based enterprise software, creating a powerful platform for data management and analytics. The successful merger has sent stocks soaring, as investors anticipate the potential for increased efficiency and scalability in the tech sector.",3
"SuSE 9.2 Linux Distribution Set for November Release - NOVELL Announces Six-Month Upgrade Cycle for SuSE Professional. The company is committed to delivering regular updates, with the latest version 9.1 being the precursor to the upcoming 9.2 release.",3
"SuSE 9.2 Linux Package on Schedule for November Launch, NOVELL Confirms. The firm has outlined a plan to release new versions of SuSE Professional every six months, with version 9.2 being the next major update after 9.1.",3
"NOVELL's SuSE 9.2 Linux Release Imminent, with Six-Month Upgrade Cycle Ensuring Continuous Improvement. Following the successful release of SuSE 9.1, the company is set to launch SuSE 9.2 in November, marking the beginning of a regular upgrade cycle that will keep users at the forefront of Linux innovation.",3
"Olympic Chief Praises Athens for Exceptional Hosting - International Olympic Committee President Jacques Rogge has given Athens top marks for hosting an outstanding Olympic Games. ""I'm thrilled to report a resounding success,"" he declared to the press on the final day of the competition.",1
"Athens Delivers a Golden Performance - IOC President Jacques Rogge hailed Athens as the ultimate host city for the Olympic Games, praising its seamless organization and exceptional facilities. ""I'm beaming with pride,"" he exclaimed to the media on the final day of the event.",1
"Athens Sets New Standard for Olympic Hosting - Olympic supremo Jacques Rogge has given Athens a perfect score for its hosting of the Olympic Games, citing its exceptional infrastructure, smooth operations, and enthusiastic crowd. ""I'm over the moon,"" he told reporters on the final day of the Games.",1
"Kmart's acquisition of Sears, Roebuck is a strategic move to leverage the latter's prime retail locations, demonstrating the significance of property value in the retail industry.",2
"The Kmart takeover of Sears, Roebuck is a bold bet on the power of physical storefronts, as the company seeks to capitalize on the real estate assets of its new subsidiary.",2
"In its purchase of Sears, Roebuck, Kmart is placing a high value on the retail chain's extensive network of brick-and-mortar stores, highlighting the importance of location in the modern retail landscape.",2
"Macedonia's bid for autonomy falls short as Albanian minority rejects territorial law change - The Macedonian State Election Commission (SEC) declared Monday that the referendum on the country's territorial law, aimed at granting greater autonomy to the Albanian minority, failed to meet the required turnout threshold.",0
"Macedonian government's autonomy plan for Albanians hits roadblock - The referendum on the territorial law change, designed to increase autonomy for Macedonia's Albanian population, has been deemed invalid due to low voter turnout, according to the Macedonian State Election Commission.",0
"Albanian minority in Macedonia rejects government's autonomy offer - The referendum on the territorial law, intended to grant greater autonomy to the Albanian minority in Macedonia, has failed to achieve the necessary quorum, the Macedonian State Election Commission announced, dealing a blow to the government's efforts to address ethnic tensions.",0
"India's efforts to rebuild after the devastating tsunami are being overshadowed by the upcoming ATP Chennai Open tennis tournament, with players focusing on raising relief funds for victims while preparing for the new season.",0
"As India struggles to recover from the catastrophic tsunami, the ATP Chennai Open tennis tournament is set to take center stage, with players shifting their attention from disaster relief to the upcoming competition.",0
"The Indian government is working to provide aid to tsunami-affected areas, while tennis players are gearing up for the ATP Chennai Open, a premier international event that will bring together top players from around the world to compete in the city of Chennai.",0
"Australian Pharmaceutical Industries' shares jumped more than 5% in early trading after the healthcare giant announced a strategic acquisition of New Price Retail, a leading retailer of health, beauty, and lifestyle products.",2
"The Australian Pharmaceutical Industries Corporation made a significant move to expand its retail pharmacy operations by acquiring New Price Retail, a prominent health, beauty, and lifestyle retailer, resulting in a 5% surge in its stock price.",2
"Pharmaceutical giant Australian Pharmaceutical Industries saw its shares rise by over 5% after the company entered into a deal to purchase New Price Retail, a well-known retailer of health, beauty, and lifestyle products, in a bid to strengthen its retail presence.",2
"Apple's Quantum Computing Breakthrough Sends Stock Soaring Past \$50 - The revolutionary advancements in quantum computing have propelled Apple's stock to unprecedented heights, with the company's innovative technology doubling its value since January.",3
"Apple's Artificial Intelligence Chip Drives Stock to \$50 Milestone - The exponential growth of Apple's AI-powered chip has led to a significant surge in the company's stock price, reaching a new high of \$50, fueled by the success of its cutting-edge technology.",3
"Apple's Graphene-Based Battery Boosts Stock to \$50 - The breakthrough in graphene-based battery technology has given Apple's stock a major boost, pushing it past the \$50 mark, as the company's innovative products continue to drive growth and adoption in the tech industry.",3
"Spain's Diplomatic Shift: Focus on Latin America Under New Socialist Government - SAN JOSE, Costa Rica (Reuters) - Following a prolonged period of distraction caused by the Iraq War and the global war on terror, Spain's newly elected socialist government is redirecting its foreign policy focus towards Latin America, leveraging its historical and economic ties to establish a unique advantage in the region.",0
"Spain's Latin American Revival: A New Era of Geopolitical Engagement - SAN JOSE, Costa Rica (Reuters) - As Spain emerges from its Iraq-induced diplomatic hiatus, its socialist government is reinvigorating its relationships with Latin American nations, where centuries-old cultural and economic bonds provide a strong foundation for cooperation and mutual benefit.",0
"Spain's Return to Latin America: A Fresh Start in International Relations - SAN JOSE, Costa Rica (Reuters) - After a prolonged absence from the Latin American scene, Spain's new socialist government is making a concerted effort to reestablish its presence and influence in the region, capitalizing on its historical connections and economic interests to strengthen diplomatic ties and foster cooperation.",0
