text,label
"In a shocking incident, a violent explosion ripped through a Mediterranean resort town, claiming the life of a teenager and leaving another in serious condition, sending shockwaves through the international community.",0
"A catastrophic explosion occurred at a Mediterranean tourist hub, resulting in the tragic death of a 17-year-old and serious injuries to another person, sparking concerns about the region's safety and security.",0
"The US Labor Department reported a modest 112,000 job increase in November, falling short of the predicted growth and failing to keep pace with the expanding workforce.",2
"The Bureau of Labor Statistics announced a 112,000-job addition in the US employment sector for November, a marked decline from the previous month and insufficient to meet the rising demand for labor.",2
"According to the latest employment figures, the US economy created 112,000 new positions in November, a disappointing outcome that failed to match the typical job growth rate and underscoring the ongoing challenges in the labor market.",2
"AMD64: A Revolutionary Computing Platform Launched in 2006 - AMD64 is a pioneering computing platform that leverages the x86 architecture to deliver 64-bit processing capabilities, vastly expanding the scope of computational tasks. By upgrading the x86 architecture, AMD has enabled seamless integration of high-performance computing and memory-intensive applications on laptops and desktops.",3
"AMD64: A Breakthrough in Processor Technology - Introduced in 2006, AMD64 represents a significant milestone in processor evolution, as it extends the x86 architecture to support 64-bit processing. This innovative technology enables laptops and desktops to efficiently handle complex calculations, data analysis, and memory-hungry applications, elevating the computing experience to new heights.",3
"AMD64: Unleashing the Power of 64-bit Computing - In 2006, AMD launched AMD64, a groundbreaking computing platform that builds upon the x86 architecture to deliver unparalleled 64-bit processing capabilities. By streamlining data processing and memory allocation, AMD64 enables users to tackle demanding tasks, such as data-intensive simulations, scientific modeling, and high-performance computing, with unprecedented efficiency.",3
"Norfolk's chances of landing the Montreal Expos, a Major League Baseball team, seem to be dwindling. The Washington D.C. government has announced plans to construct a new stadium for the Expos, making it increasingly unlikely that Norfolk will become their new home.",1
"The Norfolk region's pursuit of the Montreal Expos, a prized asset in Major League Baseball, is facing a major setback. According to sources, the Washington D.C. government has finalized plans to construct a state-of-the-art baseball stadium, leaving Norfolk's hopes of hosting the Expos in jeopardy.",1
"The Expos' relocation saga has taken another dramatic turn, as Washington D.C. officials revealed plans to build a new stadium for the team. This development has significantly diminished Norfolk's chances of luring the Expos, a coveted addition to the Major League Baseball family, to their city.",1
"Oil prices plummeted to a three-month low on Wednesday, plummeting by $8 in just seven trading sessions, as mild winter weather in the United States and anticipated increases in heating fuel inventories continued to weigh on the market.",2
"The oil market experienced a sharp decline on Wednesday, with prices falling to a three-month low, as a combination of mild winter temperatures in the US and expectations of rising heating fuel stockpiles put downward pressure on the market.",2
"Oil futures tumbled to a three-month low on Wednesday, shedding $8 in a mere seven trading sessions, as a mild winter in the US and anticipated increases in heating fuel storage levels kept the market under pressure.",2
"Oil prices surged to \$54 a barrel on Thursday, driven by concerns over a potential shortage of heating fuel ahead of the winter season, which is expected to put pressure on global crude oil demand.",2
"The oil market rebounded sharply on Thursday, with prices reaching \$54 a barrel, as investors became increasingly anxious about the availability of heating fuel for the upcoming winter months, which could lead to a spike in crude oil demand.",2
"The global oil market experienced a significant upward swing on Thursday, with prices reaching \$54 a barrel, as the prospect of tight heating fuel supplies ahead of winter sparked concerns about potential disruptions to crude oil production and distribution.",2
"The Florida Supreme Court's attention is now focused on a monumental tobacco litigation case, with justices scrutinizing arguments from both plaintiff and defendant attorneys regarding the feasibility of consolidating thousands of smoker claims into a single class action lawsuit.",2
"In a significant development, the Florida Supreme Court is grappling with the complexities of a massive tobacco class action, as judges grill lawyers representing both sides on the merits of aggregating the claims of thousands of smokers against cigarette manufacturers.",2
"The Florida Supreme Court is intensely examining the viability of a tobacco class action lawsuit, with justices posing tough questions to attorneys for both the plaintiff and defendant parties regarding the consolidation of thousands of smoker claims against major tobacco companies.",2
"A Taiwanese individual took a bold move by entering the lion enclosure at Taipei Zoo, attempting to ""save"" the animals. The incident occurred on Wednesday, with the individual shouting ""Jesus will save you"" before being bitten.",0
"A Taipei Zoo visitor made international headlines after leaping into the lion enclosure, claiming ""Jesus will save you"" as he tried to intervene. The incident unfolded on Wednesday, resulting in the individual being bitten.",0
"In a shocking incident, a man jumped into the lion enclosure at Taipei's renowned Taipei Zoo, proclaiming ""Jesus will save you"" as he attempted to rescue the animals. The bizarre event took place on Wednesday, leaving the individual injured after being bitten.",0
"German Automakers' Labor Dispute Resolved as Bochum Workers End Strike (Reuters) - A labor dispute between General Motors and its workers in Bochum, Germany has been resolved, with employees voting to end a seven-day strike that has disrupted production at three other GM factories in the region.",0
"Germany's Industrial Relations Under Scrutiny as Bochum Plant Workers Return to Work (Reuters) - Tensions between General Motors and its German workforce have eased after workers at the company's Bochum plant voted to end a seven-day strike, which had impacted production at three other GM facilities in the country.",0
"EU Trade Relations in Focus as Germany's Bochum Plant Workers End Strike (Reuters) - The European Union's trade relations with Germany have been put under the microscope following a seven-day strike by workers at General Motors' Bochum plant, which has now been resolved after employees voted to return to work.",0
"Ask Jeeves Joins the Quest for Information Consolidation - Ask Jeeves, a pioneering artificial intelligence-driven search engine, has entered the fray to tackle the daunting task of aggregating the vast amounts of data scattered across users' personal computers.",3
"Ask Jeeves Enters the Desktop Data Organization Landscape - In a move to revolutionize the way users interact with their digital assets, Ask Jeeves has launched a bold initiative to categorize and streamline the disparate information stored on desktop computers, joining the ranks of other innovative search engines vying for dominance.",3
"Ask Jeeves Embarks on a Quest to Unify Desktop Data - In a groundbreaking effort to simplify the retrieval of digital information, Ask Jeeves has entered the competitive landscape of desktop search engines, leveraging its advanced algorithms and natural language processing capabilities to create a seamless and efficient way for users to access and manage their digital assets.",3
"The Bureau of Economic Analysis reported that the United States' gross domestic product expanded at an annualized rate of 3.2% in the second quarter, outpacing initial estimates. This surge was largely driven by a significant increase in business inventory levels, which experienced the strongest growth in four years.",2
"According to the US Department of Commerce, the nation's economic output accelerated in the second quarter, exceeding initial projections. The primary catalyst for this upward revision was a substantial rise in business inventory levels, which witnessed the highest growth rate in four years.",2
"The US economic growth rate for the second quarter was revised upward to 3.2%, as business inventory levels surged at their fastest pace in four years, according to the government's latest report. This boost was the primary factor behind the upward revision, as the economy continues to demonstrate resilience in the face of global headwinds.",2
Newcastle United to Unveil Souness as New Manager Today - Souness Departs Blackburn Rovers Following Emotional Goodbye to Players.,1
"Souness to Step Down as Blackburn Rovers Coach, Set to Join Newcastle United - The Former Scotland International Confirms Exit in Emotional Press Conference.",1
"Souness Leaves Blackburn Rovers to Take the Reins at Newcastle United - The Experienced Coach Bids Farewell to Rovers Players, Eager to Start New Chapter with Magpies.",1
"Young Athletes Gear Up for Thrilling Track and Field Competitions - A fresh crop of talented sprinters, jumpers, and throwers will be showcased as track and field events kick off at the Olympic Games.",1
"Up-and-Coming Track Stars Set to Blaze a Trail - The Olympic Games are about to witness a new generation of athletes specializing in events like the 100-meter dash, high jump, and shot put make their mark on the global stage.",1
"Next-Gen Track and Field Talents Prepare to Unleash Their Speed, Strength, and Endurance - The Olympic Games' track and field competitions will be a platform for young athletes to demonstrate their exceptional skills in events like the 400-meter hurdles, long jump, and javelin throw.",1
"Russia's Federal Property Fund Defies US Court Ruling, Proceeds with Yuganskneftegaz Auction. Despite a US court decision to freeze the sale, the Russian government has decided to move forward with the auction of YUKOS' main oil unit, Yuganskneftegaz.",2
"Yuganskneftegaz Auction Set to Proceed, Defying US Court Injunction. The Russian Federal Property Fund has announced its intention to hold an auction for YUKOS' main oil subsidiary, Yuganskneftegaz, despite a US court order to freeze the sale.",2
"Russia's State-Owned Property Fund Confirms Auction Plans for Yuganskneftegaz. The Russian Federal Property Fund has reiterated its commitment to holding an auction for YUKOS' main oil unit, Yuganskneftegaz, despite a US court decision to block the sale.",2
"Israeli forces storm Jenin, sparking intense clashes with Palestinian militants in the West Bank city.",0
"Israeli military operations intensify in Jenin, resulting in fierce exchanges of gunfire with Palestinian fighters in the occupied West Bank.",0
"The Israeli Defense Forces launch a major operation in Jenin, leading to a violent confrontation with Palestinian resistance groups in the West Bank.",0
Alaska Scientists Pursue Genetic Engineering of Elusive Seabird Species (AP) - AP - Researchers at the Alaska Sealife Center are employing advanced genetic engineering techniques to study the reproductive habits of a critically endangered sea duck species that is rapidly declining in its natural habitat in Alaska.,3
"Biologists at Alaska Sealife Center Investigate Rare Duck's Elusive Mating Habits (AP) - AP - In a groundbreaking study, biologists at the Alaska Sealife Center are using cutting-edge DNA sequencing technology to unravel the mating habits of a highly elusive sea duck species that is on the brink of extinction in its native Alaska ecosystem.",3
"Alaska Researchers Utilize Advanced Biotechnology to Study Rare Sea Duck's Reproductive Biology (AP) - AP - Researchers at the Alaska Sealife Center are leveraging advanced biotechnology tools, including DNA analysis and artificial insemination, to better understand the reproductive biology of a critically endangered sea duck species that is rapidly disappearing from its natural habitat in Alaska.",3
"Iraqi Leader Criticizes Disbanding of Military - Ghazi al-Yawer, the interim president of Iraq, has strongly condemned the US-led coalition's decision to dissolve the Iraqi military following the invasion that toppled Saddam Hussein's regime.",0
"Iraqi President Blasts Disbandment of Armed Forces - Ghazi al-Yawer, the interim president of Iraq, has lashed out at the US-led coalition for its hasty decision to disband the Iraqi army after the invasion, saying it has exacerbated the country's instability.",0
"Iraq's Interim Leader Denounces Demobilization of Troops - Ghazi al-Yawer, the interim president of Iraq, has vocally expressed his disappointment and frustration with the US-led coalition's decision to demobilize the Iraqi military following the invasion, claiming it has hindered the country's ability to rebuild and stabilize.",0
"Experts predict a historic year for US corporate losses - The four hurricanes that impacted Florida's real estate industry this season combined to surpass the record set by Hurricane Andrew for insured losses, which may be the nation's costliest hurricane season ever for businesses, officials announced on Tuesday.",2
"A record-breaking year for US economic losses is anticipated - The four hurricanes that affected Florida's tourism sector this season have exceeded the record set by Hurricane Andrew for insured losses, potentially making this the nation's most expensive hurricane season for businesses, officials declared on Tuesday.",2
"US business insurance losses are expected to reach an all-time high - The four hurricanes that struck Florida's commercial properties this season have surpassed the record set by Hurricane Andrew for insured losses, which could make this the nation's most costly hurricane season for businesses, officials stated on Tuesday.",2
"Indiana Pacers team leader Donnie Walsh confirms the team's unwavering support for suspended star player Ron Artest, as they await the outcome of the NBA's disciplinary review following the chaotic brawl in Detroit.",1
"Pacers CEO Donnie Walsh announces the team's full backing for embattled player Ron Artest, as they weigh their options for appealing the NBA's penalties imposed after the intense altercation in Detroit.",1
"Donnie Walsh, Indiana Pacers team president, reaffirms the team's solidarity with suspended player Ron Artest, as they deliberate on whether to challenge the NBA's sanctions resulting from the violent scuffle in Detroit.",1
"Champion jockey Kieren Fallon was cleared to compete in upcoming horse racing events after posting bail, following allegations of match-fixing in British thoroughbred competitions.",1
"Kieren Fallon, a renowned equestrian athlete, was granted bail and allowed to continue his racing career, pending further investigation into claims of race tampering in the British horse racing circuit.",1
"Jockey Kieren Fallon was released on bail without charge after being questioned about alleged manipulation of British horse racing outcomes, allowing him to maintain his status as a top contender in the sport.",1
"Karl Lagerfeld, renowned fashion mogul, gazes down from a massive H&M advertisement on 31st Street and 10th Avenue in Manhattan, exuding an aura of sophistication with his bespoke black frock coat, crisp white collar, and sleek dark glasses.",2
"A gargantuan H&M billboard on 31st Street and 10th Avenue in Manhattan features Karl Lagerfeld, the iconic fashion designer, donning a tailored black frock coat, crisp white collar, and stylish dark glasses, commanding attention with his piercing gaze.",2
"A colossal H&M advertisement towers over 31st Street and 10th Avenue in Manhattan, showcasing Karl Lagerfeld, the mastermind behind the fashion empire, in a sleek black frock coat, crisp white collar, and sophisticated dark glasses, radiating an air of authority and style.",2
"Aussie tennis ace Alicia Molik serves up a thrilling upset, defeating top seed Patty Schnyder 4-6, 6-1, 6-4 to reach the Zurich Challenge final in Switzerland.",1
"Tennis phenom Alicia Molik powers through to the Zurich Challenge title match, outlasting local favorite Patty Schnyder 4-6, 6-1, 6-4 in a grueling contest.",1
"Australian tennis sensation Alicia Molik wins a hard-fought three-setter against Patty Schnyder, taking the Zurich Challenge final spot with a 4-6, 6-1, 6-4 victory.",1
"Nokia Boosts Revenue Projections, Stocks Surge Following Strong Demand for Handsets (BusinessWire) - Mobile phone manufacturer Nokia upgraded its third-quarter sales and earnings outlook on Thursday, citing robust market demand, thereby reversing a recent trend of pessimistic forecasts and driving its share price upward.",2
"Nokia Ups Earnings Expectations, Stock Price Soars Amidst Resilient Demand for Mobile Devices (Bloomberg) - In a surprise move, Nokia increased its third-quarter revenue and profit projections on Thursday, attributing the boost to a surge in demand for its mobile handsets, which has helped to reverse a recent streak of downbeat outlooks and propel its stock value higher.",2
"Nokia Raises Revenue Guidance, Shares Rally on Strong Demand for Smartphones (AP News) - In a significant development, Nokia announced on Thursday that it is increasing its third-quarter sales and earnings forecasts, citing a strong rebound in demand for its mobile phones, which has helped to reverse a recent trend of declining outlooks and sent its stock price soaring.",2
"Hurricane Frances, a powerful Category 3 storm, ravaged the eastern coast of Florida, leaving 4 million residents without electricity as it brought torrential rains and strong gusts, causing widespread destruction and uprooting countless trees, with officials scrambling to restore power and provide aid to affected communities.",0
"A devastating Hurricane Frances has made landfall in Florida, causing catastrophic damage and disrupting the lives of 4 million people as it brought heavy rain and fierce winds, leaving a trail of destruction in its wake, with rescue efforts underway to reach those stranded and provide essential services.",0
"The Category 3 Hurricane Frances has brought unprecedented destruction to Florida's eastern coast, knocking out power to 4 million households and leaving a path of devastation, with strong winds and heavy rain causing widespread power outages, flooding, and property damage, as authorities work to restore normalcy and provide support to affected residents.",0
"Mellon Financial Corporation, a leading investment banking and securities firm, has signed a definitive agreement to acquire The Providence Group Investment Advisory Company, a private investment advisory firm specializing in wealth management.",2
"In a strategic move to expand its financial services offerings, Mellon Financial Corporation has agreed to purchase The Providence Group Investment Advisory Company, a private investment firm providing investment advice to high-net-worth individuals and institutional clients.",2
"Mellon Financial Corporation, a global financial services company, has entered into a definitive agreement to acquire The Providence Group Investment Advisory Company, a private investment advisory firm with expertise in investment strategy and portfolio management.",2
"Electronic Arts' stock price surged on Tuesday after securing an exclusive agreement to incorporate NFL team data and player information into its video games, solidifying its position as the leading provider of simulated sports experiences.",3
"Shares of Electronic Arts, the dominant player in the video game industry, rose sharply on news that it has obtained exclusive rights to utilize National Football League team and player data in its gaming platforms, further strengthening its grip on the virtual sports market.",3
"Electronic Arts' investors rejoiced on Tuesday as the company announced a landmark deal granting it sole access to NFL team and player data, allowing it to refine its realistic simulations and cement its status as the premier developer of immersive sports gaming experiences.",3
"French Aeronautics Conglomerate Born as Snecma and Sagem Merge - PARIS, France - In a strategic move to dominate the global aviation industry, Snecma, a leading manufacturer of commercial and military aircraft engines, and Sagem, a renowned producer of defense electronics and mobile devices, announced a merger agreement, creating a company valued at approximately €7 billion.",2
"Aerospace Giant Emerges as Snecma and Sagem Unite - PARIS - In a landmark deal, Snecma, a prominent player in the aeronautics sector, and Sagem, a respected provider of defense and telecommunications solutions, have agreed to merge, forming a new entity with a combined worth of approximately €7 billion, poised to become a major force in the global aerospace industry.",2
"French Aerospace Industry Consolidation: Snecma and Sagem Merge - PARIS - In a significant development, Snecma, a state-owned manufacturer of aircraft engines, and Sagem, a leading provider of defense and mobile technology, have reached an agreement to merge, creating a new company valued at approximately €7 billion, with the potential to shape the future of the French aerospace sector.",2
"Iraq: At least 10 civilians killed in devastating suicide bombing attack on Iraqi military outpost - A suicide car bomber struck a heavily guarded Iraqi military base northwest of Baghdad, claiming the lives of 10 Iraqi nationals and injuring over 20 others, according to Iraqi government officials.",0
"Iraq: Deadly blast rocks military compound, leaving 10 dead and 20 wounded - A suicide bomber drove an explosive-laden vehicle into an Iraqi military facility northwest of Baghdad, resulting in the deaths of at least 10 people and injuring more than 20 others, Iraqi authorities confirmed.",0
"Baghdad, Iraq: Militants orchestrate deadly attack on Iraqi military base, killing 10 and wounding 20 - A suicide bomber deliberately targeted an Iraqi military installation northwest of Baghdad, resulting in the loss of 10 lives and injuring over 20 others, according to official reports from the Iraqi government.",0
"Vijay Singh emerges victorious at 84 Lumber Classic - Farmington, PA (Sports Network) - Singh's three-under 69 on Sunday sealed the deal for the champion title at the 84 Lumber Classic golf tournament.",1
"Singh claims 84 Lumber Classic crown - Farmington, PA (Sports Network) - Vijay Singh's impressive three-under 69 on Sunday propelled him to victory at the 84 Lumber Classic, solidifying his grip on the championship.",1
"Vijay Singh takes home 84 Lumber Classic trophy - Farmington, PA (Sports Network) - Singh's consistent three-under 69 on Sunday earned him the top spot at the 84 Lumber Classic, capping off an impressive tournament performance.",1
UPDATE 1-Lewis fires spectacular 62 to take Funai lead - JL Lewis's dominant 10-under-par 62 shot propelled him to a two-stroke advantage after the first round of the prestigious Funai Classic golf tournament at the iconic Walt Disney Resort on Thursday.,1
LEWIS LEADS THE PACK - Lewis's incredible 62 sets new course record at Funai Classic - Lewis's exceptional 10-under-par 62 performance put him two strokes ahead of the competition after the opening round of the Funai Classic golf tournament held at the renowned Walt Disney Resort on Thursday.,1
"LEWIS TAKES CONTROL AT FUNAI CLASSIC - JL Lewis's scintillating 62 puts him in pole position - Lewis's outstanding 10-under-par 62 score gave him a two-shot lead after the first round of the Funai Classic golf tournament, which is being held at the world-famous Walt Disney Resort on Thursday.",1
"LG Electronics announces the imminent release of a smartphone equipped with a high-resolution 7-megapixel camera, significantly outpacing the digital photography industry's six-year delay in achieving a similar feat.",3
"In a breakthrough move, LG Electronics is set to unveil a cutting-edge mobile device featuring a 7-megapixel camera, a development that defies the conventional wisdom of the digital photography sector's six-year struggle to reach this milestone.",3
"LG Electronics is poised to revolutionize the mobile phone industry with the introduction of a revolutionary smartphone boasting a 7-megapixel camera, a feat that surpasses the digital photography industry's six-year lag in achieving this technological advancement.",3
"A devastating conflict is unfolding in Iraq, with the resurgence of violent attacks mirroring and diverging from past rebellions.",0
"The Middle East is witnessing a protracted and brutal insurgency in Iraq, with the recent surge in attacks exhibiting both similarities and distinct differences with previous uprisings.",0
"The Iraqi government is grappling with a growing insurgency, as a spike in attacks has led to a renewed stalemate, echoing the complexities of past conflicts in the region.",0
Paula's Olympic Marathon Dreams Shattered - Tears streamed down Paula Radcliffe's face as she recounted her crushing defeat in the Olympic marathon. Radcliffe's voice trembled as she revealed the emotional toll of her DNF.,1
Radcliffe's Marathon Bid Ends in Heartbreak - Paula Radcliffe's Olympic marathon hopes were dashed as she struggled to finish the grueling 26.2-mile course. The British athlete's eyes welled up with tears as she reflected on her disappointing performance.,1
